word_added,s1,s2,s3,similarity_w,sum_cos
principales,"Una de las partes más visibles del coche es el panel de luminosos del salpicadero. La mayoría de los conductores son conscientes del velocímetro y del medidor de gasolina, pero hay otros elementos que tienen igual o más importancia. El tacómetro, que indica la velocid ad del motor en rotaciones por minuto (RPM).","Pedales o mandos de pie. El Acelerador: se acciona con el pie derecho y su objetivo es regular la entrada de combustible en el motor. Al presionarlo aumenta la potencia y la velocidad, y también el consumo. Cuando no se pisa, el motor sólo recibe combustible para mantenerse en marcha, funcionando al …","Un automóvil es más que eso, ya solo el motor entraña gran complejidad. Sin embargo, hagámoslo simple como el dibujo de un niño. Descubre, en Kilómetros que cuentan, las partes de un coche de forma sencilla y conoce todo el rendimiento que puede ofrecerte tu vehículo. …",0.9989248514175416,2.8672097518324735
aire,"Partes y funcionamiento del aire acondicionado automotriz Condensador del aire acondicionado. El gas que ha sido comprimido pasa a la parte superior del condensador, donde... Filtro deshidratador del aire acondicionado. Mientras tiene lugar el proceso que acabamos de describir, el filtro... Válvula ...",Sistema de aire acondicionado standar para vehículoswww.haddadaire.cl,"El filtro del habitáculo se encarga de filtrar el polvo, el polen y todas las partículas de suciedad del aire antes de que dicho aire fluya limpio y fresco al interior del vehículo. Como cualquier filtro, tiene una capacidad de absorción limitada. En todos los sistemas de aire acondicionado hay un evaporador. En sus láminas se condensa el agua.",0.9984150528907776,2.52468486453334
dirección,Partes del sistema de dirección. El sistema de dirección está formado por una serie de elementos que funcionan coordinados para transmitir el movimiento desde el volante hasta las ruedas. Volante. Elemento circular mediante el cual el conductor controla la trayectoria de las ruedas. Barra de dirección.,"La historia de la dirección discurre paralela a la invención de la rueda y su aplicación al transporte.
En la naturaleza no existen ruedas y de hecho muchas civilizaciones -como las mesoamericanas- nunca llegaron a utilizarlas.
Una posible razón está en el aumento de efectividad asociado al empleo de elementos rotatorios frente a los deslizantes o a cargar directamente el animal. Los animales de tiro disponibles en la Eurasia de la ed…","0 Comentarios. La dirección está formada por varios elementos, los cuales hacen que las ruedas directrices del vehículo se muevan como quiera el conductor. Elementos: Volante; Consiente al conductor mover las ruedas directrices. Columna de dirección; Transfiere el movimiento del volante hasta la caja de engranajes.",0.998383402824402,2.531409858104241
diferentes,"El chasis es el esqueleto de un auto. Puede ser una estructura auto portante, como una cáscara o tipo H (escalera), donde se monta el resto del vehículo. El chasis es la estructura principal donde irán montados todos los componentes del vehículo. Foto de un Chasis Auto portante Subaru. Foto de un tipo escalera Toyota Hilux. Frenos de tambor","Pedales o mandos de pie. El Acelerador: se acciona con el pie derecho y su objetivo es regular la entrada de combustible en el motor. Al presionarlo aumenta la potencia y la velocidad, y también el consumo. Cuando no se pisa, el motor sólo recibe combustible para mantenerse en marcha, funcionando al …","Explicación de las diferentes partes de un automóvil El motor. Empecemos por el motor. Después de todo, esta es la fuente de energía que mueve un automóvil por la carretera. Transmisión. La transmisión, o caja de cambios o tren motriz, permite al conductor cambiar de velocidad. Esto se logra... ...",0.998342514038086,2.889850585054677
motores,Una guía rápida y fácil para explicar todas esas partes de un motor y para qué sirven: Cárter Bomba de aceite Bloque motor Cojinetes Cigüeñal Volante de inercia Biela Bulón Pistón Segmentos Cilindro Bomba de agua Filtro de aceite Culata Válvulas Admisión Filtro de aire Escape,"Cuáles son las partes del motor de un coche. Antes de descubrir las partes que componen el motor de un coche, hay que tener en cuenta que no todos los motores son iguales. En el mercado podemos encontrar motores de combustión interna (diésel y gasolina), eléctricos o híbridos. Como la mayoría de los automóviles que se fabrican y están en circulación son de combustión interna, vamos …",Cómo identificar las partes del motor de un coche. ... Aquí se ubican la mayor parte de los relés y de los fusibles del vehículo –suele haber más en otra caja dentro del habitáculo–. Los ...,0.9983350038528442,2.7779582916378858
potencia,"Pedales o mandos de pie. El Acelerador: se acciona con el pie derecho y su objetivo es regular la entrada de combustible en el motor. Al presionarlo aumenta la potencia y la velocidad, y también el consumo. Cuando no se pisa, el motor sólo recibe combustible para mantenerse en marcha, funcionando al …","La caja de cambios es el mecanismo que permite transformar el giro y potencia del motor en movimiento y fuerza en las ruedas del auto. Esto se logra mediante un complejo sistema de piñones de diferentes tamaños y posiciones, que van acoplándose al sistema del motor. Existen dos tipos de cajas de cambios:","La potencia se refiere a la velocidad con que es aplicada el torque y el motor que aplica esta fuerza.Eso podemos ver en la aceleración, el vehículo más potente acelera por ejemplo de 0 a 100 en el menor tiempo posible. Un ejemplo de potencia es cuando usted empuja un carro de supermercado a lo largo de una cuadra.",0.9982731342315674,2.7941726145723296
esenciales,"Los frenos de disco usan un disco giratorio, que se encuentra entre las pastillas de los frenos montadas sobre calibres para reducir el movimiento del coche. Los frenos de tambor usan zapatas que empujan para afuera para contactar la parte inferior de un cilindro giratorio o tambor. Algunos coches contienen los dos tipos de frenos (un tipo para las ruedas delanteras y otro para las …","En ese sentido, la Dirección General de Tráfico (DGT) ha compartido una nota en la que especifica las cinco partes esenciales que deben limpiarse en un coche para evitar la propagación del ...","Como la mayoría de los automóviles que se fabrican y están en circulación son de combustión interna, vamos a analizar este tipo de motores. Así, un motor de combustión interna consta, de manera simplificada, de: Bloque y cilindros; Pistones; Cigüeñal; Culata y válvulas; Cárter inferior; El bloque del motor y los cilindros",0.9982513189315796,2.9485337099345155
gasolina,"Suele denominarse tapa de cilindros porque es la encargada de encerrarlos y soporta las explosiones que generan. Además, también aloja las válvulas de admisión y escape, las bujías (en motores de gasolina), el árbol de levas que activa las válvulas, los conductos de admisión de aire y combustible y los conductos de escape. Entre la culata y el bloque se encuentra la “junta de culata” …",https://capacitateparaelempleo.orgLink original: https://capacitateparaelempleo.org/pages.php?r=.tema&tagID=1753&load=3052&n=0Elementos de los que se compone...,"Partes del sistema de alimentación de gasolina Tanque o depósito de combustible Es el depósito o alojamiento de combustible, tiene un tapón de drenaje, un orificio respiradero y una tapa de llenado. Un mecanismo indicador de nivel de combustible …",0.9981985092163086,2.905861322956733
mantenimiento,El automóvil está formado por las siguientes partes: Estructura metálica: Conjunto estructural sobre el que se van montando el resto de componentes del vehículo. Carrocería: Destinada a transportar y proteger a los pasajeros y carga. Motor: Generador de potencia que produce el movimiento para ...,"En este artículo se explican estos mantenimientos o desgastes; aceite y filtro del motor, líquido de refrigeración, filtro de aire, filtro de combustible, correa de distribución (¿bomba de agua?), batería, bujías de encendido y bujías de precalentamiento.","Deben revisarse siempre que el vehículo entre al taller para su mantenimiento. FILTROS DE HABITÁCULO. Si el resto de los filtros que se montan en un vehículo tienen como fin garantizar la salud del motor del coche, el de habitáculo se ocupa de la de salud de sus ocupantes.",0.9981977939605712,2.877235382534101
chasis,"El freno de tambor es un dispositivo que realiza el frenado del vehículo por fricción. Dicha fricción se produce entre la superficie interior de un cilindro denominado tambor, que gira mecánicamente unido a la rueda, y las zapatas, que permanecen fijas sobre un soporte solidario al chasis del vehículo.","Descubre cómo está hecho el chasis de un carro, en las partes de un carro descubre porque son tan importantes y la forma que les hace resistentes. Los Automó...","Existen dos tipos de chasís para la fabricación de vehículos: chasís independiente, -bien sea de bastidor, central o híbrido- y chasís autoportante o monocasco. En ambos casos el chasís sostiene la mayor parte del vehículo, la masa suspendida, que incluye el motor, la transmisión, la carrocería, el sistema de escape y la caja de dirección. El chasís es considerado como el componente más significativo de un automóvil. Es el elemento fundamental que da fortaleza y estabilidad al vehículo. Es una parte importa…",0.9981755018234252,2.9265865945701757
elementos,"Las ruedas son los elementos sobre los que se apoya el automóvil y las encargadas de dirigir, propulsar o detener el mismo.","Generalmente se utilizan elementos como resortes, amortiguadores hidráulicos, ballestas metálicas, entre otros elementos. La disposición de estos elementos y su configuración otorga al vehículo características especiales, como suavidad, capacidad de carga, maniobrabilidad y estabilidad. Ver la Suspensión Mcpherson",El conjunto de componentes del automóvil que unen las ruedas con el chasis se denomina suspensión. Estos resortes metálicos y amortiguadores guían a las ruedas en su recorrido y transforman la energía cinética (de baches y cuestas) en calorífica.,0.9981711506843568,2.665873299045813
todas,Partes de un coche Motor Neumáticos Chasis Carrocería Parabrisas Asientos Tapicería Cuadros de mando,"El chasis es el esqueleto de un auto. Puede ser una estructura auto portante, como una cáscara o tipo H (escalera), donde se monta el resto del vehículo. El chasis es la estructura principal donde irán montados todos los componentes del vehículo. Foto de un Chasis Auto portante Subaru. Foto de un Chasis tipo escalera Toyota Hilux. Frenos de tambor",Cadena de transmisión sellada; Caja de aire; Caja de cambios; Calandra; Calavera (automóvil) Cámara de combustión de cinco techos; Capó; Carburador; Carga motor; Carputer; Cárter; Centralita electrónica; Chip de potenciación; Ciclo Otto; Cierre centralizado; Cigüeñal; Cinturato Pirelli; Climatización en vehículos; Colector de admisión; Colector de escape; Common-rail,0.998153805732727,2.865690718786258
dentro,Partes de un coche Motor Neumáticos Chasis Carrocería Parabrisas Asientos Tapicería Cuadros de mando,"Tablero de instrumentos: se sitúa debajo del parabrisas, y es una serie de luces de diferentes colores que le informan de las distintas actuaciones o situaciones del propio vehículo. Asimismo, dispone de aparatos de mediciones como el velocímetro o indicador de velocidad.",@juangangelEl primer automóvil con motor de combustión interna se atribuye a Karl Friedrich Benz en la ciudad de Mannheim en 1886 con el modelo Benz Patent-M...,0.9981107711791992,2.9102929217408477
fabricación,"La fabricación de automóviles se refiere a la producción industrial de vehículos automóviles en fábricas habilitadas para ello. Es una de las etapas indispensables de la industria automotriz, junto a la comercialización. La fabricación de automóviles requiere un capital humano y financiero muy importante. Dependiendo del tipo de vehículo, la cantidad de unidades a fabricar por día y el emplazamiento de la …","Y, la fase final del proceso de producción de un automóvil se trata de que el vehículo pase por un banco de pruebas donde se le harán valoraciones: Eléctricas ; Mecánicas; Pruebas de lluvia para detectar entradas de agua. Comprobación de aceleración y frenado. Respuesta de amortiguadores y …","La fabricación de un coche se divide, fundamentalmente, en cuatro etapas: prensado, chapistería, pintura y montaje. Vamos a repasar lo que se hace en cada una de estas cuatro etapas. ¿Sabías que en las dos primeras apenas intervienen personas?",0.9980614185333252,2.8877996893902487
cilindros,"Pedales o mandos de pie. El Acelerador: se acciona con el pie derecho y su objetivo es regular la entrada de combustible en el motor. Al presionarlo aumenta la potencia y la velocidad, y también el consumo. Cuando no se pisa, el motor sólo recibe combustible para mantenerse en marcha, funcionando al …","El bloque del motor y los cilindros El bloque es una única pieza de hierro o aluminio que aloja los cilindros, los conductos para el líquido refrigerante y el aceite y el cigüeñal. Es, por tanto, la principal pieza estructural del motor.","En algunos motores el cilindro es constituido por una ""camisa"" que no es más que un tubo cilíndrico colocado en el bloque del motor y que posibilita la circulación de agua en su vuelta, así como una fácil sustitución en caso de desgaste.",0.998055934906006,2.7902678592267667
funcionamiento,"Su misión es orientar las ruedas directrices (delanteras) en función de la trayectoria a seguir. El piñón gira con el eje de la dirección y mueve una cremallera por medio de rótulas y bieletas, lo que disminuye el esfuerzo del conductor para mover las ruedas directrices y orientar el vehículo.",@juangangelEl primer automóvil con motor de combustión interna se atribuye a Karl Friedrich Benz en la ciudad de Mannheim en 1886 con el modelo Benz Patent-M...,"Descubre las partes de un coche de forma sencilla y conoce todo el rendimiento que puede ofrecerte tu vehículo. ¡Entra! Si a un niño le pides dibujar un coche, rápidamente trazará los círculos que forman los neumáticos, la forma de la carrocería, las lunas y, en algunos casos, las puertas o …",0.998049020767212,2.979227935641856
conjunto,"No existe cuando forma un solo conjunto el motor, caja de cambios y eje motriz. – El eje motriz (par cónico-diferencial) El eje motriz, también llamado puente motriz, puede estar situado en la: o Parte delantera (vehículo de tracción delantera). o Parte trasera del vehículo (vehículo de propulsión trasera).","El chasis es el esqueleto de un auto. Puede ser una estructura auto portante, como una cáscara o tipo H (escalera), donde se monta el resto del vehículo. El chasis es la estructura principal donde irán montados todos los componentes del vehículo. Foto de un Chasis Auto portante Subaru","Es el conjunto de sistemas que interactuando entre si lo componen. Básicamente, un automóvil se compone de motor, chasis y trasmisión.",0.9980111122131348,2.767289093268793
combustible,"Si tomamos como referencia un motor de combustión interna es sencillo visualizar cinco divisiones: el bloque, el cárter inferior, los cilindros, la culata y el cigüeñal. El bloque de motor es una pieza de hierro o aluminio que aloja los cilindros y sirve de soporte de apoyo para el eje del cigüeñal.","Pistones y cigüeñal La combustión que se genera en el interior del motor de un coche varía de de un motor a gasolina a otro que funciona con gasóleo. En el primero, una chispa generada por la bujía provoca la explosión de la mezcla de combustible y aire que, a su vez, mueve ubicados en el interior de los cilindros.",Especialista de la marca DFSK Glory menciona las partes más importantes de un automóvil para el conocimiento de los usuarios.,0.9980074167251588,2.8067851855959622
bloque,"Bloque motor de fundición, seccionado (en gris) de un motor antiguo de automóvil. El bloque del motor, bloque motor, bloque de cilindros o monoblock es una pieza fundida en hierro o aluminio que aloja los cilindros de un motor de combustión interna así como los soportes de apoyo del cigüeñal.",Partes de un bloque de motor Tapa de cilindros. La tapa de cilindros es la parte superior del motor. Las cavidades de los cilindros están en dicha... Puertos de escape. El típico motor de un automóvil y un camión pequeño es un motor de cuatro tiempos. Eso …,"La culata, tapa de cilindros, cabeza del motor o tapa del bloque de cilindros es la parte superior de un motor de combustión interna que permite el cierre de las cámaras de combustión.",0.9979596138000488,1.6691596985539665
sistemas,"El VIN es el Número de Identificación Vehicular o número de chasis de un automóvil. Es único para cada vehículo y queda grabado en algunas partes del mismo (en la parte inferior del parabrisas del conductor, en el chasis de la rueda delantera, en el marco de la puerta del conductor o en el motor del carro).","El coche utiliza distintos sistemas que funcionan de manera simultánea. Conocer estas partes básicas facilita la detección de problemas, ayuda a realizar reparaciones básicas y a conducir más responsablemente. El motor. Cada coche consta de un motor y gran parte de ellos usan un motor de combustión interna que opera con gasolina.","El automóvil utiliza distintos sistemas que funcionan de manera simultánea, por lo que conocer estas partes básicas no solo facilita la detección de problemas, sino también ayuda a realizar ...",0.9979568719863892,2.3575774085368093
través,"Su misión es orientar las ruedas directrices (delanteras) en función de la trayectoria a seguir. El piñón gira con el eje de la dirección y mueve una cremallera por medio de rótulas y bieletas, lo que disminuye el esfuerzo del conductor para mover las ruedas directrices y orientar el vehículo.",El conjunto de componentes del automóvil que unen las ruedas con el chasis se denomina suspensión. Estos resortes metálicos y amortiguadores guían a las ruedas en su recorrido y transforman la energía cinética (de baches y cuestas) en calorífica.,"El chasis es el esqueleto de un auto. Puede ser una estructura auto portante, como una cáscara o tipo H (escalera), donde se monta el resto del vehículo. El chasis es la estructura principal donde irán montados todos los componentes del vehículo. Foto de un Chasis Auto portante Subaru. Foto de un Chasis tipo escalera Toyota Hilux. Frenos de tambor",0.9979392290115356,2.7720117539342843
manera,"El automóvil utiliza distintos sistemas que funcionan de manera simultánea, por lo que conocer estas partes básicas no solo facilita la detección de problemas, sino también ayuda a realizar ...","El coche utiliza distintos sistemas que funcionan de manera simultánea. Conocer estas partes básicas facilita la detección de problemas, ayuda a realizar reparaciones básicas y a conducir más responsablemente. El motor. Cada coche consta de un motor y gran parte de ellos usan un motor de combustión interna que opera con gasolina.","El VIN es el Número de Identificación Vehicular o número de chasis de un automóvil. Es único para cada vehículo y queda grabado en algunas partes del mismo (en la parte inferior del parabrisas del conductor, en el chasis de la rueda delantera, en el marco de la puerta del conductor o en el motor del carro).",0.9979068040847778,2.3575774085368093
control,"Su misión es orientar las ruedas directrices (delanteras) en función de la trayectoria a seguir. El piñón gira con el eje de la dirección y mueve una cremallera por medio de rótulas y bieletas, lo que disminuye el esfuerzo del conductor para mover las ruedas directrices y orientar el vehículo.","El ECU, conocido también como la Unidad de Control del Motor, es el cerebro del auto. Este dispositivo controla el nivel de combustible que se suministra al motor, el aire, el punto de ignición, la apertura de válvulas, el turbocompresor, entre otros.","Los cambios se colocan en el centro del vehículo. Por lo general, un conductor usa su mano izquierda para controlar el pomo del engranaje, los autos modernos son modelos de 5 marchas. Las posiciones de los cambios, especialmente 1 – 4 deben ser conocidas por el nuevo conductor que ha optado por usar un automóvil mecánico. Ajuste del asiento",0.9979004263877868,2.940157876595519
combustión,"Pedales o mandos de pie. El Acelerador: se acciona con el pie derecho y su objetivo es regular la entrada de combustible en el motor. Al presionarlo aumenta la potencia y la velocidad, y también el consumo. Cuando no se pisa, el motor sólo recibe combustible para mantenerse en marcha, funcionando al …","La división primera y fundamental de un motor de combustión: Empezando por la culata, en la mayoría de los motores de combustión en ella se encuentra el árbol de levas, los balancines con sus correspondientes emujadores (taques) y varillas empujadoras , válvulas (admisión y escape), las entradas y salidas hacia los colectores de admisión y escape respectivamente.","Motor de combustión interna y sus partes El bloque motor Es lo que solemos denominar motor coche, y el resto de elementos van conectados a él. La combustión se... La culata La culata o cabeza del motor realiza la función de servir de soporte a …",0.9978732466697692,2.6924987898130315
posible,"Pedales o mandos de pie. El Acelerador: se acciona con el pie derecho y su objetivo es regular la entrada de combustible en el motor. Al presionarlo aumenta la potencia y la velocidad, y también el consumo. Cuando no se pisa, el motor sólo recibe combustible para mantenerse en marcha, funcionando al …","El chasis es el esqueleto de un auto. Puede ser una estructura auto portante, como una cáscara o tipo H (escalera), donde se monta el resto del vehículo. El chasis es la estructura principal donde irán montados todos los componentes del vehículo. Foto de un Chasis Auto portante Subaru. Foto de un Chasis tipo escalera Toyota Hilux. Frenos de tambor","El coche es la herramienta de trabajo para muchos de nosotros. Tanto para conductores que utilizan su vehículo como medio de transporte constante como para los que están al otro lado y se dedican a tener nuestro coche siempre listo, mecánicos, ingenieros, etc. Por ello, tanto para unos como para otros, es fundamental conocer del coche y saber qué estás tratando.",0.9978697299957277,2.9711039135497455
nuevo,"El VIN es el Número de Identificación Vehicular o número de chasis de un automóvil. Es único para cada vehículo y queda grabado en algunas partes del mismo (en la parte inferior del parabrisas del conductor, en el chasis de la rueda delantera, en el marco de la puerta del conductor o en el motor del carro).",@juangangelEl primer automóvil con motor de combustión interna se atribuye a Karl Friedrich Benz en la ciudad de Mannheim en 1886 con el modelo Benz Patent-M...,Curso Mecánica: Experto en Autopartes | Componentes de un AutomóvilProfesor: Jorge Antonio GuillenVisita la pagina de la cnt: www.confederaciondetalleres.org.mx,0.9978427886962892,2.9461115671234976
información,"Chasis. El chasis es el esqueleto de un auto. Puede ser una estructura auto portante, como una cáscara o tipo H (escalera), donde se monta el resto del vehículo. El chasis es la estructura principal donde irán montados todos los componentes del Foto de un Chasis Subaru. Foto de un Chasis tipo escalera Toyota Hilux.","El cuadro de mandos es el tablero que se posiciona tras el volante del vehículo y que, a través de testigos de colores y gráficas, nos aportará información.","Conducir un auto, mecánico o automático, no es cosa de juego. Así que teniendo en cuenta la importancia que conlleva conocer el vehículo que posees, la Automotora Guillermo Morales te presentará 11 de un automóvil mecánico que todo conductor debe conocer.",0.9978356957435608,2.9190169601891247
suspensión,"Todo sistema de suspensión debe disponer de un conjunto elástico, formado por barras de torsión y otro de amortiguación, ballestas, muelles helicoidales. Además, dispone de otros elementos constructivos, como los etc., y elementos que mejoran indudablemente el comportamiento de la suspensión, como barras estabilizadoras, tirantes de reacción, barras …","La partes de la suspensión delantera son definitivamente las más importantes del sistema. Las partes de la suspensión están compuestas por elementos flexibles, como el muelle de ballesta o helicoidal, la el o y los amortiguadores.","Hay de distintos tipos. Primeramente, necesitamos saber qué es la suspensión, para así poder entender todas sus partes que la componen. La suspensión es una estructura que sirve para absorber los impactos que pueden recibir las llantas ante las imperfecciones del camino, contrarrestando los efectos y así haciendo que nuestro vehículo no reciba daño.",0.9978350400924684,2.7254051914765136
bien,"El VIN es el Número de Identificación Vehicular o número de chasis de un automóvil. Es único para cada vehículo y queda grabado en algunas partes del mismo (en la parte inferior del parabrisas del conductor, en el chasis de la rueda delantera, en el marco de la puerta del conductor o en el motor del carro).",@juangangelEl primer automóvil con motor de combustión interna se atribuye a Karl Friedrich Benz en la ciudad de Mannheim en 1886 con el modelo Benz Patent-M...,Curso Mecánica: Experto en Autopartes | Componentes de un AutomóvilProfesor: Jorge Antonio GuillenVisita la pagina de la cnt: www.confederaciondetalleres.org.mx,0.9978045225143432,2.9461115671234976
