word_added,s1,s2,s3,similarity_w,sum_cos
gravity,"Have a digital brainstorm. Sketchup is a free and very useful tool for visualising your soapbox design.For inspiration, check out the All American Soapbox Derby and Gravity Racing.. Go aero. Even at relatively low speeds, aerodynamics are important. Make sure your design interacts as little as possible with airflow.","28, 2018 - Explore Thomas Salter's board ""Soapbox Cars and Gravity Racers"" on Pinterest. See more ideas about soap box cars, soap box derby cars, pedal cars.",Soapbox Race! (Seifenkiste/ Gravity racer) Auto. Follow. 6 years ago | 58 views. Soapbox Race! (Seifenkiste/ Gravity racer) Report. Browse more videos. Playing next. 1:32. Gravity Games X5 Soapbox race car near …,0.9954614639282227,0.16927178768054316
edición,"Los diseños de carros más increíbles y creativos dirán presente en la capital cuando este sábado 14 de marzo se celebre la tercera edición de Red Bull Soapbox Race, la denominada ""carrera de autos locos"" que se realiza en varios países alrededor del mundo y que en Chile tendrá 35 competidores bajando por una pista donde los pilotos podrán alcanzar más de 40 kilómetros por hora.","Se espera que unas 10 mil personas lleguen este sábado al Parque Metropolitano de Santiago para celebrar la tercera edición del Red Bull Soapbox Race. Esta carrera, que se realiza en varios países del mundo, tendrá a 35 autos locos bajando por una pista donde los pilotos podrán alcanzar velocidades cercanas a los 40 km/h.","En 2020 vuelve uno de los eventos más entretenidos y desafiantes del mundo a Santiago. Tras cuatro años de ausencia, SoapBox Race, que en 2016 se realizó en la comuna de La Reina, regresará durante el primer semestre de 2020 y ya están abiertas las postulaciones para los valientes (y suficientemente locos) que quieran participar. Red Bull Race es un evento abierto al público ...",0.9954094886779785,0.6563388455894816
video,Red Bull Soapbox Croatia 2019 Part 1#mrlowe #redbullsoapboxrace,"La peculiar carrera de Soapbox se realizó por segunda ocasión en Ammán, Jordania. Sesenta participantes usaron su imaginación para construir carros con diseños singulares.","La loca carrera Red Bull Soapbox de Bakú. Empiezo pidiendo disculpas: me prometí a mí mismo que, por mucho miedo que pasara durante la Red Bull Soapbox de Bakú, no iba a decir muchas palabrotas.",0.9953464269638062,0.3404126230868083
participantes,La emocionante carrera de Red Bull Soapbox [fotos] En esta singular carrera participan equipos de adultos con extraños carros fabricados en casa y que funcionan a base de pura gravedad.,"Por segunda vez en Chile, se llevó a cabo el Red Bull Soapbox Race, la emblemática carrera de los “autos locos” que se realiza en distintos países del mundo y que busca convertirse en un divertido panorama de fin de semana. En esta ocasión, el evento tuvo lugar en la región Metropolitana, en la comuna de La Reina.","Competidores participan hoy, en Santiago de Chile, en la segunda versión del Red Bull Soapbox Race, la emblemática carrera de los ""autos locos"" que se …",0.9953211545944214,0.6241556839560426
coches,"Misterio descifrado. Hyundai ha desvelado este lunes las peculiaridades del Hyundai Soapbox racer, su enigmático coche de carreras sin motor que anticipó a …","Soapbox Racer es un juego coches incomparable al que puedes jugar en 1001juegos.com , gratis. A Soapbox Racer han jugado 4,946 personas y se ha puntuado 9.0 de 10 por 78 personas. Soapbox Racer se ha diseñado con HTML5 para funcionar sin problemas en la …","En 2020 vuelve uno de los eventos más entretenidos y desafiantes del mundo a Santiago. Tras cuatro años de ausencia, SoapBox Race, que en 2016 se realizó en la comuna de La Reina, regresará durante el primer semestre de 2020 y ya están abiertas las postulaciones para los valientes (y suficientemente locos) que quieran participar. Red Bull Soapbox Race es un evento abierto al público ...",0.9953144192695618,0.20407442055301983
company,"Headquartered in downtown Toronto, the fastest growing tech hub in North America, Soapbox is a dog-filled, emoji-loving startup that loves to get s*** done. We’re looking for passionate, creative and driven individuals to join our awesome team and help us transform the way managers talk to their employees.","Por segunda vez en Chile, se llevó a cabo el Red Bull Soapbox Race, la emblemática carrera de los “autos locos” que se realiza en distintos países del mundo y que busca convertirse en un divertido panorama de fin de semana. En esta ocasión, el evento tuvo lugar en la región Metropolitana, en la comuna de La Reina.","The Red Bull Soapbox Race is a soapbox race organised by the Red Bull company. First held in 2000, over a hundred races have been held in multiple countries ...",0.9952672719955444,0.30372027326469686
like,"Hyundai ha desvelado este lunes las peculiaridades del Hyundai Soapbox racer, su enigmático coche de carreras sin motor que anticipó a finales …","Por segunda vez en Chile, se llevó a cabo el Red Bull Soapbox Race, la emblemática carrera de los “autos locos” que se realiza en distintos países del mundo y que busca convertirse en un divertido panorama de fin de semana. En esta ocasión, el evento tuvo lugar en la región Metropolitana, en la comuna de La Reina.","En esta peculiar carrera, tendrás que construir tu coche con materiales desechables y diseñar una carretera repleta de trampas, saltos, giros y piruetas. Cuanto más lo compliques, más puntos obtendrás. Siempre y cuando llegues a la meta, claro.",0.9952585697174072,0.0835012823332288
español,La emocionante carrera de Red Bull Soapbox [fotos] En esta singular carrera participan equipos de adultos con extraños carros fabricados en casa y que funcionan a base de pura gravedad.,Hoy os traigo un gameplay de SoapBox Race World jugando con un Toyota Supra en el server de The World Is Ours.¿Cómo Puedes Jugar?: https://www.youtube.com/wa...,Red Bull Soapbox Race: la carrera de ‘autos locos’ que estará este sábado en el Parque Metropolitano,0.9952260255813599,0.31391211102179645
team,UNA CARRERA PARA LOS LOCOS AVENTUREROS. Red Bull Soapbox Race 2020. Parque Metropolitano 14 de Marzo 2020.,About Press Copyright Contact us Creators Advertise Developers Terms Privacy Policy & Safety How YouTube works Test new features Press Copyright Contact us Creators ...,"Team Soapbox is a leading communications and issues advocacy firm that elevates the voice of community issues. We work on timely and important issues that matter to us personally. Because we believe personal passion fuels professional success, each member of the account team chooses to work on projects that interest them.",0.9952013492584229,0.03784665863771959
street,"Por segunda vez en Chile, se llevó a cabo el Red Bull Soapbox Race, la emblemática carrera de los “autos locos” que se realiza en distintos países del mundo y que busca convertirse en un divertido panorama de fin de semana. En esta ocasión, el evento tuvo lugar en la región Metropolitana, en la comuna de La Reina.",In which I discuss street circuits that... are only kind of street circuits. Music by me.,UNA CARRERA PARA LOS LOCOS AVENTUREROS. Red Bull Soapbox Race 2020. Parque Metropolitano 14 de Marzo 2020.,0.9951984882354736,0.18943572378105444
made,La emocionante carrera de Red Bull Soapbox [fotos] En esta singular carrera participan equipos de adultos con extraños carros fabricados en casa y que funcionan a base de pura gravedad.,"Hyundai ha desvelado este lunes las peculiaridades del Hyundai Soapbox racer, su enigmático coche de carreras sin motor que anticipó a finales …","Por segunda vez en Chile, se llevó a cabo el Red Bull Soapbox Race, la emblemática carrera de los “autos locos” que se realiza en distintos países del mundo y que busca convertirse en un divertido panorama de fin de semana. En esta ocasión, el evento tuvo lugar en la región Metropolitana, en la comuna de La Reina.",0.9951580762863159,0.15356749264194136
evento,"En 2020 vuelve uno de los eventos más entretenidos y desafiantes del mundo a Santiago. Tras cuatro años de ausencia, SoapBox Race, que en 2016 se realizó en la comuna de La Reina, regresará durante el primer semestre de 2020 y ya están abiertas las postulaciones para los valientes (y suficientemente locos) que quieran participar. Red Bull Soapbox Race es un evento abierto al público ...","La carrera de autos locos Red Bull SoapBox Race inicia su etapa de postulaciones para partcipar con el más creativo, loco y rápido de los autos. En 2020 vuelve uno de los eventos más ...","Eventos. Atletas. Productos. Red Bull Soapbox Race. Red Bull Soapbox Race 2020: Santiago de Chile. 14 Marzo 2020. Santiago, Chile. Más información. Guardar ¡Fotos y videos! Ranking Final",0.9951097369194031,0.7492335124943703
school,La emocionante carrera de Red Bull Soapbox [fotos] En esta singular carrera participan equipos de adultos con extraños carros fabricados en casa y que funcionan a base de pura gravedad.,"The Red Bull Soapbox Race is a soapbox race organised by the Red Bull company. First held in 2000, over a hundred races have been held in multiple countries ...","Principal institución del Estado en educación superior pública, fundada en 1842. Carreras de pregrado, postgrado y postítulo, investigación y extensión.",0.9950860738754272,0.12480825505121435
versión,"Se abren inscripciones para la versión 2020 de Red Bull Soapbox Race ¡Vuelve a Santiago la ya conocida Red Bull Soapbox Race! A partir de hoy y hasta finales de septiembre se estarán recibiendo las postulaciones de los equipos más locos y valientes de Chile, donde tendrán que ingeniárselas para dar con un auto que combine creatividad ...","Ya llega una nueva versión del Red Bull Soapbox Race Tweet Este sábado 14 de marzo en el Parque Metropolitano, 35 carros competirán para quedarse con una nueva edición de la carrera de autos locos más entretenida y extrema del mundo.","Velocidad, risas y porrazos asegurados serán parte de la tercera versión de Red Bull Soapbox Race, la carrera de autos locos más divertida del mundo donde participarán 35 carros de más de 450 diseños que postularon. El premio para este año es vivir la fecha de la Fórmula 1 en Austria.",0.9950153231620789,0.5471302305981418
co,"Soapbox Racer es un juego coches incomparable al que puedes jugar en 1001juegos.com , gratis. A Soapbox Racer han jugado 4,946 personas y se ha puntuado 9.0 de 10 por 78 personas. Soapbox Racer se ha diseñado con HTML5 para funcionar sin problemas en la …","Soapbox Race World. Download. Return to the streets of Need for Speed: World! Download the launcher. Multiple Servers. Our server list consists of various community-hosted servers, along with official servers operated by project staff. Custom Economy.","En 2020 vuelve uno de los eventos más entretenidos y desafiantes del mundo a Santiago. Tras cuatro años de ausencia, SoapBox Race, que en 2016 se realizó en la comuna de La Reina, regresará durante el primer semestre de 2020 y ya están abiertas las postulaciones para los valientes (y suficientemente locos) que quieran participar. Red Bull Race es un evento abierto al público ...",0.9949837923049927,0.0801647424061499
design,"30, 2018 - Explore Steven Curtis Seelig's board ""Soapbox Derby Cars"", followed by 312 people on Pinterest. See more ideas about derby cars, soap box cars, soap boxes.",The F1 team’s Chief Engineering Officer Rob Marshall tells us how to win at building a machine for Red Bull Soapbox Race. Written by James Roberts Published on 07.07.2017  5:51 UTC,"Have a digital brainstorm. Sketchup is a free and very useful tool for visualising your soapbox design.For inspiration, check out the All American Soapbox Derby and Gravity Racing.. Go aero. Even at relatively low speeds, aerodynamics are important. Make sure your design …",0.9949421882629395,0.17429420238451726
annual,"Por segunda vez en Chile, se llevó a cabo el Red Bull Soapbox Race, la emblemática carrera de los “autos locos” que se realiza en distintos países del mundo y que busca convertirse en un divertido panorama de fin de semana. En esta ocasión, el evento tuvo lugar en la región Metropolitana, en la comuna de La Reina.","Para quienes asistan al Soapbox Race, la carrera contará con un circuito cerrado de televisión que dará a los asistentes la opción de ver el recorrido completo sin importar en qué parte se encuentren.Se podrá seguir a los participantes mientras recorren una pista que incorpora saltos, peraltes, curvas y obstáculos sorpresa.","La palabra divertido queda chica al lado de la carrera de autos locos que se hará en el cerro San Cristóbal. Y es que el Red Bull Soapbox Race, es una de esas competencia donde no sólo brilla la velocidad con la que conduces los carros, sino que también la imaginación, ya que es el propio participante quien lo diseña.. La tercera versión de este espectáculo se hará el sábado 14, y ...",0.9949228167533875,0.22496535773089077
inglés,Your school's having a soapbox derby.: En tu colegio va a haber una carrera de coches.: He couldn't build a soapbox derby racer.: Él no podría construir ni un coche de carreras de juguete.: This is not some soapbox derby.: Esto no es una carrera de niños.: Your school's having a soapbox derby.: La escuela hará una carrera de autos sin motor.: He couldn't build a soapbox derby racer.,"Pedagogía en Inglés (Viña del Mar, V Valparaíso) Universidad de Viña del Mar. Título ofrecido: Profesor de Inglés. Formar profesores de ingls con un alto estndar en el manejo de la disciplina -equivalente a un ALTE 4 del marco comn europeo de manejo de la lengua inglesa-, un nivel superior al exigido por el Ministerio de Educacin en Chile, es el objetivo de esta carrera.Lo ms ...","Se ofrecen carreras en Traductor Técnico, Científico o Literario en alemán, francés, inglés y portugués. El campo de trabajo del traductor es muy amplio y diverso. Está vinculado con. Laboratorio ; Empresas comerciales, Editoriales. ¿Dónde estudiar una carrera en idiomas? OFERTA EDUCATIVA GRATUITA:",0.9948924779891968,0.09094493736862254
