word_added,s1,s2,s3,similarity_w,sum_cos
cualquier,@juangangelEl primer automóvil con motor de combustión interna se atribuye a Karl Friedrich Benz en la ciudad de Mannheim en 1886 con el modelo Benz Patent-M...,"los automoviles modernos están compuestos por miles de partes, las cuales estan dispuestas de tal manera que cumplen la función especifica de desplazamiento del vehiculo, sin embargo un auto no solamente esta diseñado para esto, por eso esta dividido en muchos sistemas, entre ellos encontramos: el sistema de escape, el sistema de apoyo, el motor, el sistema de dirección, el sistema …","como construir las partes de un automovil by leonardovirgilio. Mucho más que documentos. Descubra todo lo que Scribd tiene para ofrecer, incluyendo libros y audiolibros de importantes editoriales.",0.9977906942367554,2.9592616442313173
mismo,"El chasis es el esqueleto de un auto. Puede ser una estructura auto portante, como una cáscara o tipo H (escalera), donde se monta el resto del vehículo. El chasis es la estructura principal donde irán montados todos los componentes del vehículo. Foto de un Auto portante Subaru. Foto de un tipo escalera Toyota Hilux. Frenos de tambor",@juangangelEl primer automóvil con motor de combustión interna se atribuye a Karl Friedrich Benz en la ciudad de Mannheim en 1886 con el modelo Benz Patent-M...,"los automoviles modernos están compuestos por miles de partes, las cuales estan dispuestas de tal manera que cumplen la función especifica de desplazamiento del vehiculo, sin embargo un auto no solamente esta diseñado para esto, por eso esta dividido en muchos sistemas, entre ellos encontramos: el sistema de escape, el sistema de el el sistema de dirección, el sistema de …",0.9977900981903076,2.957297608577914
sistema,"El VIN es el Número de Identificación Vehicular o número de chasis de un automóvil. Es único para cada vehículo y queda grabado en algunas partes del mismo (en la parte inferior del parabrisas del conductor, en el chasis de la rueda delantera, en el marco de la puerta del conductor o en el motor del carro).","El automóvil utiliza distintos sistemas que funcionan de manera simultánea, por lo que conocer estas partes básicas no solo facilita la detección de problemas, sino también ayuda a realizar ...",@juangangelEl primer automóvil con motor de combustión interna se atribuye a Karl Friedrich Benz en la ciudad de Mannheim en 1886 con el modelo Benz Patent-M...,0.9977657794952391,2.892836194139395
necesarios,"Descubre las partes de un coche de forma sencilla y conoce todo el rendimiento que puede ofrecerte tu vehículo. ¡Entra! Si a un niño le pides dibujar un coche, rápidamente trazará los círculos que forman los neumáticos, la forma de la carrocería, las lunas y, en algunos casos, las puertas o …","Chasis. El chasis es el esqueleto de un auto. Puede ser una estructura auto portante, como una cáscara o tipo H (escalera), donde se monta el resto del vehículo. El chasis es la estructura principal donde irán montados todos los componentes del vehículo. Foto de un Auto portante Subaru. Foto de un tipo escalera Toyota Hilux.","Esta página se editó por última vez el 12 abr 2020 a las 06:32. El texto está disponible bajo la Licencia Creative Commons Atribución Compartir Igual 3.0; pueden aplicarse cláusulas adicionales.Al usar este sitio, usted acepta nuestros términos de uso y nuestra política de privacidad. Wikipedia® es una marca registrada de la Fundación Wikimedia, Inc., una organización sin ánimo de ...",0.9977347850799559,2.9523719055908177
así,"En él están comprendidos los circuitos de encendido, de carga, de arranque y de iluminación, con un elemento común que es la batería. Ésta proporciona energía eléctrica partiendo de una energía química producida por la reacción de un electrónico (disolución de agua destilada y ácido sulfúrico). Es necesario llevar un mantenimiento adecuado de la batería, comprobando y repostando el nivel de electrolito.",El conjunto de componentes del automóvil que unen las ruedas con el chasis se denomina suspensión. Estos resortes metálicos y amortiguadores guían a las ruedas en su recorrido y transforman la energía cinética (de baches y cuestas) en calorífica.,@juangangelEl primer automóvil con motor de combustión interna se atribuye a Karl Friedrich Benz en la ciudad de Mannheim en 1886 con el modelo Benz Patent-M...,0.9977331757545472,2.9225939171884545
plano,Nuevas partes para vehículos motorizados en un primer plano de fondo gris. una gran profundidad de campo. Editor de imagen Guardar,Partes de un motor: Autos carburados y autos inyectados: ... En un auto carburado es mucho más sencillo: se abre la . tapa de la cazoleta del . filtro de aire que va encima del carburador (de color rojo en la foto) y se mira por el ... En un camino plano y derecho soltar el volante y ver si el auto …,"planos para la construccion de la estructura de un buggy de 2 personas C. Rueda de Zamora • Diseñada usando tubos de 1.5 de diametro y 0.95 de espesor.Solo use tubos hechos para hacer estructuras como estas,no use tubos de agua o similares.",0.9977325201034546,2.9596455855423196
material,"En promedio un auto puede contener 1,350 kilógramos de acero, mientras que una camioneta lograría poseer alrededor de 1,800 Kg. En los autos el acero se usa para crear el chasis subyacente o la caja debajo del cuerpo que forma el esqueleto del vehículo y …","Esta página se editó por última vez el 12 abr 2020 a las 06:32. El texto está disponible bajo la Licencia Creative Commons Atribución Compartir Igual 3.0; pueden aplicarse cláusulas adicionales.Al usar este sitio, usted acepta nuestros términos de uso y nuestra política de privacidad. Wikipedia® es una marca registrada de la Fundación Wikimedia, Inc., una organización sin ánimo de ...",@juangangelEl primer automóvil con motor de combustión interna se atribuye a Karl Friedrich Benz en la ciudad de Mannheim en 1886 con el modelo Benz Patent-M...,0.9977231621742249,3.0
hora,"Un automóvil, a las 15 h 20 min 10 seg, parte de una ciudad a otra. Si en total tardó 320,25 min; la hora, minuto y segundo a la que llegó exactamente a su destino es: A) 5 h, 20 min, 15 s B) 15 h, 400 min, 35 s",@juangangelEl primer automóvil con motor de combustión interna se atribuye a Karl Friedrich Benz en la ciudad de Mannheim en 1886 con el modelo Benz Patent-M...,"10 partes importantes de un automóvil mecánico Dirección. Controla las ruedas – la mejor manera es colocar las manos en lo que se conoce como posición “diez y dos”. La bocina. En la mayoría de los autos, la bocina está normalmente situada en el …",0.9977182149887084,2.910061953110386
tiempo,"Ahora es el momento de profundizar en la materia para que a partir de hoy tú también sepas lo que es un cigüeñal, una bujía o cómo se calcula la famosa cilindrada. Cuáles son las partes del motor de un coche. Antes de descubrir las partes que componen el motor de un coche, hay que tener en cuenta que no todos los motores son iguales.","los automoviles modernos están compuestos por miles de partes, las cuales estan dispuestas de tal manera que cumplen la función especifica de desplazamiento del vehiculo, sin embargo un auto no solamente esta diseñado para esto, por eso esta dividido en muchos sistemas, entre ellos encontramos: el sistema de escape, el sistema de apoyo, el motor, el sistema de …","El tiempo necesario aproximado para el montaje desde cero de un vehículo de la clase del Volkswagen Golf suele ser entre 15 - 20 horas, según la complejidad y el equipamiento. El récord de tiempo de producción lo ostenta el Smart, que precisa aprox. solo de 4 horas para ser finalizado. Esto es posible gracias a su reducido tamaño y el porcentaje importante de componentes ensamblados previamente.",0.9977141022682191,2.9324660652319805
principal,"Pedales o mandos de pie. El Acelerador: se acciona con el pie derecho y su objetivo es regular la entrada de combustible en el motor. Al presionarlo aumenta la potencia y la velocidad, y también el consumo. Cuando no se pisa, el motor sólo recibe combustible para mantenerse en marcha, funcionando al …","Cada coche consta de un motor y gran parte de ellos usan un motor de combustión interna que opera con gasolina. La gasolina, junto con el aire, se echa en una cámara de combustión donde se comprime y se enciende con una chispa. La combustión que resulta de ello produce un golpe de energía que, al repetirlo rápidamente, enciende el coche. En general, se hace referencia a los motores según …","Pero a pesar de todos los cambios que han tenido lugar, las partes principales de un automóvil han permanecido esencialmente sin cambios desde primer Modelo T de Henry Ford salió de la línea en 1908. Chasis y Cuerpo El bastidor de un automóvil, a veces llamado el chasis, proporciona una plataforma rígida sobre la que montar todo lo demás.",0.9977049827575684,2.9342424872757866
seguridad,"Una seguridad que contribuye a proporcionar una mayor eficacia y estabilidad del vehículo en movimiento, como, por ejemplo: el ABS y el asistente de frenado y, por si fuera poco, reducir al mínimo los daños materiales y físicos que puedan producirse cuando el siniestro vial puede ser imprevisible pero no por ello inevitable, como, por ejemplo, el …","- Visibilidad: las ventanillas, lunas y retrovisores forman parte de la seguridad activa por lo que es fundamental llevar un buen ajuste y limpieza para tener una conducción segura:","Frenos de emergencia BAS El Brake Assist System (BAS), es un sistema de frenado de emergencia que permite detener el vehículo en un menor tiempo y distancia. Sin duda se trata de un sistema de seguridad activa muy importante del vehículo.. En …",0.9976752400398254,2.867384757905252
realizar,"El chasis es el esqueleto de un auto. Puede ser una estructura auto portante, como una cáscara o tipo H (escalera), donde se monta el resto del vehículo. El chasis es la estructura principal donde irán montados todos los componentes del vehículo. Foto de un Chasis Auto portante Subaru. Foto de un Chasis tipo escalera Toyota Hilux. Frenos de tambor","Los frenos de disco usan un disco giratorio, que se encuentra entre las pastillas de los frenos montadas sobre calibres para reducir el movimiento del coche. Los frenos de tambor usan zapatas que empujan para afuera para contactar la parte inferior de un cilindro giratorio o tambor. Algunos coches contienen los dos tipos de frenos (un tipo para las ruedas delanteras y otro para las …","El automóvil utiliza distintos sistemas que funcionan de manera simultánea, por lo que conocer estas partes básicas no solo facilita la detección de problemas, sino también ayuda a realizar ...",0.9976746439933776,2.905705733168921
diseño,"Aunque a veces pueda parecer fácil, diseñar un nuevo modelo es una tarea que exige un gran esfuerzo por parte de un amplio equipo de profesionales. Desde el …","Elementos de diseño. La tarea del equipo de diseño está repartida generalmente en tres aspectos principales: el diseño exterior, el diseño interior, el color y los agregados aplicados. El diseño gráfico es también un aspecto del diseño de automóviles. Esta fase es compartida entre el equipo de diseño y el diseñador al mando del equipo tomara las medidas para el fin a que se destina.","Diseño de los elementos de suspensión de un vehículo de competición Ruedas: Se entenderá como “ruedas”, todos los elementos que ... por otra parte, es el mismo para un automóvil de serie, que para una furgoneta, etc. En un coche de calle, la diferencia reside en el carácter más o menos deportivo, más o ... que definen un automóvil ...",0.9976487755775452,2.7630725903489806
cuales,Partes de un coche Motor Neumáticos Chasis Carrocería Parabrisas Asientos Tapicería Cuadros de mando,"Pero a pesar de todos los cambios que han tenido lugar, las partes principales de un automóvil han permanecido esencialmente sin cambios desde primer Modelo T de Henry Ford salió de la línea en 1908. Chasis y Cuerpo El bastidor de un automóvil, a veces llamado el chasis, proporciona una plataforma rígida sobre la que montar todo lo demás.","Por ello, Humberto Rossi, especialista de la reconocida marca de autos DFSK Glory, da detalles sobre algunas de las partes más importantes de un auto y cuáles …",0.9976476430892944,2.87879759057671
volante,"El volante ha evolucionado con el tiempo y dejó de ser un mero elemento para dirigir el vehículo. El volante es uno de los elementos esenciales del auto, es lo que nos da control para dirigir el vehículo y por tanto, requiere de ciertos conocimientos y experiencia para maniobrarlo adecuadamente.","Un volante de dirección (también conocido como volante o timón) es un tipo de control de dirección en vehículos.
Los volantes se utilizan en todo tipo de vehículos, desde los automóviles hasta camiones ligeros y pesados. El volante es la parte del sistema de gobiernoque es manipulado por el conductor, generando acciones que son las respondidas por el resto del sistema. Esto se logra a través del contacto mecánic…","El volante BIMASA está constituido por dos masas, una unida al cigüeñal y otra al embrague, siendo éstas las que a continuación se detallan.",0.9976326823234558,2.8579181663322766
mayor,"los automoviles modernos están compuestos por miles de partes, las cuales estan dispuestas de tal manera que cumplen la función especifica de desplazamiento del vehiculo, sin embargo un auto no solamente esta diseñado para esto, por eso esta dividido en muchos sistemas, entre ellos encontramos: el sistema de escape, el sistema de apoyo, el motor, el sistema de …",@juangangelEl primer automóvil con motor de combustión interna se atribuye a Karl Friedrich Benz en la ciudad de Mannheim en 1886 con el modelo Benz Patent-M...,"Un automóvil, también denominado coche, carro, auto, etc; es un vehículo motorizado con ruedas utilizado para el transporte.La mayoría de las definiciones de automóvil, hacen referencia a los vehículos que circulan principalmente por las carreteras, con capacidad de uno a ocho personas, cuentan con cuatro neumáticos y transportan principalmente a personas, antes que mercaderías.",0.9976300597190856,2.904060310164054
muestra,"los automoviles modernos están compuestos por miles de partes, las cuales estan dispuestas de tal manera que cumplen la función especifica de desplazamiento del vehiculo, sin embargo un auto no solamente esta diseñado para esto, por eso esta dividido en muchos sistemas, entre ellos encontramos: el sistema de el el el el el el el el ...","Aqu mostramos un grfico con los sistemas y las partes que lo componen, es un grfico bastante bsico, pero intenta mostrar las partes principales del automovil. Motor El motor de un automvil requiere ser compacto y liviano de peso, que genere gran potencia, sea fcil de manejar, que raramente se avere y que sea silencioso cuando opere.",partes de un automóvil Motor. Parte del automóvil que le permiten desplazarse. Parte que genera la energía para su desplazamiento y la manda a... Parte del automóvil. Carrocería. Estructura de la cual se sostiene y se forma el automóvil se puede decir que es Espejos. Son ...,0.9976286292076112,2.8733049339659136
cuenta,Partes de un coche Motor Neumáticos Chasis Carrocería Parabrisas Asientos Tapicería Cuadros de mando,Especialista de la marca DFSK Glory menciona las partes más importantes de un automóvil para el conocimiento de los usuarios.,"Conducir un auto, mecánico o automático, no es cosa de juego. Así que teniendo en cuenta la importancia que conlleva conocer el vehículo que posees, la Automotora Guillermo Morales te presentará 11 de un mecánico que todo conductor debe conocer. Dirección",0.9976264238357544,2.9588257518080248
energía,Circuito de carga: es el que responde a la energía de la batería que consume el automóvil. Circuito de arranque : arranca el motor del vehículo haciéndolo girar a unas 50 r.p.m. (revoluciones por minuto).,El conjunto de componentes del automóvil que unen las ruedas con el chasis se denomina suspensión. Estos resortes metálicos y amortiguadores guían a las ruedas en su recorrido y transforman la energía cinética (de baches y cuestas) en calorífica.,Que partes de un automóvil emplean energía para ponerlo en marcha Recibe ahora mismo las respuestas que necesitas! yarchaga79 yarchaga79 15.10.2020 Castellano Secundaria Que partes de un automóvil emplean energía para ponerlo en marcha 2 Ver respuestas dinalp68 dinalp68 Respuesta: ...,0.997610569000244,2.8686624997341577
movimiento,"Su misión es orientar las ruedas directrices (delanteras) en función de la trayectoria a seguir. El piñón gira con el eje de la dirección y mueve una cremallera por medio de rótulas y bieletas, lo que disminuye el esfuerzo del conductor para mover las ruedas directrices y orientar el vehículo.","La caja de cambios es el mecanismo que permite transformar el giro y potencia del motor en movimiento y fuerza en las ruedas del auto. Esto se logra mediante un complejo sistema de piñones de diferentes tamaños y posiciones, que van acoplándose al sistema del motor. Existen dos tipos de cajas de cambios:","Escape: el pistón vuelve a subir y la válvula de escape se abre para que salga el gas de la explosión. Cada movimiento del pistón supone media vuelta del cigüeñal, que a su vez se traduce en el movimiento de las ruedas. De forma simplificada, así es cómo funciona el motor de un coche y estas son las funciones que desempeña cada pieza.",0.997609555721283,2.876407792333335
frenos,¿Cuáles son las partes de un sistema de frenos? Pedal. El conductor de un vehículo presiona el pedal de freno para detener el auto. La presión sobre el pedal mueve un... Cilindro prinicpal. El cilindro principal está ubicado directamente en …,Las tuberías de los circuitos de frenos son las encargadas de permitir el paso de líquido de frenos desde la bomba de frenos a los bombines de freno en las ruedas. Están formadas por tramos rígidos...,Partes del Sistema de Frenos Líquido de frenos. Se define como el fluido hidráulico especial encargado de transmitir la fuerza producida en el pedal... Pedal. Este elemento se presiona para activar el sistema de frenos. La presión ejercida en el pedal produce movimiento... Servofreno. …,0.9976004958152772,2.38979052529142
