word_added,s1,s2,s3,similarity_w,sum_cos
anual,"La compañía Red Bull celebra el domingo 14 de julio su anual 'Soapbox race', una carrera internacional de autos locos que reúne a varios equipos con sus bólidos artesanos con el objetivo de ...","La carrera ‘Red Bull Soapbox Race’ se realiza en países como Chile, Brasil, España, Italia y Alemania. Y los más sorprende de la carrera son los diseños extraordinarios y sus poderosas ...","Promoción ""CONTRATA TU SOAP Y PARTICIPA POR UNA GIFT CARD"" es válida desde el 18 de marzo de 2021 al 11 de abril de 2021 ambas fechas inclusive, para todas las personas que contraten su Seguro Obligatorio de Accidentes Personales a través de la web seguros.sura.cl, de la aplicación móvil de Seguros SURA o del número de venta por WhatsApp de Seguros SURA (+56921877179).",0.9394367337226868,2.807743911685124
racer,"Misterio descifrado. Hyundai ha desvelado este lunes las peculiaridades del Hyundai Soapbox racer, su enigmático coche de carreras sin motor que anticipó a …","Si este verano no hubiera sufrido las restricciones contra la pandemia del coronavirus, habríamos podido ver alguna de las tradicionales carreras de carretones, trastos o carros que proluferan en las fiestas mayores.Hyundai ha querido tomar el relevo de esos vehículos ausentes con el nuevo Soapbox Ride, un carretón pasado por el centro de diseño de Hyundai en Europa.","La carrera ‘Red Bull Soapbox Race’ se realiza en países como Chile, Brasil, España, Italia y Alemania. Y los más sorprende de la carrera son los diseños extraordinarios y sus poderosas ...",0.938968062400818,2.8023285446026294
official,Mira todos los accidentes y colisiones de la primera Red Bull Soapbox Race de Bulgaria. Así es una carrera de coches de madera sin frenos Sabes que has triunfado cuando trabajas como piloto de ...,"Soapbox Race World. Download. Return to the streets of Need for Speed: World! Download the launcher. Multiple Servers. Our server list consists of various community-hosted servers, along with servers operated by project staff. Custom Economy. Every server has total freedom over its economy, so there are plenty of unique experiences to ...","Esta es una carrera en grupo. Y si a eso le sumamos que los autos no pueden utilizar un motor, el resto del equipo pasa a ser vital a la hora de impulsar los primeros movimientos del carro.",0.9375628829002379,2.9464148477808316
llevó,"Por segunda vez en nuestro país se llevó a cabo el Red Bull Soapbox Race, que se realiza en distintos países del mundo como un divertido panorama de fin de semana. La cita contó con una pista ...","Este coche fue creado a partir de las carreras Soapbox Derby fundadas en 1933 en la ciudad de Akron, en Ohio, Estados Unidos. Todos los meses de Julio se celebra este campeonato donde el ...","La palabra divertido queda chica al lado de la carrera de autos locos que se hará en el cerro San Cristóbal. Y es que el Red Bull Soapbox Race, es una de esas competencia donde no sólo brilla la velocidad con la que conduces los carros, sino que también la imaginación, ya que es el propio participante quien lo diseña.. La tercera versión de este espectáculo se hará el sábado 14, y ...",0.9370505809783936,2.8547518915396317
descargar,"Soapbox Race World. Download. Return to the streets of Need for Speed: World! Download the launcher. Multiple Servers. Our server list consists of various community-hosted servers, along with official servers operated by project staff. Custom Economy.","Conoce las mallas de todas nuestras carreras, técnicas y profesionales, organizadas según su escuela, jornada, formato y modalidad: ... Ingeniería En Mecánica Automotriz y Autotrónica. Descargar. Técnico En Electricidad Y Automatización Industrial. . Técnico …","La carrera de autos locos Red Bull SoapBox Race inicia su etapa de postulaciones para partcipar con el más creativo, loco y rápido de los autos. En 2020 vuelve uno de los eventos más ...",0.9367547631263732,2.9663132298354182
reina,"Vuelve uno de los eventos más entretenidos y desafiantes de Santiago. El Red Bull Soapbox Race, que en 2016 se realizó en la comuna de La Reina, volverá durante el primer semestre de 2020 y ya ...","Por segunda vez en nuestro país se llevó a cabo el Red Bull Soapbox Race, que se realiza en distintos países del mundo como un divertido panorama de fin de semana. La cita contó con una pista ...","Vuelve uno de los eventos más entretenidos y desafiantes del mundo a Santiago.Tras cuatro años de ausencia, la Red Bull SoapBox Race, que en 2016 se realizó en La Reina, regresará durante el ...",0.9363819360733032,2.202938920194914
gravity,"La carrera ‘Red Bull Soapbox Race’ se realiza en países como Chile, Brasil, España, Italia y Alemania. Y los más sorprende de la carrera son los diseños extraordinarios y sus poderosas ...",Top speed run down Monitor Pass of 74.2 mph in a Soapbox Gravity Car. As far as I know this is the fastest anyone has traveled in a soapbox car.,"A una carrera de Soapbox asisten cerca de 40,000 espectadores, cifra récord para muchos deportes en el mundo. Los participantes ahora son de todas las edades y características, sin embargo, las carreras tradicionales fueron creadas para niños de hasta 13 años. Una carrera promedio en los Estados Unidos registra más de 300 corredores inscritos.",0.9356765151023864,2.8683555720384004
super,"La carrera de autos locos Red Bull SoapBox Race inicia su etapa de postulaciones para partcipar con el más creativo, loco y rápido de los autos. En 2020 vuelve uno de los eventos más ...",La emocionante carrera de Red Bull Soapbox [fotos] En esta singular carrera participan equipos de adultos con extraños carros fabricados en casa y que funcionan a base de pura gravedad.,"Buscando inspiración en algunos vehículos de la marca, y siguiendo la nueva identidad de la firma, el Concept 45 fue de gran ayuda, ya que en el tratamiento superficial del cuerpo de la caja, los paneles planos y la silueta en forma de cuña, se inspiran en el modelo antes mencionado. Materiales. El Hyundai Soapbox está hecho de madera, varillas de metal y materiales de conexión como ...",0.935470461845398,2.84484276416064
segunda,"La peculiar carrera de Soapbox se realizó por segunda ocasión en Ammán, Jordania. Sesenta participantes usaron su imaginación para construir carros con diseños singulares.","Competidores participan hoy, en Santiago de Chile, en la segunda versión del Red Bull Soapbox Race, la emblemática carrera de los ""autos locos"" …","Cerca de 20 mil personas disfrutaron este domingo de la segunda versión chilena de Red Bull Soapbox Race, la divertida carrera de carros que se efectuó en la comuna de La Reina en Santiago y que retó a 42 entusiastas equipos a convertirse en diseñadores, ingenieros y pilotos de sus propios “autos …",0.9345656633377076,2.574095682116633
video,"amigos, este 11 de septiembre se realizara el 1er red bull soapbox en la ciudad de mexico, se realizara en GALERIAS ATIZAPAN, la cita es a las 11 de la mañana, la entrada es gratis, estare ...","La peculiar carrera de Soapbox se realizó por segunda ocasión en Ammán, Jordania. Sesenta participantes usaron su imaginación para construir carros con diseños singulares.","Red Bull Soapbox Race es una carrera de autos locos que se realiza en todo el mundo, abierto al público, donde cada equipo puede inscribirse y …",0.9344521760940552,2.8444391374936577
city,"La carrera de autos locos Red Bull SoapBox Race inicia su etapa de postulaciones para partcipar con el más creativo, loco y rápido de los autos. En 2020 vuelve uno de los eventos más ...","Se espera que unas 10 mil personas lleguen este sábado al Parque Metropolitano de Santiago para celebrar la tercera edición del Red Bull Soapbox Race. Esta carrera, que se realiza en varios países del mundo, tendrá a 35 autos locos bajando por una pista donde los pilotos podrán alcanzar velocidades cercanas a los 40 km/h.","Red Bull SoapBox Race 2020: Vuelve al Cerro San Cristóbal la carrera de autos locos más entretenida de Chile Mucha atención, que ya comenzó la etapa de postulaciones para partcipar con el más creativo, loco y rápido de los autos de Santiago",0.9343411922454834,2.0303567193205985
free,La emocionante carrera de Red Bull Soapbox [fotos] En esta singular carrera participan equipos de adultos con extraños carros fabricados en casa y que funcionan a base de pura gravedad.,"La carrera de autos locos Red Bull SoapBox Race inicia su etapa de postulaciones para partcipar con el más creativo, loco y rápido de los autos. En 2020 vuelve uno de los eventos más ...","Soapbox Race World. Download. Return to the streets of Need for Speed: World! Download the launcher. Multiple Servers. Our server list consists of various community-hosted servers, along with official servers operated by project staff. Custom Economy.",0.9339536428451538,2.8261142343185037
youth,"La carrera de autos locos Red Bull SoapBox Race inicia su etapa de postulaciones para partcipar con el más creativo, loco y rápido de los autos. En 2020 vuelve uno de los eventos más ...",La emocionante carrera de Red Bull Soapbox [fotos] En esta singular carrera participan equipos de adultos con extraños carros fabricados en casa y que funcionan a base de pura gravedad.,"Esta es una carrera en grupo. Y si a eso le sumamos que los autos no pueden utilizar un motor, el resto del equipo pasa a ser vital a la hora de impulsar los primeros movimientos del carro.",0.933858036994934,2.7441388286644055
speed,"Este coche fue creado a partir de las carreras Soapbox Derby fundadas en 1933 en la ciudad de Akron, en Ohio, Estados Unidos.","Hyundai ha desvelado este lunes las peculiaridades del Hyundai Soapbox racer, su enigmático coche de carreras sin motor que anticipó a finales …","With Soapbox Race World, servers can provide custom game modifications to their players, ranging from simple lighting mods to totally new cars! Ready to hit the streets? Download the launcher now!",0.933790922164917,2.8473286806480393
pack,La emocionante carrera de Red Bull Soapbox [fotos] En esta singular carrera participan equipos de adultos con extraños carros fabricados en casa y que funcionan a base de pura gravedad.,"Esta es una carrera en grupo. Y si a eso le sumamos que los autos no pueden utilizar un motor, el resto del equipo pasa a ser vital a la hora de impulsar los primeros movimientos del carro.","La carrera de autos locos Red Bull SoapBox Race inicia su etapa de postulaciones para partcipar con el más creativo, loco y rápido de los autos. En 2020 vuelve uno de los eventos más ...",0.9336743354797364,2.7441388286644055
