word_added,s1,s2,s3,similarity_w,sum_cos
posible,"Pedales o mandos de pie. El Acelerador: se acciona con el pie derecho y su objetivo es regular la entrada de combustible en el motor. Al presionarlo aumenta la potencia y la velocidad, y también el consumo. Cuando no se pisa, el motor sólo recibe combustible para mantenerse en marcha, funcionando al …","El chasis es el esqueleto de un auto. Puede ser una estructura auto portante, como una cáscara o tipo H (escalera), donde se monta el resto del vehículo. El chasis es la estructura principal donde irán montados todos los componentes del vehículo. Foto de un Chasis Auto portante Subaru. Foto de un Chasis tipo escalera Toyota Hilux. Frenos de tambor","Una de las partes más visibles del coche es el panel de luminosos del salpicadero. La mayoría de los conductores son conscientes del velocímetro y del medidor de gasolina, pero hay otros elementos que tienen igual o más importancia. El tacómetro, que indica la velocid ad del motor en rotaciones por minuto (RPM).",0.9983693361282348,2.9514569868354585
cuenta,Partes de un coche Motor Neumáticos Chasis Carrocería Parabrisas Asientos Tapicería Cuadros de mando,"Conducir un auto, mecánico o automático, no es cosa de juego. Así que teniendo en cuenta la importancia que conlleva conocer el vehículo que posees, la Automotora Guillermo Morales te presentará 11 de un mecánico que todo conductor debe conocer. Dirección",Especialista de la marca DFSK Glory menciona las partes más importantes de un automóvil para el conocimiento de los usuarios.,0.9983428716659546,2.9588257518080248
manera,"El automóvil utiliza distintos sistemas que funcionan de manera simultánea, por lo que conocer estas partes básicas no solo facilita la detección de problemas, sino también ayuda a realizar ...","Cada coche consta de un motor y gran parte de ellos usan un motor de combustión interna que opera con gasolina. La gasolina, junto con el aire, se echa en una cámara de combustión donde se comprime y se enciende con una chispa. La combustión que resulta de ello produce un golpe de energía que, al repetirlo rápidamente, enciende el coche.","Chasis. El chasis es el esqueleto de un auto. Puede ser una estructura auto portante, como una cáscara o tipo H (escalera), donde se monta el resto del vehículo. El chasis es la estructura principal donde irán montados todos los componentes del vehículo. Foto de un Chasis Auto portante Subaru. Foto de un Chasis tipo escalera Toyota Hilux.",0.9983245134353638,3.0
materiales,"Las puertas, el techo y los paneles de la carrocería están hechos de acero. Incluso algunas partes para acomodar el motor, y los escapes son hechos de acero inoxidable. Este material también se lo emplea para formar el chasis subyacente del vehículo o parte del esqueleto del coche, para así proteger a sus ocupantes en caso de un accidente.","Materiales utilizados en la carrocería del automóvil 3 fotos El acero es el material por excelencia utilizado para la construcción de las carrocerías de los automóviles, pero bajo la denominación de acero hay diferentes calidades con características muy particulares que propician su utilización según la aplicación.","En promedio un auto puede contener 1,350 kilógramos de acero, mientras que una camioneta lograría poseer alrededor de 1,800 Kg. En los autos el acero se usa para crear el chasis subyacente o la caja debajo del cuerpo que forma el esqueleto del vehículo y …",0.9983208775520324,2.6477680834842396
necesarios,"Chasis. El chasis es el esqueleto de un auto. Puede ser una estructura auto portante, como una cáscara o tipo H (escalera), donde se monta el resto del vehículo. El chasis es la estructura principal donde irán montados todos los componentes del vehículo. Foto de un Auto portante Subaru. Foto de un tipo escalera Toyota Hilux.",Partes de un coche Motor Neumáticos Chasis Carrocería Parabrisas Asientos Tapicería Cuadros de mando,"Aparte de los filtros surtidos familiares para la mayoría de los automovilistas, hay muchas partes de un coche que caen bajo la categoría de ""elementos de desgaste."" Los Frenos freno reparaciones y servicios del sistema son el dinero encima los responsables los talleres reparación más generales.",0.9982988834381104,2.8488574867840875
casa,@juangangelEl primer automóvil con motor de combustión interna se atribuye a Karl Friedrich Benz en la ciudad de Mannheim en 1886 con el modelo Benz Patent-M...,"El chasis es el esqueleto de un auto. Puede ser una estructura auto portante, como una cáscara o tipo H (escalera), donde se monta el resto del vehículo. El chasis es la estructura principal donde irán montados todos los componentes del vehículo. Foto de un Chasis Auto portante Subaru",Curso Mecánica: Experto en Autopartes | Componentes de un AutomóvilProfesor: Jorge Antonio GuillenVisita la pagina de la cnt: www.confederaciondetalleres.org.mx,0.9982964396476746,2.975387383439154
general,"El chasis es el esqueleto de un auto. Puede ser una estructura auto portante, como una cáscara o tipo H (escalera), donde se monta el resto del vehículo. El chasis es la estructura principal donde irán montados todos los componentes del vehículo. Foto de un Chasis Auto portante Subaru. Foto de un Chasis tipo escalera Toyota Hilux. Frenos de tambor","En él están comprendidos los circuitos de encendido, de carga, de arranque y de iluminación, con un elemento común que es la batería. Ésta proporciona energía eléctrica partiendo de una energía química producida por la reacción de un electrónico (disolución de agua destilada y ácido sulfúrico). Es necesario llevar un mantenimiento adecuado de la batería, comprobando y repostando el nivel de electrolito.","Pero a pesar de todos los cambios que han tenido lugar, las partes principales de un automóvil han permanecido esencialmente sin cambios desde primer Modelo T de Henry Ford salió de la línea en 1908. Chasis y Cuerpo El bastidor de un , a veces llamado el chasis, proporciona una plataforma rígida sobre la que montar todo lo demás.",0.998279869556427,2.8589596263238697
productos,"Los instrumentos, medidores, interruptores, las ventilas del aire acondicionado, manijas, tapetes, bolsas de aire entre otras partes –incluidas en el motor- están fabricadas de diferentes tipos de plásticos.",@juangangelEl primer automóvil con motor de combustión interna se atribuye a Karl Friedrich Benz en la ciudad de Mannheim en 1886 con el modelo Benz Patent-M...,"Las partes específicas de una línea de producción de automóviles pueden variar según el fabricante, ya que algunos fabricantes crearán más de un tipo de automóvil en una sola línea o en una sola fábrica. ... son formas eficientes y rápidas de producir terminados mientras se mantienen bajos los costos generales.",0.9982702136039734,2.9199195829509064
bloque,principal l descarga de bloques l bloques de colaboradores l librerías l otras librerías l contactar l mapa del sitio : Bloques AutoCAD para descargar GRATIS: bloquesautocad.com: ir a librería vehículos: Librerías AutoCAD vehículos y transportes - coches,"La tapa de cilindros es la parte superior del motor. Las cavidades de los cilindros están en dicha tapa. La bomba de aceite bombea aceite en la tapa, y los filtros de aceite a través de las piezas internas del Para una mejor lubricación, los técnicos de suelen pintar la para que sea más suave, lo que permite que el aceite fluya de nuevo en el motor más rápido.","Bloque motor de fundición, seccionado (en gris) de un motor antiguo de automóvil. El bloque del motor, bloque motor, bloque de cilindros o monoblock es una pieza fundida en hierro o aluminio que aloja los cilindros de un motor de combustión interna así como los soportes de apoyo del cigüeñal.",0.998269259929657,2.816431641076966
medio,"El chasis es el esqueleto de un auto. Puede ser una estructura auto portante, como una cáscara o tipo H (escalera), donde se monta el resto del vehículo. El chasis es la estructura principal donde irán montados todos los componentes del vehículo. Foto de un Chasis Auto portante Subaru. Foto de un Chasis tipo escalera Toyota Hilux. Frenos de tambor",En esta página puedes ver las diferentes partes de un auto. Conjunto de partes de un auto. Las partes de un auto so n:. Estructura del chasis; Timón o volante,@juangangelEl primer automóvil con motor de combustión interna se atribuye a Karl Friedrich Benz en la ciudad de Mannheim en 1886 con el modelo Benz Patent-M...,0.9982580542564392,2.7167316447631324
características,"El VIN es el Número de Identificación Vehicular o número de chasis de un automóvil. Es único para cada vehículo y queda grabado en algunas partes del mismo (en la parte inferior del parabrisas del conductor, en el chasis de la rueda delantera, en el marco de la puerta del conductor o en el motor del carro).","El motor, las ruedas, los frenos, las ventanas forman parte de su concepto; bueno, los tres primeros sí, pero las ventanas no son necesarias, existen coches que no tienen ventanas.","Partes principales en vehículos automóviles Estructura (Carrocería, Chasis, Bastidor)",0.998254656791687,2.8334734741198284
aprender,"El chasis es el esqueleto de un auto. Puede ser una estructura auto portante, como una cáscara o tipo H (escalera), donde se monta el resto del vehículo. El chasis es la estructura principal donde irán montados todos los componentes del vehículo. Foto de un Chasis Auto portante Subaru. Foto de un Chasis tipo escalera Toyota Hilux. Frenos de tambor",@juangangelEl primer automóvil con motor de combustión interna se atribuye a Karl Friedrich Benz en la ciudad de Mannheim en 1886 con el modelo Benz Patent-M...,"Cómo aprender sobre las partes de un coche. entusiastas de automóviles y los propietarios de automóviles pueden aprender sobre las partes de un coche a través de una serie de recursos. Tanto en línea como en medios impresos, manuales y tutoriales son utilizados en el …",0.9982421994209291,3.0
bien,"El VIN es el Número de Identificación Vehicular o número de chasis de un automóvil. Es único para cada vehículo y queda grabado en algunas partes del mismo (en la parte inferior del parabrisas del conductor, en el chasis de la rueda delantera, en el marco de la puerta del conductor o en el motor del carro).",@juangangelEl primer automóvil con motor de combustión interna se atribuye a Karl Friedrich Benz en la ciudad de Mannheim en 1886 con el modelo Benz Patent-M...,Curso Mecánica: Experto en Autopartes | Componentes de un AutomóvilProfesor: Jorge Antonio GuillenVisita la pagina de la cnt: www.confederaciondetalleres.org.mx,0.9982229471206664,2.9461115671234976
fabricación,"La fabricación de automóviles se refiere a la producción industrial de vehículos automóviles en fábricas habilitadas para ello. Es una de las etapas indispensables de la industria automotriz, junto a la comercialización. La fabricación de automóviles requiere un capital humano y financiero muy importante. Dependiendo del tipo de vehículo, la cantidad de unidades a fabricar por día y el emplazamiento de la …","La fabricación de un coche se divide, fundamentalmente, en cuatro etapas: prensado, chapistería, pintura y montaje. Vamos a repasar lo que se hace en cada una de estas cuatro etapas. ¿Sabías que en las dos primeras apenas intervienen personas?","Y, la fase final del proceso de producción de un automóvil se trata de que el vehículo pase por un banco de pruebas donde se le harán valoraciones: Eléctricas ; Mecánicas; Pruebas de lluvia para detectar entradas de agua. Comprobación de aceleración y frenado. Respuesta de amortiguadores y …",0.9982172846794128,2.8877996893902487
nuevo,"El VIN es el Número de Identificación Vehicular o número de chasis de un automóvil. Es único para cada vehículo y queda grabado en algunas partes del mismo (en la parte inferior del parabrisas del conductor, en el chasis de la rueda delantera, en el marco de la puerta del conductor o en el motor del carro).",@juangangelEl primer automóvil con motor de combustión interna se atribuye a Karl Friedrich Benz en la ciudad de Mannheim en 1886 con el modelo Benz Patent-M...,Curso Mecánica: Experto en Autopartes | Componentes de un AutomóvilProfesor: Jorge Antonio GuillenVisita la pagina de la cnt: www.confederaciondetalleres.org.mx,0.998213231563568,2.9461115671234976
cosas,"El VIN es el Número de Identificación Vehicular o número de chasis de un automóvil. Es único para cada vehículo y queda grabado en algunas partes del mismo (en la parte inferior del parabrisas del conductor, en el chasis de la rueda delantera, en el marco de la puerta del conductor o en el motor del carro).","Descubre las partes de un coche de forma sencilla y conoce todo el rendimiento que puede ofrecerte tu vehículo. ¡Entra! Si a un niño le pides dibujar un coche, rápidamente trazará los círculos que forman los neumáticos, la forma de la carrocería, las lunas y, en algunos casos, las puertas o …","10 partes importantes de un automóvil mecánico Dirección. Controla las ruedas – la mejor manera es colocar las manos en lo que se conoce como posición “diez y dos”. La bocina. En la mayoría de los autos, la bocina está normalmente situada en el …",0.9982045888900756,2.900314654236866
energía,El conjunto de componentes del automóvil que unen las ruedas con el chasis se denomina suspensión. Estos resortes metálicos y amortiguadores guían a las ruedas en su recorrido y transforman la energía cinética (de baches y cuestas) en calorífica.,Que partes de un automóvil emplean energía para ponerlo en marcha Recibe ahora mismo las respuestas que necesitas! yarchaga79 yarchaga79 15.10.2020 Castellano Secundaria Que partes de un automóvil emplean energía para ponerlo en marcha 2 Ver respuestas dinalp68 dinalp68 Respuesta: ...,Circuito de carga: es el que responde a la energía de la batería que consume el automóvil. Circuito de arranque : arranca el motor del vehículo haciéndolo girar a unas 50 r.p.m. (revoluciones por minuto).,0.9982023239135742,2.8686624997341577
cualquier,@juangangelEl primer automóvil con motor de combustión interna se atribuye a Karl Friedrich Benz en la ciudad de Mannheim en 1886 con el modelo Benz Patent-M...,"Partes de un amortiguador. Un amortiguador es aquel componente del automóvil encargado de absorber cualquier impacto fuerte para evitar que sea transferido a los pasajeros. Gracias a estos el viaje logra ser mucho más cómodo y placentero, puesto a que los viajeros no sentirán los impactos directos en el pavimento. Los amortiguadores deberán ser cambiados cada cierto tiempo, …",Frenos Manubrio o Volante Faros o Luces Gracias a el se puede controlar y maniobrar el automóvil. Gracias a ellos el auto puede frenar rápidamente y detenerse por completo. Permiten ver en la oscuridad ya que genera luz para iluminar y hacer visible el camino. Neumáticos Motor,0.9981911182403564,2.8863216639327716
ayuda,La suspensión consta de un conjunto de piezas y sistemas que buscan reducir las vibraciones producidas por las imperfecciones del camino. Generalmente se utilizan elementos como entre otros elementos.,@juangangelEl primer automóvil con motor de combustión interna se atribuye a Karl Friedrich Benz en la ciudad de Mannheim en 1886 con el modelo Benz Patent-M...,"los automoviles modernos están compuestos por miles de partes, las cuales estan dispuestas de tal manera que cumplen la función especifica de desplazamiento del vehiculo, sin embargo un auto no solamente esta diseñado para esto, por eso esta dividido en muchos sistemas, entre ellos encontramos: el sistema de escape, el sistema de apoyo, el motor, el sistema de dirección, el …",0.9981898069381714,2.948354957730686
diferentes,"Pedales o mandos de pie. El Acelerador: se acciona con el pie derecho y su objetivo es regular la entrada de combustible en el motor. Al presionarlo aumenta la potencia y la velocidad, y también el consumo. Cuando no se pisa, el motor sólo recibe combustible para mantenerse en marcha, funcionando al …","El chasis es el esqueleto de un auto. Puede ser una estructura auto portante, como una cáscara o tipo H (escalera), donde se monta el resto del vehículo. El chasis es la estructura principal donde irán montados todos los componentes del vehículo. Foto de un Chasis Auto portante Subaru. Foto de un Chasis tipo escalera Toyota Hilux. Frenos de tambor","Explicación de las diferentes partes de un automóvil El motor. Empecemos por el motor. Después de todo, esta es la fuente de energía que mueve un automóvil por la carretera. Transmisión. La transmisión, o caja de cambios o tren motriz, permite al conductor cambiar de velocidad. Esto se logra... ...",0.9981781244277954,2.889850585054677
permite,"El motor es el corazón de un auto, es el elemento que permite el movimiento y el funcionamiento de casi la totalidad de los sistemas auxiliares que permiten la conducción. Las nuevas tecnologías han permitido que los nuevos vehículos puedan contar con motores más pequeños y menos contaminantes, dejando en el pasado aquellos motores grandes y ruidosos.","Descubre las partes de un coche de forma sencilla y conoce todo el rendimiento que puede ofrecerte tu vehículo. ¡Entra! Si a un niño le pides dibujar un coche, rápidamente trazará los círculos que forman los neumáticos, la forma de la carrocería, las lunas y, en algunos casos, las puertas o …",Parte de un automóvil que permite maniobrarlo Respuestas Esta página le ayudará a encontrar todas las respuestas de CodyCross de todos los niveles. A través de los trucos y soluciones que encontrará en este sitio usted será capaz de pasar cada pista de crucigrama.,0.9981720447540284,2.9852851734995793
tiempo,"Ahora es el momento de profundizar en la materia para que a partir de hoy tú también sepas lo que es un cigüeñal, una bujía o cómo se calcula la famosa cilindrada. Cuáles son las partes del motor de un coche. Antes de descubrir las partes que componen el motor de un coche, hay que tener en cuenta que no todos los motores son iguales.","los automoviles modernos están compuestos por miles de partes, las cuales estan dispuestas de tal manera que cumplen la función especifica de desplazamiento del vehiculo, sin embargo un auto no solamente esta diseñado para esto, por eso esta dividido en muchos sistemas, entre ellos encontramos: el sistema de escape, el sistema de apoyo, el motor, el sistema de …","El tiempo necesario aproximado para el montaje desde cero de un vehículo de la clase del Volkswagen Golf suele ser entre 15 - 20 horas, según la complejidad y el equipamiento. El récord de tiempo de producción lo ostenta el Smart, que precisa aprox. solo de 4 horas para ser finalizado. Esto es posible gracias a su reducido tamaño y el porcentaje importante de componentes ensamblados previamente.",0.9981682300567628,2.9324660652319805
