word_added,s1,s2,s3,similarity_w,sum_cos
principales,"En él están comprendidos los circuitos de encendido, de carga, de arranque y de iluminación, con un elemento común que es la batería. Ésta proporciona energía eléctrica partiendo de una energía química producida por la reacción de un electrónico (disolución de agua destilada y ácido sulfúrico). Es necesario llevar un mantenimiento adecuado de la batería, comprobando y repostando el nivel de electrolito.","Cada coche consta de un motor y gran parte de ellos usan un motor de combustión interna que opera con gasolina. La gasolina, junto con el aire, se echa en una cámara de combustión donde se comprime y se enciende con una chispa. La combustión que resulta de ello produce un golpe de energía que, al repetirlo rápidamente, enciende el coche. En general, se hace referencia a los motores según …",El conjunto de componentes del automóvil que unen las ruedas con el chasis se denomina suspensión. Estos resortes metálicos y amortiguadores guían a las ruedas en su recorrido y transforman la energía cinética (de baches y cuestas) en calorífica.,0.999047577381134,2.9378473955275215
gasolina,"Suele denominarse tapa de cilindros porque es la encargada de encerrarlos y soporta las explosiones que generan. Además, también aloja las válvulas de admisión y escape, las bujías (en motores de gasolina), el árbol de levas que activa las válvulas, los conductos de admisión de aire y combustible y los conductos de escape. Entre la y el bloque se encuentra la “junta de” …",https://capacitateparaelempleo.orgLink original: https://capacitateparaelempleo.org/pages.php?r=.tema&tagID=1753&load=3052&n=0Elementos de los que se compone...,"Es el depósito o alojamiento de combustible, tiene un tapón de drenaje, un orificio respiradero y una tapa de llenado. Un mecanismo indicador de nivel de combustible dentro del tanque y la tubería de conducción. Existen tanques metálicos, pero actualmente son plásticos, reducen el nivel de sedimentos, corrosión y peso.",0.9988327026367188,2.943073377320737
motores,Una guía rápida y fácil para explicar todas esas partes de un motor y para qué sirven: Cárter Bomba de aceite Bloque motor Cojinetes Cigüeñal Volante de inercia Biela Bulón Pistón Segmentos Cilindro Bomba de agua Filtro de aceite Culata Válvulas Admisión Filtro de aire Escape,"Cuáles son las partes del motor de un coche. Antes de descubrir las partes que componen el motor de un coche, hay que tener en cuenta que no todos los motores son iguales. En el mercado podemos encontrar motores de combustión interna (diésel y gasolina), eléctricos o híbridos. Como la mayoría de los automóviles que se fabrican y están en circulación son de combustión interna, vamos …",Cómo identificar las partes del motor de un coche. ... Aquí se ubican la mayor parte de los relés y de los fusibles del vehículo –suele haber más en otra caja dentro del habitáculo–. Los ...,0.9988120794296264,2.7779582916378858
elementos,"Las ruedas son los elementos sobre los que se apoya el automóvil y las encargadas de dirigir, propulsar o detener el mismo.","Generalmente se utilizan elementos como resortes, amortiguadores hidráulicos, ballestas metálicas, entre otros elementos. La disposición de estos elementos y su configuración otorga al vehículo características especiales, como suavidad, capacidad de carga, maniobrabilidad y estabilidad. Ver la Suspensión Mcpherson",El conjunto de componentes del automóvil que unen las ruedas con el chasis se denomina suspensión. Estos resortes metálicos y amortiguadores guían a las ruedas en su recorrido y transforman la energía cinética (de baches y cuestas) en calorífica.,0.9987882375717164,2.665873299045813
todas,Partes de un coche Motor Neumáticos Chasis Carrocería Parabrisas Asientos Tapicería Cuadros de mando,"El chasis es el esqueleto de un auto. Puede ser una estructura auto portante, como una cáscara o tipo H (escalera), donde se monta el resto del vehículo. El chasis es la estructura principal donde irán montados todos los componentes del vehículo. Foto de un Chasis Auto portante Subaru. Foto de un Chasis tipo escalera Toyota Hilux. Frenos de tambor",Partes de un auto y sus funciones El motor. Cada auto funciona con un motor y la mayoría de los autos usan un motor de combustión interna que opera con... La transmisión directa. La transmisión directa es una serie de componentes que conectan el movimiento producido por el... El sistema eléctrico. ...,0.9987826347351074,2.657831699572229
conjunto,"No existe cuando forma un solo conjunto el motor, caja de cambios y eje motriz. – El eje motriz (par cónico-diferencial) El eje motriz, también llamado puente motriz, puede estar situado en la: o Parte delantera (vehículo de tracción delantera). o Parte trasera del vehículo (vehículo de propulsión trasera).","El chasis es el esqueleto de un auto. Puede ser una estructura auto portante, como una cáscara o tipo H (escalera), donde se monta el resto del vehículo. El chasis es la estructura principal donde irán montados todos los componentes del vehículo. Foto de un Chasis Auto portante Subaru. Foto de un Chasis tipo escalera Toyota Hilux. Frenos de tambor","Es el conjunto de sistemas que interactuando entre si lo componen. Básicamente, un automóvil se compone de motor, chasis y trasmisión.",0.9987728595733644,2.772505105893403
chasis,"El freno de tambor es un dispositivo que realiza el frenado del vehículo por fricción. Dicha fricción se produce entre la superficie interior de un cilindro denominado tambor, que gira mecánicamente unido a la rueda, y las zapatas, que permanecen fijas sobre un soporte solidario al chasis del vehículo.","Descubre cómo está hecho el chasis de un carro, en las partes de un carro descubre porque son tan importantes y la forma que les hace resistentes. Los Automó...","Las partes de un chasis Primordialmente, el chasis de carro independiente se compone de diversos elementos, aunque recordemos que es más simple. Este lleva un travesaño delantero, larguero del bastidor delantero, la consola para resorte y travesaño principal para la parte delantera.",0.9987246990203856,2.85813971463538
además,"Partes de un automóvil . El motor. ... Es más fiable y tiene una mayor duración, así como un menor coste de mantenimiento. Además dispone de un control de emisión de gases del escape más económico. Sin embargo, el aceite de engrase tiene que ser de mejor calidad. Asimismo, el motor diesel tiene menor potencia que el motor de gasolina ...",Partes de un coche Motor Neumáticos Chasis Carrocería Parabrisas Asientos Tapicería Cuadros de mando,"El ECU, conocido también como la Unidad de Control del Motor, es el cerebro del auto. Este dispositivo controla el nivel de combustible que se suministra al motor, el aire, el punto de ignición, la apertura de válvulas, el turbocompresor, entre otros.",0.998672902584076,2.7179225978884465
mantenimiento,El automóvil está formado por las siguientes partes: Estructura metálica: Conjunto estructural sobre el que se van montando el resto de componentes del vehículo. Carrocería: Destinada a transportar y proteger a los pasajeros y carga. Motor: Generador de potencia que produce el movimiento para ...,"En este artículo se explican estos mantenimientos o desgastes; aceite y filtro del motor, líquido de refrigeración, filtro de aire, filtro de combustible, correa de distribución (¿bomba de agua?), batería, bujías de encendido y bujías de precalentamiento.","Deben revisarse siempre que el vehículo entre al taller para su mantenimiento. FILTROS DE HABITÁCULO. Si el resto de los filtros que se montan en un vehículo tienen como fin garantizar la salud del motor del coche, el de habitáculo se ocupa de la de salud de sus ocupantes.",0.998659372329712,2.877235382534101
esenciales,"Los frenos de disco usan un disco giratorio, que se encuentra entre las pastillas de los frenos montadas sobre calibres para reducir el movimiento del coche. Los frenos de tambor usan zapatas que empujan para afuera para contactar la parte inferior de un cilindro giratorio o tambor. Algunos coches contienen los dos tipos de frenos (un tipo para las ruedas delanteras y otro para las …","En ese sentido, la Dirección General de Tráfico (DGT) ha compartido una nota en la que especifica las cinco partes esenciales que deben limpiarse en un coche para evitar la propagación del ...","Como la mayoría de los automóviles que se fabrican y están en circulación son de combustión interna, vamos a analizar este tipo de motores. Así, un motor de combustión interna consta, de manera simplificada, de: Bloque y cilindros; Pistones; Cigüeñal; Culata y válvulas; Cárter inferior; El bloque del motor y los cilindros",0.9986194372177124,2.9485337099345155
dentro,"Tablero de instrumentos: se sitúa debajo del parabrisas, y es una serie de luces de diferentes colores que le informan de las distintas actuaciones o situaciones del propio vehículo. Asimismo, dispone de aparatos de mediciones como el velocímetro o indicador de velocidad.",Partes de un coche Motor Neumáticos Chasis Carrocería Parabrisas Asientos Tapicería Cuadros de mando,@juangangelEl primer automóvil con motor de combustión interna se atribuye a Karl Friedrich Benz en la ciudad de Mannheim en 1886 con el modelo Benz Patent-M...,0.9985997080802916,2.9102929217408477
decir,Partes de un coche Motor Neumáticos Chasis Carrocería Parabrisas Asientos Tapicería Cuadros de mando,"10 partes importantes de un automóvil mecánico Dirección. Controla las ruedas – la mejor manera es colocar las manos en lo que se conoce como posición “diez y dos”. La bocina. En la mayoría de los autos, la bocina está normalmente situada en el …","La suspensión del automóvil está formada por las ballestas, horquillas rótulas, muelles y amortiguadores, estabilizadores, ruedas y neumáticos. El bastidor del automóvil se puede considerar el cuerpo integrador de la suspensión. Está fijado a los brazos de los ejes mediante ballestas o …",0.998581886291504,2.8592176899416026
mismo,"El chasis es el esqueleto de un auto. Puede ser una estructura auto portante, como una cáscara o tipo H (escalera), donde se monta el resto del vehículo. El chasis es la estructura principal donde irán montados todos los componentes del vehículo. Foto de un Auto portante Subaru. Foto de un tipo escalera Toyota Hilux. Frenos de tambor",@juangangelEl primer automóvil con motor de combustión interna se atribuye a Karl Friedrich Benz en la ciudad de Mannheim en 1886 con el modelo Benz Patent-M...,"los automoviles modernos están compuestos por miles de partes, las cuales estan dispuestas de tal manera que cumplen la función especifica de desplazamiento del vehiculo, sin embargo un auto no solamente esta diseñado para esto, por eso esta dividido en muchos sistemas, entre ellos encontramos: el sistema de escape, el sistema de el el sistema de dirección, el sistema de …",0.9985727071762084,2.957297608577914
frenos,"El freno de tambor está formado por: el tambor de rueda, siendo la pieza giratoria del freno y receptora de la casi totalidad del calor desarrollado en el frenado, por el plato de anclaje o plato...",¿Cuáles son las partes de un sistema de frenos? Pedal. El conductor de un vehículo presiona el pedal de freno para detener el auto. La presión sobre el pedal mueve un... Cilindro prinicpal. El cilindro principal está ubicado directamente en …,"Partes del sistema de frenos. El sistema de frenos se conoce como uno de los tantos elementos de seguridad de mayor importancia en un auto. Este mecanismo otorga protección, posibilita detener al carro en movimiento. Los primeros sistemas de que se emplearon fueron pedazos grandes de madera colocados al frente de las llantas para producir fricción.",0.9985575079917908,2.8140528769273825
través,"Su misión es orientar las ruedas directrices (delanteras) en función de la trayectoria a seguir. El piñón gira con el eje de la dirección y mueve una cremallera por medio de rótulas y bieletas, lo que disminuye el esfuerzo del conductor para mover las ruedas directrices y orientar el vehículo.",El conjunto de componentes del automóvil que unen las ruedas con el chasis se denomina suspensión. Estos resortes metálicos y amortiguadores guían a las ruedas en su recorrido y transforman la energía cinética (de baches y cuestas) en calorífica.,"El chasis es el esqueleto de un auto. Puede ser una estructura auto portante, como una cáscara o tipo H (escalera), donde se monta el resto del vehículo. El chasis es la estructura principal donde irán montados todos los componentes del vehículo. Foto de un Chasis Auto portante Subaru. Foto de un Chasis tipo escalera Toyota Hilux. Frenos de tambor",0.9985451698303224,2.7720117539342843
combustión,"Pedales o mandos de pie. El Acelerador: se acciona con el pie derecho y su objetivo es regular la entrada de combustible en el motor. Al presionarlo aumenta la potencia y la velocidad, y también el consumo. Cuando no se pisa, el motor sólo recibe combustible para mantenerse en marcha, funcionando al …","La división primera y fundamental de un motor de combustión: Empezando por la culata, en la mayoría de los motores de combustión en ella se encuentra el árbol de levas, los balancines con sus correspondientes emujadores (taques) y varillas empujadoras , válvulas (admisión y escape), las entradas y salidas hacia los colectores de admisión y escape respectivamente.","Motor de combustión interna y sus partes El bloque motor Es lo que solemos denominar motor coche, y el resto de elementos van conectados a él. La combustión se... La culata La culata o cabeza del motor realiza la función de servir de soporte a …",0.9985243082046508,2.6924987898130315
material,"El Automóvil, Concepto, Evolución Histórica, Desarrollos Previos al Motor de Combustión Interna de Tipo Actual a Gasolina, El Concepto Moderno de Automóvil, Expansión de la Industria Automotriz en Europa y Estados Unidos, El en Principios de Siglo XX, Recorrido Cronológico del Nacimiento del , Primer Vehículo Propulsado a Vapor, Primer Motor a Explosión, Primer ...","Las puertas, el techo y los paneles de la carrocería están hechos de acero. Incluso algunas partes para acomodar el motor, y los escapes son hechos de acero inoxidable. Este material también se lo emplea para formar el chasis subyacente del vehículo o parte del esqueleto del coche, para así proteger a sus ocupantes en caso de un accidente.","En promedio un auto puede contener 1,350 kilógramos de acero, mientras que una camioneta lograría poseer alrededor de 1,800 Kg. En los autos el acero se usa para crear el chasis subyacente o la caja debajo del cuerpo que forma el esqueleto del vehículo y …",0.998523473739624,2.7582794619388804
funcionamiento,@juangangelEl primer automóvil con motor de combustión interna se atribuye a Karl Friedrich Benz en la ciudad de Mannheim en 1886 con el modelo Benz Patent-M...,"Su misión es orientar las ruedas directrices (delanteras) en función de la trayectoria a seguir. El piñón gira con el eje de la dirección y mueve una cremallera por medio de rótulas y bieletas, lo que disminuye el esfuerzo del conductor para mover las ruedas directrices y orientar el vehículo.",Partes de un auto y sus funciones El motor. Cada auto funciona con un motor y la mayoría de los autos usan un motor de combustión interna que opera con... La transmisión directa. La transmisión directa es una serie de componentes que conectan el movimiento producido por el... El sistema eléctrico. ...,0.9984803199768066,2.8691636651575774
información,"Chasis. El chasis es el esqueleto de un auto. Puede ser una estructura auto portante, como una cáscara o tipo H (escalera), donde se monta el resto del vehículo. El chasis es la estructura principal donde irán montados todos los componentes del vehículo. Foto de un Chasis Auto portante Subaru. Foto de un Chasis tipo escalera Toyota Hilux.","Descubre las partes de un coche de forma sencilla y conoce todo el rendimiento que puede ofrecerte tu vehículo. ¡Entra! Si a un niño le pides dibujar un coche, rápidamente trazará los círculos que forman los neumáticos, la forma de la carrocería, las lunas y, en algunos casos, las puertas o …",Anatomía de un automóvil: vehículo de carretera impulsado por un motor y utilizado para el transporte de personas. Maletero: lugar para guardar equipajes. Luz roja posterior: luz trasera que indica que el auto desacelera o se detiene. Rueda de repuesto: rueda de un auto utilizada para sustituir una rueda dañada.,0.9984459877014159,2.862635339287261
realizar,"El automóvil utiliza distintos sistemas que funcionan de manera simultánea, por lo que conocer estas partes básicas no solo facilita la detección de problemas, sino también ayuda a realizar ...","La dirección funciona mediante el giro de las ruedas delanteras, que se determina el rumbo que sigue el automóvil. El volante es su sistema de accionamiento. Este es, quizá, el concepto más sencillo e intuitivo de las partes del coche.","El chasis es el esqueleto de un auto. Puede ser una estructura auto portante, como una cáscara o tipo H (escalera), donde se monta el resto del vehículo. El chasis es la estructura principal donde irán montados todos los componentes del vehículo. Foto de un Chasis Auto portante Subaru. Foto de un Chasis tipo escalera Toyota Hilux. Frenos de tambor",0.998439073562622,2.9387416408823133
aire,"Partes y funcionamiento del aire acondicionado automotriz Condensador del aire acondicionado. El gas que ha sido comprimido pasa a la parte superior del condensador, donde... Filtro deshidratador del aire acondicionado. Mientras tiene lugar el proceso que acabamos de describir, el filtro... Válvula ...",Sistema de aire acondicionado standar para vehículoswww.haddadaire.cl,"De uno a tres cilindros, construidos en duraluminio o fundición de hierro, pistones de aluminio con uno o dos aros, bielas de aluminio o acero, cigüeñal de acero sobre cojinetes de bronce, bolas o agujas. Tienen un plato de válvulas de acero lapidado con válvulas de lamina de acero también lapidado, para",0.9984371662139891,2.780753863448837
dirección,Partes del sistema de dirección. El sistema de dirección está formado por una serie de elementos que funcionan coordinados para transmitir el movimiento desde el volante hasta las ruedas. Volante. Elemento circular mediante el cual el conductor controla la trayectoria de las ruedas. Barra de dirección.,"La historia de la dirección discurre paralela a la invención de la rueda y su aplicación al transporte.
En la naturaleza no existen ruedas y de hecho muchas civilizaciones -como las mesoamericanas- nunca llegaron a utilizarlas.
Una posible razón está en el aumento de efectividad asociado al empleo de elementos rotatorios frente a los deslizantes o a cargar directamente el animal. Los animales de tiro disponibles en la Eurasia de la ed…","0 Comentarios. La dirección está formada por varios elementos, los cuales hacen que las ruedas directrices del vehículo se muevan como quiera el conductor. Elementos: Volante; Consiente al conductor mover las ruedas directrices. Columna de dirección; Transfiere el movimiento del volante hasta la caja de engranajes.",0.9984279870986938,2.531409858104241
necesario,"Descubre las partes de un coche de forma sencilla y conoce todo el rendimiento que puede ofrecerte tu vehículo. ¡Entra! Si a un niño le pides dibujar un coche, rápidamente trazará los círculos que forman los neumáticos, la forma de la carrocería, las lunas y, en algunos casos, las puertas o …","El chasis es el esqueleto de un auto. Puede ser una estructura auto portante, como una cáscara o tipo H (escalera), donde se monta el resto del vehículo. El chasis es la estructura principal donde irán montados todos los componentes del vehículo. Foto de un Chasis Auto portante Subaru. Foto de un Chasis tipo escalera Toyota Hilux. Frenos de tambor","Aparte de los filtros surtidos familiares para la mayoría de los automovilistas, hay muchas partes de un coche que caen bajo la categoría de ""elementos de desgaste."" Los Frenos freno reparaciones y servicios del sistema son el dinero encima los responsables de los talleres de reparación más generales.",0.9984223246574402,2.8730164566676364
combustible,"Partes del sistema de alimentación de gasolina Tanque o depósito de combustible Es el depósito o alojamiento de combustible, tiene un tapón de drenaje, un orificio respiradero y una tapa de llenado. Un mecanismo indicador de nivel de combustible dentro del tanque y la tubería de conducción.",La bomba empuja la gasolina hacia el líneas de combustible. Hay líneas de combustible de metal duro en la mayoría de los vehículos que hacen funcionar el combustible desde el tanque hacia el motor.,Especialista de la marca DFSK Glory menciona las partes más importantes de un automóvil para el conocimiento de los usuarios.,0.9984207153320312,2.7430901824985874
cilindros,"En los motores de combustión interna tales como los utilizados en los vehículos automotores, se dispone un ingenioso arreglo de cilindros junto con pistones, válvulas, anillos y otros mecanismos de regulación y transmisión, pues allí es donde se realiza la explosión del combustible, es el origen de la fuerza mecánica del motor que se transforma luego en movimiento del vehículo.","El bloque del motor y los cilindros El bloque es una única pieza de hierro o aluminio que aloja los cilindros, los conductos para el líquido refrigerante y el aceite y el cigüeñal. Es, por tanto, la principal pieza estructural del motor.",Circuito de encendido: se encarga de producir la chispa en las bujías para que se inflame la mezcla carburada en los cilindros. Circuito de carga: es el que responde a la energía de la batería que consume el automóvil. de arranca el motor del vehículo haciéndolo girar a unas 50 r.p.m. (revoluciones por minuto). Esto se consigue con el motor eléctrico de arranque al recibir corriente …,0.9983974695205688,2.8089506377816753
vamos,"En él están comprendidos los circuitos de encendido, de carga, de arranque y de iluminación, con un elemento común que es la batería. Ésta proporciona energía eléctrica partiendo de una energía química producida por la reacción de un electrónico (disolución de agua destilada y ácido sulfúrico). Es necesario llevar un mantenimiento adecuado de la batería, comprobando y repostando el nivel de electrolito.",Partes de un coche Motor Neumáticos Chasis Carrocería Parabrisas Asientos Tapicería Cuadros de mando,Partes de un coche Motor Neumáticos Chasis Carrocería Parabrisas Asientos Tapicería Cuadros de mando,0.998390018939972,2.0
control,"El ECU, conocido también como la Unidad de Control del Motor, es el cerebro del auto. Este dispositivo controla el nivel de combustible que se suministra al motor, el aire, el punto de ignición, la apertura de válvulas, el turbocompresor, entre otros.","Su misión es orientar las ruedas directrices (delanteras) en función de la trayectoria a seguir. El piñón gira con el eje de la dirección y mueve una cremallera por medio de rótulas y bieletas, lo que disminuye el esfuerzo del conductor para mover las ruedas directrices y orientar el vehículo.","Los cambios se colocan en el centro del vehículo. Por lo general, un conductor usa su mano izquierda para controlar el pomo del engranaje, los autos modernos son modelos de 5 marchas. Las posiciones de los cambios, especialmente 1 – 4 deben ser conocidas por el nuevo conductor que ha optado por usar un automóvil mecánico. Ajuste del asiento",0.9983730316162108,2.940157876595519
potencia,"Pedales o mandos de pie. El Acelerador: se acciona con el pie derecho y su objetivo es regular la entrada de combustible en el motor. Al presionarlo aumenta la potencia y la velocidad, y también el consumo. Cuando no se pisa, el motor sólo recibe combustible para mantenerse en marcha, funcionando al …","El VIN es el Número de Identificación Vehicular o número de chasis de un automóvil. Es único para cada vehículo y queda grabado en algunas partes del mismo (en la parte inferior del parabrisas del conductor, en el chasis de la rueda delantera, en el marco de la puerta del conductor o en el motor del carro).","Las partes de un automovil. los automoviles modernos están compuestos por miles de partes, las cuales estan dispuestas de tal manera que cumplen la función especifica de desplazamiento del vehiculo, sin embargo un auto no solamente esta diseñado para esto, por eso esta dividido en muchos sistemas, entre ellos encontramos: el sistema de escape, el sistema de apoyo, el motor, el sistema de ...",0.9983702301979064,2.908944365715872
