word_added,s1,s2,s3,similarity_w,sum_cos
world,Lee Atentamente la Descripción! Información Y LINKS Nuestra Comunidad*Encuentra todo lo relacionado con nuestro servidor de habla hispana; The World Is O...,La emocionante carrera de Red Bull Soapbox [fotos] En esta singular carrera participan equipos de adultos con extraños carros fabricados en casa y que funcionan a base de pura gravedad.,PÁGINA OFICIAL DE SOAPBOX RACE WORLD:https://soapboxrace.worldPÁGINA DE DESCARGA DEL LANZADOR:https://github.com/SoapboxRaceWorld/GameLauncher_NFSW/releases/...,0.9729782342910767,0.04999136218835751
racing,UNA CARRERA PARA LOS LOCOS AVENTUREROS. Red Bull Soapbox Race 2020. Parque Metropolitano 14 de Marzo 2020.,"La carrera de autos locos Red Bull SoapBox Race inicia su etapa de postulaciones para partcipar con el más creativo, loco y rápido de los autos. En 2020 vuelve uno de los eventos más ...",Mira todos los accidentes y colisiones de la primera Red Bull Soapbox Race de Bulgaria. Así es una carrera de coches de madera sin frenos. ... 300 carreras para Red Bull Racing. F1.,0.9704931974411011,0.6463373143147679
grid,"La carrera de autos locos Red Bull SoapBox Race inicia su etapa de postulaciones para partcipar con el más creativo, loco y rápido de los autos. En 2020 vuelve uno de los eventos más ...",La emocionante carrera de Red Bull Soapbox [fotos] En esta singular carrera participan equipos de adultos con extraños carros fabricados en casa y que funcionan a base de pura gravedad.,"Red Bull Soapbox Race. Red Bull Soapbox Race 2020: Santiago de Chile. 14 Marzo 2020. Santiago, Chile. Guardar. Los mejores momentos ¡Fotos y videos! Ranking Final ¡El staff de pista!",0.9664642810821533,0.46137196187282414
locos,"Red Bull Soapbox Race: la carrera de ‘autos locos’ que estará este sábado en el Parque Metropolitano. Felipe Valdés B. 12 mar 2020 12:59 PM. Se esperan cerca de 10 mil asistentes a este evento de vehículos sin motor, que aprovechan la gravedad para circular por intrincados circuitos.",Regresan los autos locos de la Red Bull SoapBox Race La competencia vuelve a Santiago tras cuatro años de ausencia y se realizará en 2020 en el cerro San Cristóbal.,"Red Bull Soapbox Race, la competencia de autos sin motor tendrá lugar por primera vez en nuestro país y se enfrentarán a un circuito especialmente diseñado s...",0.9649233222007751,0.48531273424981997
soapbox,"Las carreras de Soapbox. Desde 1933, el Soapbox Derby existe y fue creado en los Estados Unidos, en la ciudad de Akron, en Ohio. Todos los meses de julio se celebra un campeonato donde el protagonista es un sin motor y marcas como Red Bull han puesto el ojo en la competencia, profesionalizándola y llevándola a todos los lugares del mundo.",La emocionante carrera de Red Bull Soapbox [fotos] En esta singular carrera participan equipos de adultos con extraños carros fabricados en casa y que funcionan a base de pura gravedad.,"La carrera de autos locos Red Bull SoapBox Race inicia su etapa de postulaciones para partcipar con el más creativo, loco y rápido de los autos. En 2020 vuelve uno de los eventos más ...",0.9596602916717529,0.24297489614997725
car,"La compañía Red Bull celebra el domingo 14 de julio su anual 'Soapbox race', una carrera internacional de autos locos que reúne a varios equipos con sus bólidos artesanos con el objetivo de ...","En esta peculiar carrera, tendrás que construir tu coche con materiales desechables y diseñar una carretera repleta de trampas, saltos, giros y piruetas. Cuanto más lo compliques, más puntos obtendrás. Siempre y cuando llegues a la meta, claro.","Esta es una carrera en grupo. Y si a eso le sumamos que los autos no pueden utilizar un motor, el resto del equipo pasa a ser vital a la hora de impulsar los primeros movimientos del carro.",0.9571013450622559,0.07931393135233117
angeles,"Más de 60 vehículos ""caseros"" participaron en la carrera ""SoapBox"" este fin de semana en Los Ángeles, logrando congregar a cerca de 55.000 asistentes. Entre los equipos participantes estaba el ""Elote Loco"", un …","Esta es una carrera en grupo. Y si a eso le sumamos que los autos no pueden utilizar un motor, el resto del equipo pasa a ser vital a la hora de impulsar los primeros movimientos del carro.","SOAP, Contrata tu Seguro Obligatorio de Accidentes Personales (SOAP) y cumple tus obligaciones como conductor. Obtén una Cobertura de hasta UF 300 para todos los afectados en un accidente automovilístico en el que esté involucrado tu vehículo.",0.9563947319984436,0.02299742028704729
red,"La carrera de autos locos Red Bull SoapBox Race inicia su etapa de postulaciones para partcipar con el más creativo, loco y rápido de los autos. En 2020 vuelve uno de los eventos más ...","Red Bull Soapbox Race: la carrera de ‘autos locos’ que estará este sábado en el Parque Metropolitano. Felipe Valdés B. 12 mar 2020 12:59 PM. Se esperan cerca de 10 mil asistentes a este evento de vehículos sin motor, que aprovechan la gravedad para circular por intrincados circuitos.","Como cada año, el deporte motor disfruta una de las carreras más divertidas y raras en el mundo, la Red Bull Soapbox Race , realizada en Alexandra Palace en Londres, donde los participantes lucen su creatividad para desarrollar vehículos hechos con cajas de cartón. Con más de 13 años de creación en Bruselas, la carrera Soapbox Race, busca unir a aficionados a las carreras para desafiar ...",0.9515326619148254,0.4237755396639767
coches,"Misterio descifrado. Hyundai ha desvelado este lunes las peculiaridades del Hyundai Soapbox racer, su enigmático coche de carreras sin motor que anticipó a …","En 2020 vuelve uno de los eventos más entretenidos y desafiantes del mundo a Santiago. Tras cuatro años de ausencia, SoapBox Race, que en 2016 se realizó en la comuna de La Reina, regresará durante el primer semestre de 2020 y ya están abiertas las postulaciones para los valientes (y suficientemente locos) que quieran participar. Red Bull Soapbox Race es un evento abierto al público ...","Buscando inspiración en algunos vehículos de la marca, y siguiendo la nueva identidad de la firma, el Concept 45 fue de gran ayuda, ya que en el tratamiento superficial del cuerpo de la caja, los paneles planos y la silueta en forma de cuña, se inspiran en el modelo antes mencionado. Materiales. El Hyundai Soapbox está hecho de madera, varillas de metal y materiales de conexión como ...",0.9515076875686646,0.10912844262788994
driver,"El Soapbox está hecho de madera, varillas metálicas y materiales de conexión como escuadras, abrazaderas y tornillos.Las ruedas son de una carretilla y …","La compañía Red Bull celebra el domingo 14 de julio su anual 'Soapbox race', una carrera internacional de autos locos que reúne a varios equipos con sus bólidos artesanos con el objetivo de ...",La emocionante carrera de Red Bull Soapbox [fotos] En esta singular carrera participan equipos de adultos con extraños carros fabricados en casa y que funcionan a base de pura gravedad.,0.9513406157493591,0.21128374691145138
cdmx,"Una carrera donde los coches no tiene motor y, además de la velocidad, es necesario creatividad y originalidad. Esta es la fórmula de Red Bull Soapbox Race CDMX 2016.","amigos, este 11 de septiembre se realizara el 1er red bull soapbox en la ciudad de mexico, se realizara en GALERIAS ATIZAPAN, la cita es a las 11 de la mañana, la entrada es gratis, estare ...",Red Bull Soapbox Race CDMX 2016. 11 Septiembre 2016. Guardar. Red Bull Soapbox Race es una carrera donde las estrellas son los coches …,0.9505734443664551,0.8185957662685305
organiza,"La compañía Red Bull celebra el domingo 14 de julio su anual 'Soapbox race', una carrera internacional de autos locos que reúne a varios equipos con sus bólidos artesanos con el objetivo de ...","Red Bull Soapbox Race es una carrera de autos locos que se realiza en todo el mundo, abierto al público, donde cada equipo puede inscribirse y …","Descargue la foto editorial Tornac, Francia - 08 de octubre de 2016: carrera de soapbox organizada en el pueblo de Tornac, situado en el departamento francés de Gard. La barra instalada durante toda la carrera 129346238 de la colección de millones de fotos, vectores e …",0.9491785764694214,0.34781429729353674
derby,"Este coche fue creado a partir de las carreras Soapbox Derby fundadas en 1933 en la ciudad de Akron, en Ohio, Estados Unidos. Todos los meses de Julio se celebra este campeonato donde el ...","Este coche fue creado a partir de las carreras Soapbox Derby fundadas en 1933 en la ciudad de Akron, en Ohio, Estados Unidos. ... dar un paso hacia delante en la evolución del automóvil es ...","The Soap Box Derby is a youth soapbox car racing program which has been run in the United States since 1933. World Championship finals are held each July at Derby Downs in Akron, Ohio.Cars competing in this and related events are unpowered, relying completely upon gravity to move.",0.9446269273757935,0.7201212025030972
carros,"La carrera de autos locos Red Bull SoapBox Race inicia su etapa de postulaciones para partcipar con el más creativo, loco y rápido de los autos. En 2020 vuelve uno de los eventos más ...",La emocionante carrera de Red Bull Soapbox [fotos] En esta singular carrera participan equipos de adultos con extraños carros fabricados en casa y que funcionan a base de pura gravedad.,"Red Bull SoapBox Race 2020: Vuelve al Cerro San Cristóbal la carrera de autos locos más entretenida de Chile Mucha atención, que ya comenzó la etapa de postulaciones para partcipar con el más creativo, loco y rápido de los de Santiago",0.9436342716217041,0.8295132490151285
race,La emocionante carrera de Red Bull Soapbox [fotos] En esta singular carrera participan equipos de adultos con extraños carros fabricados en casa y que funcionan a base de pura gravedad.,"¡Vuelve a Santiago la ya conocida Red Bull Soapbox Race! A partir de hoy y hasta finales de septiembre se estarán recibiendo las postulaciones de los equipos más locos y valientes de Chile, donde tendrán que ingeniárselas para dar con un auto que combine creatividad, locura y velocidad.","La carrera de autos locos Red Bull SoapBox Race inicia su etapa de postulaciones para partcipar con el más creativo, loco y rápido de los autos. En 2020 vuelve uno de los eventos más ...",0.9425622224807739,0.40234039766145874
hex,La emocionante carrera de Red Bull Soapbox [fotos] En esta singular carrera participan equipos de adultos con extraños carros fabricados en casa y que funcionan a base de pura gravedad.,"¡Vuelve a Santiago la ya conocida Red Bull Soapbox Race! A partir de hoy y hasta finales de septiembre se estarán recibiendo las postulaciones de los equipos más locos y valientes de Chile, donde tendrán que ingeniárselas para dar con un auto que combine creatividad, locura y velocidad.","Este coche fue creado a partir de las carreras Soapbox Derby fundadas en 1933 en la ciudad de Akron, en Ohio, Estados Unidos. Todos los meses de Julio se celebra este campeonato donde el ...",0.941773533821106,0.1755991569955386
pinewood,"Cómo construir un coche de carreras del Derby de Pinewood Para Lobatos y Lobeznas, las razas de Pinewood Derby son uno de los eventos más emocionantes del año Scout. Versiones más pequeñas del Derby, Derby los coches son coches modelo construidos por los mismos Scouts. Una vez completada la","Pinewood Derby coches son impresionantes, los niños el amor que los hacen y aprenden mucho acerca de carpintería, pintura, aerodinámica y el peso de la distribución. ... Una carrera de gravedad es básicamente un derby de . de coches por una colina alimentada sólo por la gravedad.","Este coche fue creado a partir de las carreras Soapbox Derby fundadas en 1933 en la ciudad de Akron, en Ohio, Estados Unidos. Todos los meses de Julio se celebra este campeonato donde el ...",0.9372754096984863,0.4338526462974898
bull,"Red Bull Soapbox Race: la carrera de ‘autos locos’ que estará este sábado en el Parque Metropolitano. Felipe Valdés B. 12 mar 2020 12:59 PM. Se esperan cerca de 10 mil asistentes a este evento de vehículos sin motor, que aprovechan la gravedad para circular por intrincados circuitos.",UNA CARRERA PARA LOS LOCOS AVENTUREROS. Red Bull Soapbox Race 2020. Parque Metropolitano 14 de Marzo 2020.,Mira todos los accidentes y colisiones de la primera Red Bull Soapbox Race de Bulgaria. Así es una carrera de coches de madera sin frenos. ... 300 carreras para Red Bull Racing.,0.9358533024787903,0.6031695269853978
cars,"Frank Bankonin makes exclusive soapbox cars by hand -- based on classic designs by Bugatti, Ferrari, or Bentley. Bankonin fulfills the childhood dreams of hi...","Escucha bien en tu interior, es una sensación única que solo tú puedes sentir, forma parte de ti, te representa y proyecta quien eres. No pongas freno a tus impulsos y déjate llevar por tu intuición.","amigos, este 11 de septiembre se realizara el 1er red bull soapbox en la ciudad de mexico, se realizara en GALERIAS ATIZAPAN, la cita es a las 11 de la mañana, la entrada es gratis, estare ...",0.9347470998764038,0.016554696165640086
carreras,"A una carrera de Soapbox asisten cerca de 40,000 espectadores, cifra récord para muchos deportes en el mundo. Los participantes ahora son de todas las edades y características, sin embargo, las carreras tradicionales fueron creadas para niños de hasta 13 años. Una carrera promedio en los Estados Unidos registra más de 300 corredores inscritos.",El sector del automóvil supone el 10% del PIB nacional. La Universidad Nebrija fue pionera en ofrecer el Grado en Ingeniería del Automóvil en España en su apuesta por ofrecer titulaciones universitarias en áreas estratégicas para nuestro país. El Grado ofrece al alumno asignaturas con una sólida,"Grupo Carrera, Talleres Carrera, Automoviles el puente, puente pasaje, automoviles, vehiculos, cohes, coches de segunda mano, coches de ocasión, vehículos de ocasión, vehículos de segunda mano, automoviesde ocasion, automoviles de segunda mano, citroen, coruña, coches seminuevos, vehiculos seminuevos, vehiculos de importación, automviles de importación",0.9347155690193176,0.03487396921361635
divertida,"Hyundai ha desvelado este lunes las peculiaridades del Hyundai Soapbox racer, su enigmático coche de carreras sin motor que anticipó a finales …",Súbete a los autos más locos de esta divertida carrera con este vídeo hecho con GoPro. Por Tarquin Cooper Publicado el 03.11.2016  14:16 GMT. ... La loca carrera Red Bull Soapbox de Bakú ...,"Como cada año, el deporte motor disfruta una de las carreras más divertidas y raras en el mundo, la Red Bull Soapbox Race , realizada en Alexandra Palace en Londres, donde los participantes lucen su creatividad para desarrollar vehículos hechos con cajas de cartón. Con más de 13 años de creación en Bruselas, la carrera Soapbox Race, busca unir a aficionados a las carreras para desafiar ...",0.933912992477417,0.2183071407011871
build,I show you how to build a soapbox derby car. I won 1st place in my local soapbox derby race with this car design. Check out my footage of the crashe...,"Esta es una carrera en grupo. Y si a eso le sumamos que los autos no pueden utilizar un motor, el resto del equipo pasa a ser vital a la hora de impulsar los primeros movimientos del carro.","Cómo hacer un carro de plataforma improvisada. Un auto de carreras soapbox, también llamado carrito de colina en Australia, normalmente esta hecho de madera y usado para competencias en carreras. Para manejarlo tienes que usar ambos pies y...",0.9324197769165039,0.06063878740721489
noviembre,"Este domingo en la comuna de La Reina (Santiago, Chile) se realizará la original competencia Red Bull Soapbox Race, que por segunda vez se realiza en el país con 48 “autos locos” se lanzarán en una pista de 400 metros con obstáculos en la empinada calle Talinay de La Reina, este domingo 27 de , desde las 11:00 horas. Este panorama familiar es gratuito.","Este 27 de noviembre vuelve a Chile la carrera más loca y creativa de todas, y es que Soap Box Race espera llenar de vida y de colores las calles de Santiago.","Lunes 28, Noviembre 2016 [FOTOS] Red Bull Soapbox Race: así fue la carrera de ""autos locos"" en Chile Por segunda vez en Chile, se llevó a cabo el Red Bull Soapbox Race, la emblemática carrera de los “autos locos” que se realiza en distintos países del mundo y que busca convertirse en un divertido panorama de fin de semana.",0.9313187003135681,0.5067332382830843
autos,"Las carreras de Soapbox. Desde 1933, el Soapbox Derby existe y fue creado en los Estados Unidos, en la ciudad de Akron, en Ohio. Todos los meses de julio se celebra un campeonato donde el protagonista es un auto sin motor y marcas como Red Bull han puesto el ojo en la competencia, profesionalizándola y llevándola a todos los lugares del mundo.","La carrera de autos locos Red Bull SoapBox Race inicia su etapa de postulaciones para partcipar con el más creativo, loco y rápido de los autos. En 2020 vuelve uno de los eventos más ...","Red Bull SoapBox Race 2020: Vuelve al Cerro San Cristóbal la carrera de autos locos más entretenida de Chile Mucha atención, que ya comenzó la etapa de postulaciones para partcipar con el más creativo, loco y rápido de los autos de Santiago",0.9298955202102661,0.7893420447795555
soar,"Este coche fue creado a partir de las carreras Soapbox Derby fundadas en 1933 en la ciudad de Akron, en Ohio, Estados Unidos. Todos los meses de Julio se celebra este campeonato donde el ...","La carrera ‘Red Bull Soapbox Race’ se realiza en países como Chile, Brasil, España, Italia y Alemania. Y los más sorprende de la carrera son los diseños extraordinarios y sus poderosas ...","A una carrera de Soapbox asisten cerca de 40,000 espectadores, cifra récord para muchos deportes en el mundo. Los participantes ahora son de todas las edades y características, sin embargo, las carreras tradicionales fueron creadas para niños de hasta 13 años. Una carrera promedio en los Estados Unidos registra más de 300 corredores inscritos.",0.9291286468505859,0.18280599014075205
american,"Hyundai ha desvelado este lunes las peculiaridades del Hyundai Soapbox racer, su enigmático coche de carreras sin motor que anticipó a finales …","Si este verano no hubiera sufrido las restricciones contra la pandemia del coronavirus, habríamos podido ver alguna de las tradicionales carreras de carretones, trastos o carros que proluferan en las fiestas mayores.Hyundai ha querido tomar el relevo de esos vehículos ausentes con el nuevo Soapbox Ride, un carretón pasado por el centro de diseño de Hyundai en Europa.","Vuelve uno de los eventos más entretenidos y desafiantes del mundo a Santiago.Tras cuatro años de ausencia, la Red Bull SoapBox Race, que en 2016 se realizó en La Reina, regresará durante el ...",0.9275929927825928,0.20181748170534838
racer,"Misterio descifrado. Hyundai ha desvelado este lunes las peculiaridades del Hyundai Soapbox racer, su enigmático coche de carreras sin motor que anticipó a …","Si este verano no hubiera sufrido las restricciones contra la pandemia del coronavirus, habríamos podido ver alguna de las tradicionales carreras de carretones, trastos o carros que proluferan en las fiestas mayores.Hyundai ha querido tomar el relevo de esos vehículos ausentes con el nuevo Ride, un carretón pasado por el centro de diseño de Hyundai en Europa.","La carrera ‘Red Bull Soapbox Race’ se realiza en países como Chile, Brasil, España, Italia y Alemania. Y los más sorprende de la carrera son los diseños extraordinarios y sus poderosas ...",0.9273920059204102,0.18108972816327085
santiago,"La carrera de autos locos Red Bull SoapBox Race inicia su etapa de postulaciones para partcipar con el más creativo, loco y rápido de los autos. En 2020 vuelve uno de los eventos más ...","Vuelve uno de los eventos más entretenidos y desafiantes de Santiago. El Red Bull Soapbox Race, que en 2016 se realizó en la comuna de La Reina, volverá durante el primer semestre de 2020 y ya ...","Red Bull Soapbox Race. Red Bull Soapbox Race 2020: Santiago de Chile. 14 Marzo 2020. Santiago, Chile. Guardar. Los mejores momentos ¡Fotos y videos! Ranking Final ¡El staff de pista!",0.927347719669342,0.6829506554942697
domingo,"La compañía Red Bull celebra el domingo 14 de julio su anual 'Soapbox race', una carrera internacional de autos locos que reúne a varios equipos con sus bólidos artesanos con el objetivo de ...","Red Bull Soapbox Race es una carrera de autos locos que se realiza en todo el mundo, abierto al público, donde cada equipo puede inscribirse y …","Para quienes asistan al Soapbox Race, la carrera contará con un circuito cerrado de televisión que dará a los asistentes la opción de ver el recorrido completo sin importar en qué parte se encuentren.Se podrá seguir a los participantes mientras recorren una pista que incorpora saltos, peraltes, curvas y obstáculos sorpresa.",0.9242625832557678,0.3536725907486325
primera,"Este coche fue creado a partir de las carreras Soapbox Derby fundadas en 1933 en la ciudad de Akron, en Ohio, Estados Unidos. Todos los meses de Julio se celebra este campeonato donde el ...","Este es el primer automóvil sin motor ... Este coche fue creado a partir de las carreras Soapbox Derby fundadas en 1933 en la ciudad de Akron, en Ohio, Estados Unidos. Todos los meses de Julio se ...","La carrera de autos locos Red Bull SoapBox Race inicia su etapa de postulaciones para partcipar con el más creativo, loco y rápido de los autos. En 2020 vuelve uno de los eventos más ...",0.9228508472442627,0.8085317364537831
event,"En 2020 vuelve uno de los eventos más entretenidos y desafiantes del mundo a Santiago. Tras cuatro años de ausencia, SoapBox Race, que en 2016 se realizó en la comuna de La Reina, regresará durante el primer semestre de 2020 y ya están abiertas las postulaciones para los valientes (y suficientemente locos) que quieran participar. Red Bull Soapbox Race es un evento abierto al público ...","Vuelve uno de los eventos más entretenidos y desafiantes de Santiago. El Red Bull Soapbox Race, que en 2016 se realizó en la comuna de La Reina, volverá durante el primer semestre de 2020 y ya ...","Para quienes asistan al Soapbox Race, la carrera contará con un circuito cerrado de televisión que dará a los asistentes la opción de ver el recorrido completo sin importar en qué parte se encuentren.Se podrá seguir a los participantes mientras recorren una pista que incorpora saltos, peraltes, curvas y obstáculos sorpresa.",0.9223650693893433,0.7011355509893108
ca,"Buscando inspiración en algunos vehículos de la marca, y siguiendo la nueva identidad de la firma, el Concept 45 fue de gran ayuda, ya que en el tratamiento superficial del cuerpo de la caja, los paneles planos y la silueta en forma de cuña, se inspiran en el modelo antes mencionado. Materiales. El Hyundai Soapbox está hecho de madera, varillas de metal y materiales de conexión como ...","Para quienes asistan al Soapbox Race, la carrera contará con un circuito cerrado de televisión que dará a los asistentes la opción de ver el recorrido completo sin importar en qué parte se encuentren.Se podrá seguir a los participantes mientras recorren una pista que incorpora saltos, peraltes, curvas y obstáculos sorpresa.","Este 27 de noviembre vuelve a Chile la carrera más loca y creativa de todas, y es que Soap Box Race espera llenar de vida y de colores las calles de Santiago.",0.9216787219047546,0.0623281205180144
annual,"La compañía Red Bull celebra el domingo 14 de julio su anual 'Soapbox race', una carrera internacional de autos locos que reúne a varios equipos con sus bólidos artesanos con el objetivo de ...","Este coche fue creado a partir de las carreras Soapbox Derby fundadas en 1933 en la ciudad de Akron, en Ohio, Estados Unidos. Todos los meses de Julio se celebra este campeonato donde el ...",Numerosos participantes han mostrado sus peculiares modelos de automóvil en la Red Bull Soapbox Race que se ha celebrado en la localidad belga de Kluisbergen,0.9213559031486511,0.26575760955317396
stock,"Descubra Soap Box Derby o Soapbox Car imágenes de stock en HD y millones de otras fotos, ilustraciones y vectores en stock libres de regalías en la colección de Shutterstock. Se agregan miles de imágenes nuevas de alta calidad todos los días.","Foto de Soapbox coche carrera en Munich Imagen Disponible en Alta Resolución, Descarga inmediata. small: 727 x 485 Pixels, medium: 1258 x 839 Pixels, large: 3600 x 2400 Pixels,",La emocionante carrera de Red Bull Soapbox [fotos] En esta singular carrera participan equipos de adultos con extraños carros fabricados en casa y que funcionan a base de pura gravedad.,0.9213318824768066,0.12513107675416485
chile,"Red Bull Soapbox Race. Red Bull Soapbox Race 2020: Santiago de Chile. 14 Marzo 2020. Santiago, Chile. Guardar. Los mejores momentos ¡Fotos y videos! Ranking Final ¡El staff de pista!",Regresan los autos locos de la Red Bull SoapBox Race La competencia vuelve a Santiago tras cuatro años de ausencia y se realizará en 2020 en el cerro San Cristóbal.,"Red Bull SoapBox Race 2020: Vuelve al Cerro San Cristóbal la carrera de autos locos más entretenida de Chile Mucha atención, que ya comenzó la etapa de postulaciones para partcipar con el más creativo, loco y rápido de los autos de Santiago",0.9213122129440308,0.9644918741157782
