word_added,s1,s2,s3,similarity_w,sum_cos
méxico,"Si aún tienen dudas puedes entrar al siguiente link: ¡Reglas de la carrera, aquí! Red Bull Soapbox Race será en la ciudad de México, la locación se las revelaremos pronto. ¡Nos vemos el 11 ...","A una carrera de Soapbox asisten cerca de 40,000 espectadores, cifra récord para muchos deportes en el mundo. Los participantes ahora son de todas las edades y características, sin embargo, las carreras tradicionales fueron creadas para niños de hasta 13 años. Una carrera promedio en los Estados Unidos registra más de 300 corredores inscritos.","Bienvenidos. El Automóvil Club de México, les da la mas cordial bienvenida a explorar su página y ver los servicios que brindamos para su comodidad, entre los servicios que se brindan se cuenta con la expedición de los Permisos Internacionales para Conducir (PIC´S) y su escuela de manejo de alto nível.",0.9206877946853638,0.06948380331482396
youth,"La carrera de autos locos Red Bull SoapBox Race inicia su etapa de postulaciones para partcipar con el más creativo, loco y rápido de los autos. En 2020 vuelve uno de los eventos más ...",La emocionante carrera de Red Bull Soapbox [fotos] En esta singular carrera participan equipos de adultos con extraños carros fabricados en casa y que funcionan a base de pura gravedad.,"Esta es una carrera en grupo. Y si a eso le sumamos que los autos no pueden utilizar un motor, el resto del equipo pasa a ser vital a la hora de impulsar los primeros movimientos del carro.",0.9200317859649658,0.2558611713355944
evento,"El último gran evento del 2020: Así fue el Soapbox Race Chile, la loca carrera de autos. ... Red Bull Soapbox Race es una carrera de autos locos que se realiza en todo el mundo, abierto al ...","Red Bull Soapbox Race es un evento que se realiza en todo el mundo, abierto al público, donde cada equipo puede inscribirse y participar diseñando y construyendo sus propios autos. Cada máquina que participa hecha a mano es alimentada por puro coraje, fuerza de la gravedad y un poco de Red Bull.","En 2020 vuelve uno de los eventos más entretenidos y desafiantes del mundo a Santiago. Tras cuatro años de ausencia, SoapBox Race, que en 2016 se realizó en la comuna de La Reina, regresará durante el primer semestre de 2020 y ya están abiertas las postulaciones para los valientes (y suficientemente locos) que quieran participar. Red Bull Soapbox Race es un evento abierto al público ...",0.9196287393569946,0.7651246183851574
vez,"Hyundai ha desvelado este lunes las peculiaridades del Hyundai Soapbox racer, su enigmático coche de carreras sin motor que anticipó a finales …","Esta es una carrera en grupo. Y si a eso le sumamos que los autos no pueden utilizar un motor, el resto del equipo pasa a ser vital a la hora de impulsar los primeros movimientos del carro.","Buscando inspiración en algunos vehículos de la marca, y siguiendo la nueva identidad de la firma, el Concept 45 fue de gran ayuda, ya que en el tratamiento superficial del cuerpo de la caja, los paneles planos y la silueta en forma de cuña, se inspiran en el modelo antes mencionado. Materiales. El Hyundai está hecho de madera, varillas de metal y materiales de conexión como ...",0.9194047451019287,0.1020481330972064
realiza,"La peculiar carrera de Soapbox se realizó por segunda ocasión en Ammán, Jordania. Sesenta participantes usaron su imaginación para construir carros con diseños singulares.","Red Bull Soapbox Race es una carrera de autos locos que se realiza en todo el mundo, abierto al público, donde cada equipo puede inscribirse y …","Se espera que unas 10 mil personas lleguen este sábado al Parque Metropolitano de Santiago para celebrar la tercera edición del Red Bull Soapbox Race. Esta carrera, que se realiza en varios países del mundo, tendrá a 35 autos locos bajando por una pista donde los pilotos podrán alcanzar velocidades cercanas a los 40 km/h.",0.9191147685050964,0.33283380792078776
london,"Como cada año, el deporte motor disfruta una de las carreras más divertidas y raras en el mundo, la Red Bull Soapbox Race , realizada en Alexandra Palace en Londres, donde los participantes lucen su creatividad para desarrollar vehículos hechos con cajas de cartón. Con más de 13 años de creación en Bruselas, la Race, busca unir a aficionados a las para desafiar ...","Un vistazo a los mejores momentos de la carrera Red Bull Soapbox en 2019. ... ¡Las carreras más rápidas, los bólidos más locos y las caídas más desastrosas en Londres! Ver más.",Red Bull Soapbox London 2019 Part 2Results Red Bull London 20191 TEAM GAS GAS GAS2 BUMBLEBEE BRAWL3 TEAM APOLLOCALYPTIC - MISSION ACCOMPLISHED4 THE THIRLBY J...,0.9189204573631287,0.3194442108616299
teams,"Video, when done well, is the ultimate tool for building trust at scale because it’s the closest thing possible to an in-person interaction, and Soapbox for ...",Turn Microsoft Teams conversations into agendas. Build your agenda naturally and collaboratively by adding agenda items when they pop up in conversation. Simply switch to the SoapBox tab and add to your team meeting agenda. SoapBox also prompts teams to add things to the agenda between meetings. No more awkward silences (or excuses!).,"SoapBox Features. Build shared agendas- Allow your team members to build and collaborate on team meeting agenda items. Add Suggested Agenda Items- Shuffle through and add suggested agenda items to your meetings. Check items off as you tackle them- As you have your meeting tick off things you’ve completed, or if you haven’t gotten to an agenda item it will automatically roll over …",0.9188624620437622,0.6758402695217691
argentina,"Se viene el Soapbox Argentina, la carrera de carros locos más divertida del mundo. El 10 de noviembre se hara la carrera mas alocada y divertida de carros temáticos en Bueno Aires, con 4 carros ...",Carburando lo mas importante del automovilismo deportivo Argentino. Todos los detalles de las carreras de autos en un solo lugar.,Cuenta la historia de una auto de carreras diseñado y construido por Rotor Cars en la Argentina para luego ser llevado a competir a Inglaterra. Con la base de un motor Ford A de 1929 de origen Argentino comienza una aventura donde el entusiasmo y la camaradería son …,0.9174141883850098,0.13759113867589007
mundo,"A una carrera de Soapbox asisten cerca de 40,000 espectadores, cifra récord para muchos deportes en el mundo. Los participantes ahora son de todas las edades y características, sin embargo, las tradicionales fueron creadas para niños de hasta 13 años. Una promedio en los Estados Unidos registra más de 300 corredores inscritos.","Red Bull Soapbox Race es un evento que se realiza en todo el mundo, abierto al público, donde cada equipo puede inscribirse y participar diseñando y construyendo sus propios autos. Cada máquina que participa hecha a mano es alimentada por puro coraje, fuerza de la gravedad y un poco de Red Bull.","Un vistazo a los mejores momentos de la carrera Red Bull Soapbox en 2019. ... Descubre el Mundo de Red Bull. Sam Bloom, campeona de surf adaptado: “Eres más valiente de lo que piensas” ...",0.9172425270080566,0.2953145429977163
anual,"La compañía Red Bull celebra el domingo 14 de julio su anual 'Soapbox race', una carrera internacional de autos locos que reúne a varios equipos con sus bólidos artesanos con el objetivo de ...","La carrera ‘Red Bull Soapbox Race’ se realiza en países como Chile, Brasil, España, Italia y Alemania. Y los más sorprende de la carrera son los diseños extraordinarios y sus poderosas ...","Promoción ""CONTRATA TU SOAP Y PARTICIPA POR UNA GIFT CARD"" es válida desde el 18 de marzo de 2021 al 11 de abril de 2021 ambas fechas inclusive, para todas las personas que contraten su Seguro Obligatorio de Accidentes Personales a través de la web seguros.sura.cl, de la aplicación móvil de Seguros SURA o del número de venta por WhatsApp de Seguros SURA (+56921877179).",0.9150415062904358,0.19225608831487603
school,La emocionante carrera de Red Bull Soapbox [fotos] En esta singular carrera participan equipos de adultos con extraños carros fabricados en casa y que funcionan a base de pura gravedad.,"Buscando inspiración en algunos vehículos de la marca, y siguiendo la nueva identidad de la firma, el Concept 45 fue de gran ayuda, ya que en el tratamiento superficial del cuerpo de la caja, los paneles planos y la silueta en forma de cuña, se inspiran en el modelo antes mencionado. Materiales. El Hyundai Soapbox está hecho de madera, varillas de metal y materiales de conexión como ...","Este coche fue creado a partir de las carreras Soapbox Derby fundadas en 1933 en la ciudad de Akron, en Ohio, Estados Unidos. Todos los meses de Julio se celebra este campeonato donde el ...",0.9150357246398926,0.03873169672912609
box,La emocionante carrera de Red Bull Soapbox [fotos] En esta singular carrera participan equipos de adultos con extraños carros fabricados en casa y que funcionan a base de pura gravedad.,"La carrera de autos locos Red Bull SoapBox Race inicia su etapa de postulaciones para partcipar con el más creativo, loco y rápido de los autos. En 2020 vuelve uno de los eventos más ...","Este coche fue creado a partir de las carreras Soapbox Derby fundadas en 1933 en la ciudad de Akron, en Ohio, Estados Unidos. Todos los meses de Julio se celebra este campeonato donde el ...",0.9145691990852356,0.16622414760922283
soap,La emocionante carrera de Red Bull Soapbox [fotos] En esta singular carrera participan equipos de adultos con extraños carros fabricados en casa y que funcionan a base de pura gravedad.,"La carrera de autos locos Red Bull SoapBox Race inicia su etapa de postulaciones para partcipar con el más creativo, loco y rápido de los autos. En 2020 vuelve uno de los eventos más ...","Por segunda vez en Chile, se llevó a cabo el Red Bull Soapbox Race, la emblemática carrera de los “autos locos” que se realiza en distintos países del mundo y que busca convertirse en un divertido panorama de fin de semana. En esta ocasión, el evento tuvo lugar en la región Metropolitana, en la comuna de La Reina.",0.9142366647720337,0.3770053291137252
best,Red Bull Soapbox Croatia 2019 Part 1#mrlowe #redbullsoapboxrace,La emocionante carrera de Red Bull Soapbox [fotos] En esta singular carrera participan equipos de adultos con extraños carros fabricados en casa y que funcionan a base de pura gravedad.,Red Bull Soapbox Race Croatia 2019 #mrlowe #redbullsoapboxrace,0.9137277603149414,1.0238771120355732
company,La emocionante carrera de Red Bull Soapbox [fotos] En esta singular carrera participan equipos de adultos con extraños carros fabricados en casa y que funcionan a base de pura gravedad.,"Esta es una carrera en grupo. Y si a eso le sumamos que los autos no pueden utilizar un motor, el resto del equipo pasa a ser vital a la hora de impulsar los primeros movimientos del carro.","amigos, este 11 de septiembre se realizara el 1er red bull soapbox en la ciudad de mexico, se realizara en GALERIAS ATIZAPAN, la cita es a las 11 de la mañana, la entrada es gratis, estare ...",0.9134556651115417,0.1323165046673733
