word_added,s1,s2,s3,similarity_w,sum_cos
principales,"Una de las partes más visibles del coche es el panel de luminosos del salpicadero. La mayoría de los conductores son conscientes del velocímetro y del medidor de gasolina, pero hay otros elementos que tienen igual o más importancia. El tacómetro, que indica la velocid ad del motor en rotaciones por minuto (RPM).","Pedales o mandos de pie. El Acelerador: se acciona con el pie derecho y su objetivo es regular la entrada de combustible en el motor. Al presionarlo aumenta la potencia y la velocidad, y también el consumo. Cuando no se pisa, el motor sólo recibe combustible para mantenerse en marcha, funcionando al …","Un automóvil es más que eso, ya solo el motor entraña gran complejidad. Sin embargo, hagámoslo simple como el dibujo de un niño. Descubre, en Kilómetros que cuentan, las partes de un de forma sencilla y conoce todo el rendimiento que puede ofrecerte tu …",0.9990766048431396,2.893993541256883
sistemas,"Chasis. El chasis es el esqueleto de un auto. Puede ser una estructura auto portante, como una cáscara o tipo H (escalera), donde se monta el resto del vehículo. El chasis es la estructura principal donde irán montados todos los componentes del vehículo. Foto de un Chasis Auto portante Subaru. Foto de un Chasis tipo escalera Toyota Hilux.","Es, digamos el enchufe entre el motor y las ruedas a través de los demás elementos de transmisión. Se ejecuta a través del pedal; suelto está embragado y hay conexión entre el motor y las ruedas, pisado está desembragado y las ruedas quedan desconectadas del motor.","Descubre las partes de un coche de forma sencilla y conoce todo el rendimiento que puede ofrecerte tu vehículo. ¡Entra! Si a un niño le pides dibujar un coche, rápidamente trazará los círculos que forman los neumáticos, la forma de la carrocería, las lunas y, en algunos casos, las puertas o …",0.9990522861480712,2.958247836730344
parte,"Chasis. El chasis es el esqueleto de un auto. Puede ser una estructura auto portante, como una cáscara o tipo H (escalera), donde se monta el resto del vehículo. El chasis es la estructura principal donde irán montados todos los componentes del vehículo. Foto de un Chasis Auto portante Subaru. Foto de un Chasis tipo escalera Toyota Hilux.","En él están comprendidos los circuitos de encendido, de carga, de arranque y de iluminación, con un elemento común que es la batería. Ésta proporciona energía eléctrica partiendo de una energía química producida por la reacción de un electrónico (disolución de agua destilada y ácido sulfúrico). Es necesario llevar un mantenimiento adecuado de la batería, comprobando y repostando el nivel de electrolito.",Partes de un coche Motor Neumáticos Chasis Carrocería Parabrisas Asientos Tapicería Cuadros de mando,0.999033749103546,2.8762115072884296
conjunto,"No existe cuando forma un solo conjunto el motor, caja de cambios y eje motriz. – El eje motriz (par cónico-diferencial) El eje motriz, también llamado puente motriz, puede estar situado en la: o Parte delantera (vehículo de tracción delantera). o Parte trasera del vehículo (vehículo de propulsión trasera).","El chasis es el esqueleto de un auto. Puede ser una estructura auto portante, como una cáscara o tipo H (escalera), donde se monta el resto del vehículo. El chasis es la estructura principal donde irán montados todos los componentes del vehículo. Foto de un Chasis Auto portante Subaru","Básicamente, un automóvil se compone de motor, chasis y trasmisión. El motor es el elemento que transforma el combustible (gasóleo o gasolina) en movimiento, y lo trasmite a las ruedas del vehículo a través de la trasmisión (la caja de cambios), haciendo que …",0.9990277290344238,2.7318549871700957
elementos,"Las ruedas son los elementos sobre los que se apoya el automóvil y las encargadas de dirigir, propulsar o detener el mismo.","Generalmente se utilizan elementos como resortes, amortiguadores hidráulicos, ballestas metálicas, entre otros elementos. La disposición de estos elementos y su configuración otorga al vehículo características especiales, como suavidad, capacidad de carga, maniobrabilidad y estabilidad. Ver la Suspensión Mcpherson",El conjunto de componentes del automóvil que unen las ruedas con el chasis se denomina suspensión. Estos resortes metálicos y amortiguadores guían a las ruedas en su recorrido y transforman la energía cinética (de baches y cuestas) en calorífica.,0.9990253448486328,2.665873299045813
decir,Partes de un coche Motor Neumáticos Chasis Carrocería Parabrisas Asientos Tapicería Cuadros de mando,"El chasis es el esqueleto de un auto. Puede ser una estructura auto portante, como una cáscara o tipo H (escalera), donde se monta el resto del vehículo. El chasis es la estructura principal donde irán montados todos los componentes del vehículo. Foto de un Chasis Auto portante Subaru. Foto de un Chasis tipo escalera Toyota Hilux. Frenos de tambor","Las diferencias entre un automóvil mecánico y uno automático es bastante clara. A veces las preferencias por cada uno de ellos van desde la dificultad que representa hasta la comodidad, incluso se llega a decir que mientras la persona tenga más años, optará por uno mecánico.",0.9990247488021852,2.8979439938550087
dentro,"Dentro de este sistema entran el embrague, la caja de cambios o caja de velocidades, y el árbol de transmisión. El sistema de suspensión Su función principal es evitar que las irregularidades del terreno se transmitan al interior del vehículo, uniendo el chasis del vehículo con las ruedas.",@juangangelEl primer automóvil con motor de combustión interna se atribuye a Karl Friedrich Benz en la ciudad de Mannheim en 1886 con el modelo Benz Patent-M...,El conjunto de componentes del automóvil que unen las ruedas con el chasis se denomina suspensión. Estos resortes metálicos y amortiguadores guían a las ruedas en su recorrido y transforman la energía cinética (de baches y cuestas) en calorífica.,0.9989928007125854,2.8604392662019493
potencia,"Pedales o mandos de pie. El Acelerador: se acciona con el pie derecho y su objetivo es regular la entrada de combustible en el motor. Al presionarlo aumenta la potencia y la velocidad, y también el consumo. Cuando no se pisa, el motor sólo recibe combustible para mantenerse en marcha, funcionando al …","La caja de cambios es el mecanismo que permite transformar el giro y potencia del motor en movimiento y fuerza en las ruedas del auto. Esto se logra mediante un complejo sistema de piñones de diferentes tamaños y posiciones, que van acoplándose al sistema del motor. Existen dos tipos de cajas de cambios:",Curso Mecánica: Experto en Autopartes | Componentes de un AutomóvilProfesor: Jorge Antonio GuillenVisita la pagina de la cnt: www.confederaciondetalleres.org.mx,0.9989639520645142,2.9061343742946475
funcionamiento,"Su misión es orientar las ruedas directrices (delanteras) en función de la trayectoria a seguir. El piñón gira con el eje de la dirección y mueve una cremallera por medio de rótulas y bieletas, lo que disminuye el esfuerzo del conductor para mover las ruedas directrices y orientar el vehículo.",@juangangelEl primer automóvil con motor de combustión interna se atribuye a Karl Friedrich Benz en la ciudad de Mannheim en 1886 con el modelo Benz Patent-M...,"Partes de un automóvil . El motor. ... Motor de explosión (gasolina): su funcionamiento se basa en la fuerza que produce la explosión de una mezcla de aire y gasolina en el carburador. La inflamación de la mezcla se provoca mediante una chispa eléctrica que salta, en el momento adecuado en la cámara de …",0.9989296793937684,2.9184862588739033
partes,"Pedales o mandos de pie. El Acelerador: se acciona con el pie derecho y su objetivo es regular la entrada de combustible en el motor. Al presionarlo aumenta la potencia y la velocidad, y también el consumo. Cuando no se pisa, el motor sólo recibe combustible para mantenerse en marcha, funcionando al …","El chasis es el esqueleto de un auto. Puede ser una estructura auto portante, como una cáscara o tipo H (escalera), donde se monta el resto del vehículo. El chasis es la estructura principal donde irán montados todos los componentes del vehículo. Foto de un Chasis Auto portante Subaru. Foto de un Chasis tipo escalera Toyota Hilux. Frenos de tambor",Partes de un coche Motor Neumáticos Chasis Carrocería Parabrisas Asientos Tapicería Cuadros de mando,0.9989179372787476,2.823112723396821
aire,"Partes y funcionamiento del aire acondicionado automotriz Condensador del aire acondicionado. El gas que ha sido comprimido pasa a la parte superior del condensador, donde... Filtro deshidratador del aire acondicionado. Mientras tiene lugar el proceso que acabamos de describir, el filtro... Válvula ...",Sistema de aire acondicionado standar para vehículoswww.haddadaire.cl,"El filtro del habitáculo se encarga de filtrar el polvo, el polen y todas las partículas de suciedad del aire antes de que dicho aire fluya limpio y fresco al interior del vehículo. Como cualquier filtro, tiene una capacidad de absorción limitada. En todos los sistemas de aire acondicionado hay un evaporador. En sus láminas se condensa el agua.",0.9989153146743774,2.52468486453334
carrocería,"La mayor parte de los componentes que forman la carrocería son elementos interiores. Suelen quedar ocultos por las piezas exteriores, accesorios, tapizados y guarnecidos que …","Partes de la carrocería. La carrocería, como ya se ha dicho, se divide en dos partes principales: La parte elástica o deformable: es la que, en el choque, se encarga de absorber toda la inercia posible, teniendo en cuenta que la tiene que absorber de manera brusca y casi instantáneamente.","La carrocería es la estructura que se dispone sobre el chasis para albergar a los ocupantes y la carga del vehículo. En el caso de los chasis auto portantes, la carrocería está incluida en la estructura y solamente añade elementos estéticos. Ver una Carrocería Tesla Model 3",0.9989124536514282,2.793826730571033
tiempo,"Ahora es el momento de profundizar en la materia para que a partir de hoy tú también sepas lo que es un cigüeñal, una bujía o cómo se calcula la famosa cilindrada. Cuáles son las partes del motor de un coche. Antes de descubrir las partes que componen el motor de un coche, hay que tener en cuenta que no todos los motores son iguales.","los automoviles modernos están compuestos por miles de partes, las cuales estan dispuestas de tal manera que cumplen la función especifica de desplazamiento del vehiculo, sin embargo un auto no solamente esta diseñado para esto, por eso esta dividido en muchos sistemas, entre ellos encontramos: el sistema de escape, el sistema de apoyo, el motor, el sistema de …","Corte de piezas metálicas. En la segunda etapa del proceso de producción de un automóvil y ya que las piezas se tienen disponibles en cada estación, se realiza el corte de las piezas metálicas que servirán como el armazón del carro, principalmente a través de 4 pasos:. Sitúan en posición las piezas metálicas de chapa plana, a fin de que reciban el estampado del dibujo.",0.998909592628479,2.9324660652319805
posible,"Pedales o mandos de pie. El Acelerador: se acciona con el pie derecho y su objetivo es regular la entrada de combustible en el motor. Al presionarlo aumenta la potencia y la velocidad, y también el consumo. Cuando no se pisa, el motor sólo recibe combustible para mantenerse en marcha, funcionando al …","Una de las partes más visibles del coche es el panel de luminosos del salpicadero. La mayoría de los conductores son conscientes del velocímetro y del medidor de gasolina, pero hay otros elementos que tienen igual o más importancia. El tacómetro, que indica la velocid ad del motor en rotaciones por minuto (RPM).",Partes de un coche. Motor; Neumáticos; Chasis; Carrocería; Parabrisas; Asientos; Tapicería; Cuadros de mando,0.9989062547683716,2.8165403016938217
esenciales,"Los frenos de disco usan un disco giratorio, que se encuentra entre las pastillas de los frenos montadas sobre calibres para reducir el movimiento del coche. Los frenos de tambor usan zapatas que empujan para afuera para contactar la parte inferior de un cilindro giratorio o tambor. Algunos coches contienen los dos tipos de frenos (un tipo para las ruedas delanteras y otro para las …","Como la mayoría de los automóviles que se fabrican y están en circulación son de combustión interna, vamos a analizar este tipo de motores. Así, un motor de combustión interna consta, de manera simplificada, de: Bloque y cilindros; Pistones; Cigüeñal; Culata y válvulas; Cárter inferior; El bloque del motor y los cilindros","En ese sentido, la Dirección General de Tráfico (DGT) ha compartido una nota en la que especifica las cinco partes esenciales que deben limpiarse en un coche para evitar la propagación del ...",0.9988924264907836,2.9485337099345155
gasolina,https://capacitateparaelempleo.orgLink original: https://capacitateparaelempleo.org/pages.php?r=.tema&tagID=1753&load=3052&n=0Elementos de los que se compone...,"Suele denominarse tapa de cilindros porque es la encargada de encerrarlos y soporta las explosiones que generan. Además, también aloja las válvulas de admisión y escape, las bujías (en motores de gasolina), el árbol de levas que activa las válvulas, los conductos de admisión de aire y combustible y los conductos de escape. Entre la y el bloque se encuentra la “junta de” …","MANUAL GRATIS PARA PROFESIONALES EN MOTORES A GASOLINA – ESPAÑOL. El Automóvil, Tipos de Automóvil, Partes del Automóvil, Chasis, El Motor, El Embrague, La Caja de Cambios, La Transmisión, El Diferencial y Puente Trasero, Ruedas, Dirección, Características, Numero de Cilindros, Línea, Forma Vertical, Oposición, Forma Horizontal, Motor Mono cilíndrico, Motor Audi V12, Según el ...",0.9988913536071776,2.9615464628780908
combustible,"Como la mayoría de los automóviles que se fabrican y están en circulación son de combustión interna, vamos a analizar este tipo de motores. Así, un motor de combustión interna consta, de manera simplificada, de: Bloque y cilindros; Pistones; Cigüeñal; Culata y válvulas; Cárter inferior; El bloque del motor y los cilindros","Si tomamos como referencia un motor de combustión interna es sencillo visualizar cinco divisiones: el bloque, el cárter inferior, los cilindros, la culata y el cigüeñal. El bloque de motor es una pieza de hierro o aluminio que aloja los cilindros y sirve de soporte de apoyo para el eje del cigüeñal.",La bomba empuja la gasolina hacia el líneas de combustible. Hay líneas de combustible de metal duro en la mayoría de los vehículos que hacen funcionar el combustible desde el tanque hacia el motor.,0.9988903999328612,2.4671781016806937
mantenimiento,"En este artículo se explican estos mantenimientos o desgastes; aceite y filtro del motor, líquido de refrigeración, filtro de aire, filtro de combustible, correa de distribución (¿bomba de agua?), batería, bujías de encendido y bujías de precalentamiento.",El automóvil está formado por las siguientes partes: Estructura metálica: Conjunto estructural sobre el que se van montando el resto de componentes del vehículo. Carrocería: Destinada a transportar y proteger a los pasajeros y carga. Motor: Generador de potencia que produce el movimiento para ...,"Deben revisarse siempre que el vehículo entre al taller para su mantenimiento. FILTROS DE HABITÁCULO. Si el resto de los filtros que se montan en un vehículo tienen como fin garantizar la salud del motor del coche, el de habitáculo se ocupa de la de salud de sus ocupantes.",0.9988564252853394,2.877235382534101
funciona,El bloque de motor es una pieza de hierro o aluminio que aloja los cilindros y sirve de soporte de apoyo para el eje del cigüeñal. Por él también circula el líquido refrigerante y el aceite que lubrica el motor y que frecuentemente debemos …,"Pistones y cigüeñal La combustión que se genera en el interior del motor de un coche varía de de un motor a gasolina a otro que funciona con gasóleo. En el primero, una chispa generada por la bujía provoca la explosión de la mezcla de combustible y aire que, a su vez, mueve los pistones ubicados en el interior de los cilindros.",Para soportar esta pesada carga de trabajo el motor debe ser lo suficientemente sólido. Éste se compone de dos partes básicas: el bloque motor y la culata. El bloque motor es la parte inferior y...,0.9988492131233216,2.5967771193826286
utiliza,"Cada coche consta de un motor y gran parte de ellos usan un motor de combustión interna que opera con gasolina. La gasolina, junto con el aire, se echa en una cámara de combustión donde se comprime y se enciende con una chispa. La combustión que resulta de ello produce un golpe de energía que, al repetirlo rápidamente, enciende el coche. En general, se hace referencia a los …","El chasis es el esqueleto de un auto. Puede ser una estructura auto portante, como una cáscara o tipo H (escalera), donde se monta el resto del vehículo. El chasis es la estructura principal donde irán montados todos los componentes del vehículo. Foto de un Chasis Auto portante Subaru. Foto de un Chasis tipo escalera Toyota Hilux. Frenos de tambor",El conjunto de componentes del automóvil que unen las ruedas con el chasis se denomina suspensión. Estos resortes metálicos y amortiguadores guían a las ruedas en su recorrido y transforman la energía cinética (de baches y cuestas) en calorífica.,0.9988449215888976,2.8906032722907806
motores,"Los tipos de motor más comunes son los que presentan los cilindros de forma lineal (de 2 a 6) y que podemos encontrar en automóviles de media gama; así como los que los sitúan enfrentados formando una V, más característicos de los motores grandes. Pero en el mercado también existen motores con en paralelo, formando una W o incluso un círculo.",Una guía rápida y fácil para explicar todas esas partes de un motor y para qué sirven: Cárter Bomba de aceite Bloque motor Cojinetes Cigüeñal Volante de inercia Biela Bulón Pistón Segmentos Cilindro Bomba de agua Filtro de aceite Culata Válvulas Admisión Filtro de aire Escape,Cómo identificar las partes del motor de un coche. ... Aquí se ubican la mayor parte de los relés y de los fusibles del vehículo –suele haber más en otra caja dentro del habitáculo–. Los ...,0.9988423585891724,2.904750418493333
volante,"El volante ha evolucionado con el tiempo y dejó de ser un mero elemento para dirigir el vehículo. El volante es uno de los elementos esenciales del auto, es lo que nos da control para dirigir el vehículo y por tanto, requiere de ciertos conocimientos y experiencia para maniobrarlo adecuadamente.","Un volante de dirección (también conocido como volante o timón) es un tipo de control de dirección en vehículos.
Los volantes se utilizan en todo tipo de vehículos, desde los automóviles hasta camiones ligeros y pesados. El volante es la parte del sistema de gobiernoque es manipulado por el conductor, generando acciones que son las respondidas por el resto del sistema. Esto se logra a través del contacto mecánic…","Partes de un volante El volante, como mecanismo, no podía ser más simple. En el fondo, un volante de inercia es un disco muy pesado, que actúa como un dispositivo de almacenamiento de energía. Después de un motor acelera el volante hasta una velocidad dada, la inercia del volante de inercia que intenta mantener girando a que rpm.",0.9988399744033812,2.7087919734658517
manera,"El chasis es el esqueleto de un auto. Puede ser una estructura auto portante, como una cáscara o tipo H (escalera), donde se monta el resto del vehículo. El chasis es la estructura principal donde irán montados todos los componentes del vehículo. Foto de un Chasis Auto portante Subaru. Foto de un Chasis tipo escalera Toyota Hilux. Frenos de tambor","El automóvil utiliza distintos sistemas que funcionan de manera simultánea, por lo que conocer estas partes básicas no solo facilita la detección de problemas, sino también ayuda a realizar ...","Cada coche consta de un motor y gran parte de ellos usan un motor de combustión interna que opera con gasolina. La gasolina, junto con el aire, se echa en una cámara de combustión donde se comprime y se enciende con una chispa. La combustión que resulta de ello produce un golpe de energía que, al repetirlo rápidamente, enciende el coche.",0.9988369345664978,3.0
dirección,Partes del sistema de dirección. El sistema de dirección está formado por una serie de elementos que funcionan coordinados para transmitir el movimiento desde el volante hasta las ruedas. Volante. Elemento circular mediante el cual el conductor controla la trayectoria de las ruedas. Barra de dirección.,"La historia de la dirección discurre paralela a la invención de la rueda y su aplicación al transporte.
En la naturaleza no existen ruedas y de hecho muchas civilizaciones -como las mesoamericanas- nunca llegaron a utilizarlas.
Una posible razón está en el aumento de efectividad asociado al empleo de elementos rotatorios frente a los deslizantes o a cargar directamente el animal. Los animales de tiro disponibles en la Eurasia de la ed…","0 Comentarios. La dirección está formada por varios elementos, los cuales hacen que las ruedas directrices del vehículo se muevan como quiera el conductor. Elementos: Volante; Consiente al conductor de dirección hasta la caja de engranajes.",0.9988358020782472,2.584532618415091
chasis,"Partes de Chasis Todo en suspensión, frenos y clutch para auto liviano, pesado y autobuses.","Descubre cómo está hecho el chasis de un carro, en las partes de un carro descubre porque son tan importantes y la forma que les hace resistentes. Los Automó...","Las partes de un chasis Primordialmente, el chasis de carro independiente se compone de diversos elementos, aunque recordemos que es más simple. Este lleva un travesaño delantero, larguero del bastidor delantero, la consola para resorte y travesaño principal para la parte delantera.",0.9988287687301636,2.78626178019468
componentes,"El chasis es el esqueleto de un auto. Puede ser una estructura auto portante, como una cáscara o tipo H (escalera), donde se monta el resto del vehículo. El chasis es la estructura principal donde irán montados todos los componentes del vehículo. Foto de un Chasis Auto portante Subaru. Foto de un Chasis tipo escalera Toyota Hilux. Frenos de tambor",Partes de un coche Motor Neumáticos Chasis Carrocería Parabrisas Asientos Tapicería Cuadros de mando,@juangangelEl primer automóvil con motor de combustión interna se atribuye a Karl Friedrich Benz en la ciudad de Mannheim en 1886 con el modelo Benz Patent-M...,0.9988280534744264,2.8485183361305393
función,"Partes de un automóvil . El motor. ... Su misión es orientar las ruedas directrices (delanteras) en función de la trayectoria a seguir. El piñón gira con el eje de la dirección y mueve una cremallera por medio de rótulas y bieletas, lo que disminuye el esfuerzo del conductor para mover las ruedas directrices y orientar el vehículo. ...","Continuando la entrega anterior de este bloque, se va a dar una explicación sencilla de cada uno de los elementos principales del automóvil que se presentaron. Función de los elementos del automóvil. En esta primera animación, son cuatro, se ven por este orden los siguientes elementos del automóvil:","El motor es un componente importante en la mecánica del vehículo, puesto que es el encargado de hacer funcionar el automóvil transformando la energía eléctrica como la …",0.998827576637268,2.795991416784111
además,"Pedales o mandos de pie. El Acelerador: se acciona con el pie derecho y su objetivo es regular la entrada de combustible en el motor. Al presionarlo aumenta la potencia y la velocidad, y también el consumo. Cuando no se pisa, el motor sólo recibe combustible para mantenerse en marcha, funcionando al …",El conjunto de componentes del automóvil que unen las ruedas con el chasis se denomina suspensión. Estos resortes metálicos y amortiguadores guían a las ruedas en su recorrido y transforman la energía cinética (de baches y cuestas) en calorífica.,@juangangelEl primer automóvil con motor de combustión interna se atribuye a Karl Friedrich Benz en la ciudad de Mannheim en 1886 con el modelo Benz Patent-M...,0.9988155364990234,2.9126739889304414
control,"El ECU, conocido también como la Unidad de Control del Motor, es el cerebro del auto. Este dispositivo controla el nivel de combustible que se suministra al motor, el aire, el punto de ignición, la apertura de válvulas, el turbocompresor, entre otros.","Los cambios se colocan en el centro del vehículo. Por lo general, un conductor usa su mano izquierda para controlar el pomo del engranaje, los autos modernos son modelos de 5 marchas. Las posiciones de los cambios, especialmente 1 – 4 deben ser conocidas por el nuevo conductor que ha optado por usar un automóvil mecánico. Ajuste del asiento","Su misión es orientar las ruedas directrices (delanteras) en función de la trayectoria a seguir. El piñón gira con el eje de la dirección y mueve una cremallera por medio de rótulas y bieletas, lo que disminuye el esfuerzo del conductor para mover las ruedas directrices y orientar el vehículo.",0.9988119602203368,2.940157876595519
