word_added,s1,s2,s3,similarity_w,sum_cos
todas,Partes de un coche Motor Neumáticos Chasis Carrocería Parabrisas Asientos Tapicería Cuadros de mando,"El chasis es el esqueleto de un auto. Puede ser una estructura auto portante, como una cáscara o tipo H (escalera), donde se monta el resto del vehículo. El chasis es la estructura principal donde irán montados todos los componentes del vehículo. Foto de un Chasis Auto portante Subaru. Foto de un Chasis tipo escalera Toyota Hilux. Frenos de tambor","El VIN es el Número de Identificación Vehicular o número de chasis de un automóvil. Es único para cada vehículo y queda grabado en algunas partes del mismo (en la parte inferior del parabrisas del conductor, en el chasis de la rueda delantera, en el marco de la …",0.998809576034546,2.668952980013179
frenos,¿Cuáles son las partes de un sistema de frenos? Pedal. El conductor de un vehículo presiona el pedal de freno para detener el auto. La presión sobre el pedal mueve un... Cilindro prinicpal. El cilindro principal está ubicado directamente en …,Las tuberías de los circuitos de frenos son las encargadas de permitir el paso de líquido de frenos desde la bomba de frenos a los bombines de freno en las ruedas. Están formadas por tramos rígidos...,Partes del Sistema de Frenos Líquido de frenos. Se define como el fluido hidráulico especial encargado de transmitir la fuerza producida en el pedal... Pedal. Este elemento se presiona para activar el sistema de frenos. La presión ejercida en el pedal produce movimiento... Servofreno. …,0.9988057017326356,2.38979052529142
bien,"El VIN es el Número de Identificación Vehicular o número de chasis de un automóvil. Es único para cada vehículo y queda grabado en algunas partes del mismo (en la parte inferior del parabrisas del conductor, en el chasis de la rueda delantera, en el marco de la puerta del conductor o en el motor del carro).",@juangangelEl primer automóvil con motor de combustión interna se atribuye a Karl Friedrich Benz en la ciudad de Mannheim en 1886 con el modelo Benz Patent-M...,"Como la mayoría de los automóviles que se fabrican y están en circulación son de combustión interna, vamos a analizar este tipo de motores. Así, un motor de combustión interna consta, de manera simplificada, de: Bloque y cilindros; Pistones; Cigüeñal; Culata y válvulas; Cárter inferior; El bloque del motor y los cilindros",0.9988019466400146,2.7634820472195347
movimiento,"Su misión es orientar las ruedas directrices (delanteras) en función de la trayectoria a seguir. El piñón gira con el eje de la dirección y mueve una cremallera por medio de rótulas y bieletas, lo que disminuye el esfuerzo del conductor para mover las ruedas directrices y orientar el vehículo.","La caja de cambios es el mecanismo que permite transformar el giro y potencia del motor en movimiento y fuerza en las ruedas del auto. Esto se logra mediante un complejo sistema de piñones de diferentes tamaños y posiciones, que van acoplándose al sistema del motor. Existen dos tipos de cajas de cambios:","Posteriormente cada equipo recibe información sobre mediciones realizadas durante el arranque del automóvil, del tiempo, la posición, la velocidad (o rapidez) y la masa de un automóvil, para luego solicitar propuestas sobre el trabajo que se va a desarrollar para el análisis del de cada uno de esos automóviles.",0.9987986087799072,2.9608764601374484
fabricación,"La fabricación de automóviles se refiere a la producción industrial de vehículos automóviles en fábricas habilitadas para ello. Es una de las etapas indispensables de la industria automotriz, junto a la comercialización.La de automóviles requiere un capital humano y financiero muy importante.. Dependiendo del tipo de vehículo, la cantidad de unidades a fabricar por día y ...","O lo que es lo mismo, la etapa del proceso de producción de un automóvil que se trata de terminar de “vestir” al carro, la cual, a su vez, se realiza a través de 3 fases principales: Ensamblaje de piezas plásticas que completan la carrocería, tal y como es el parachoques. Instalación de y …","La fabricación de un coche se divide, fundamentalmente, en cuatro etapas: prensado, chapistería, pintura y montaje. Vamos a repasar lo que se hace en cada una de estas cuatro etapas. ¿Sabías que en las dos primeras apenas intervienen personas?",0.9987949132919312,2.9187450109768505
conductor,"Las partes que todo conductor debería conocer de su auto ... Toda la energía necesaria para el movimiento de un automóvil es generada dentro de las piezas del motor, así que su correcto funcionamiento es crucial. El mecanismo de un motor es un tanto complejo, pero su función puede reducirse al movimiento de ascenso y descenso de pistones ...","El coche es la herramienta de trabajo para muchos de nosotros. Tanto para conductores que utilizan su vehículo como medio de transporte constante como para los que están al otro lado y se dedican a tener nuestro coche siempre listo, mecánicos, ingenieros, etc. Por ello, tanto para unos como para otros, es fundamental conocer del coche y saber qué estás tratando.","Conducir un auto, mecánico o automático, no es cosa de juego. Así que teniendo en cuenta la importancia que conlleva conocer el vehículo que posees, te presentamos 11 partes de un automóvil mecánico que todo debe conocer. Dirección",0.9987927675247192,2.8012978687649883
conocer,Las partes de tu coche que deberías conocer El motor. Cada coche consta de un motor y gran parte de ellos usan un motor de combustión interna que opera con gasolina. Caja de cambios. Transforma la energía del motor y se acciona con la palanca de …,Partes de un coche. Motor; Neumáticos; Chasis; Carrocería; Parabrisas; Asientos; Tapicería; Cuadros de mando,"Así que teniendo en cuenta la importancia que conlleva conocer el vehículo que posees, te presentamos 11 partes de un automóvil mecánico que todo conductor debe conocer. Dirección. Controla las ruedas – la mejor manera es colocar las manos en lo que se conoce como posición “diez y …",0.9987910985946656,2.7002855198517164
vehiculo,Partes de un coche Motor Neumáticos Chasis Carrocería Parabrisas Asientos Tapicería Cuadros de mando,"El VIN es el Número de Identificación Vehicular o número de chasis de un automóvil. Es único para cada vehículo y queda grabado en algunas partes del mismo (en la parte inferior del parabrisas del conductor, en el chasis de la rueda delantera, en el marco de la puerta del conductor o en el motor del carro).","Ensamblado de chasis y carrocería . La tercera etapa del proceso de producción de un automóvil se trata de aquella en la que tienen más injerencia los procesos de Soldadura, pues ahí se ensamblan las piezas de la carrocería, chasis y plataforma a través de máquinas y/o robots de Soldadura, a fin de construir el cuerpo del .. Por lo tanto, y entre otras cosas, otro de ...",0.9987900257110596,2.635322397387564
muestra,"Partes de un automóvil . El motor. Se trata de una máquina destinada a producir movimiento mediante la transformación de la energía química en energía mecánica. El carburador es el dispositivo encargado de mezclar el aire y la gasolina. Tiene un depósito encargado de mantener constante el nivel de combustible a la salida del surtidor, o ...","El VIN es el Número de Identificación Vehicular o número de chasis de un automóvil. Es único para cada vehículo y queda grabado en algunas partes del mismo (en la parte inferior del parabrisas del conductor, en el chasis de la rueda delantera, en el marco de la puerta del conductor o en el motor del carro).","Las partes de un automovil. los automoviles modernos están compuestos por miles de partes, las cuales estan dispuestas de tal manera que cumplen la función especifica de desplazamiento del vehiculo, sin embargo un auto no solamente esta diseñado para esto, por eso esta dividido en muchos sistemas, entre ellos encontramos: el sistema de escape, el sistema de apoyo, el motor, el sistema de ...",0.9987871646881104,2.897834533706258
tipo,"Cuando este tipo de repuestos llegan al mercado del consumidor se denominan Equipamiento Original (OE, por sus siglas en inglés Original Equipment), o piezas genuinas. Repuestos Originales (OEM) Los fabricantes de vehículos deben garantizar la consecución de las partes necesarias de recambio para una sustitución parcial o completa.","Es la parte del pistón que, junto con el cilindro, la cabeza del motor, y las válvulas forman la cámara de combustión del motor. Esta puede presentar diferentes formas de acuerdo con el tipo de combustión que se persigue como el acomodo de las válvulas de admisión y escape. Ranura para lubricación del pistón","Un monovolumen es una carrocería en la que no se diferencia más de un volumen. La zona del motor, la cabina y el maletero están completamente integrados. Generalmente, un monovolumen es más alto que un automóvil de turismo (1,6 a 1,8 m contra 1,4 a 1,5 m). Todos los autos Mitsubishi cuentan con este tipo de carrocería.",0.9987838268280028,2.9251620258006206
arquitectura,"Partes de un automóvil . El motor. Se trata de una máquina destinada a producir movimiento mediante la transformación de la energía química en energía mecánica. El carburador es el dispositivo encargado de mezclar el aire y la gasolina. Tiene un depósito encargado de mantener constante el nivel de combustible a la salida del surtidor, o ...","El VIN es el Número de Identificación Vehicular o número de chasis de un automóvil. Es único para cada vehículo y queda grabado en algunas partes del mismo (en la parte inferior del parabrisas del conductor, en el chasis de la rueda delantera, en el marco de la puerta del conductor o en el motor del carro).","Partes de la suspensión de un automóvil. Se llama así al conjunto de partes elásticas que se interponen entre los órganos suspendidos, es decir, el bastidor, la carrocería, los pasajeros y la carga; y los órganos no suspendidos, las ruedas y los ejes.",0.9987789392471312,2.8841252565074758
hora,"Partes de un automóvil . El motor. Se trata de una máquina destinada a producir movimiento mediante la transformación de la energía química en energía mecánica. El carburador es el dispositivo encargado de mezclar el aire y la gasolina. Tiene un depósito encargado de mantener constante el nivel de combustible a la salida del surtidor, o ...","Descubre las partes de un coche de forma sencilla y conoce todo el rendimiento que puede ofrecerte tu vehículo. ¡Entra! Si a un niño le pides dibujar un coche, rápidamente trazará los círculos que forman los neumáticos, la forma de la carrocería, las lunas y, en algunos casos, las puertas o …","El VIN es el Número de Identificación Vehicular o número de chasis de un automóvil. Es único para cada vehículo y queda grabado en algunas partes del mismo (en la parte inferior del parabrisas del conductor, en el chasis de la rueda delantera, en el marco de la puerta del conductor o en el motor del carro).",0.99877667427063,2.910561959930179
productos,@juangangelEl primer automóvil con motor de combustión interna se atribuye a Karl Friedrich Benz en la ciudad de Mannheim en 1886 con el modelo Benz Patent-M...,"Las ruedas son básicas para un auto ya que además de permitir que un vehículo circule, si se mantienen en buenas condiciones, ayudan a ahorrar combustible e ir seguros en el camino.","El VIN es el Número de Identificación Vehicular o número de chasis de un automóvil. Es único para cada vehículo y queda grabado en algunas partes del mismo (en la parte inferior del parabrisas del conductor, en el chasis de la rueda delantera, en el marco de la puerta del conductor o en el motor del carro).",0.9987674951553344,2.9181649597750496
cosas,"10 partes importantes de un automóvil mecánico Dirección. Controla las ruedas – la mejor manera es colocar las manos en lo que se conoce como posición “diez y dos”. La bocina. En la mayoría de los autos, la bocina está normalmente situada en el …","Descubre las partes de un coche de forma sencilla y conoce todo el rendimiento que puede ofrecerte tu vehículo. ¡Entra! Si a un niño le pides dibujar un coche, rápidamente trazará los círculos que forman los neumáticos, la forma de la carrocería, las lunas y, en algunos casos, las puertas o …","El VIN es el Número de Identificación Vehicular o número de chasis de un automóvil. Es único para cada vehículo y queda grabado en algunas partes del mismo (en la parte inferior del parabrisas del conductor, en el chasis de la rueda delantera, en el marco de la puerta del conductor o en el motor del carro).",0.998762845993042,2.900314654236866
básicas,"Conocer estas partes básicas facilita la detección de problemas, ayuda a realizar reparaciones básicas y a conducir más responsablemente. El motor. Cada coche consta de un motor y gran parte de ellos usan un motor de combustión interna que opera con gasolina. La gasolina, junto con el aire, se echa en una cámara de combustión donde se ...","El motor. Se trata de una máquina destinada a producir movimiento mediante la transformación de la energía química en energía mecánica. El carburador es el dispositivo encargado de mezclar el aire y la gasolina. Tiene un depósito encargado de mantener constante el nivel de combustible a la salida del surtidor, o un tubo calibrado que une la cuba con el colector de admisión.","El VIN es el Número de Identificación Vehicular o número de chasis de un automóvil. Es único para cada vehículo y queda grabado en algunas partes del mismo (en la parte inferior del parabrisas del conductor, en el chasis de la rueda delantera, en el marco de la puerta del conductor o en el motor del carro).",0.9987603425979614,2.8046243482535558
peso,"Un automóvil, también denominado coche, carro, auto, etc; es un vehículo motorizado con ruedas utilizado para el transporte.La mayoría de las definiciones de automóvil, hacen referencia a los vehículos que circulan principalmente por las carreteras, con capacidad de uno a ocho personas, cuentan con cuatro neumáticos y transportan principalmente a personas, antes que mercaderías.","Resulta muy difícil alcanzar este objetivo que, por otra parte, es el mismo para un automóvil de serie, que para una furgoneta, etc. En un coche de calle, la diferencia reside en el carácter más o menos deportivo, más o menos confortable, con que se quiera dotar al modelo.","El VIN es el Número de Identificación Vehicular o número de chasis de un automóvil. Es único para cada vehículo y queda grabado en algunas partes del mismo (en la parte inferior del parabrisas del conductor, en el chasis de la rueda delantera, en el marco de la puerta del conductor o en el motor del carro).",0.9987585544586182,2.7906131126214944
lado,"Partes de un automóvil . El motor. Se trata de una máquina destinada a producir movimiento mediante la transformación de la energía química en energía mecánica. ... Se distingue, por un lado, la llanta (elemento rígido de la rueda sobre la que se monta el neumático), y por el otro neumático, ...",Partes de un coche Motor Neumáticos Chasis Carrocería Parabrisas Asientos Tapicería Cuadros de mando,"¿cual es el lado derecho de un automovil ¿el del chofer o el del copiloto? tengo que reparar el cinturón de seguridad de un chevy 2000. solo quiero cambiar el del lado del chofer, pero quiero saber si es el que esta marcado: R (right) ó el que esta marcado: L …",0.9987565875053406,2.9040416360852697
medidas,"El VIN es el Número de Identificación Vehicular o número de chasis de un automóvil. Es único para cada vehículo y queda grabado en algunas partes del mismo (en la parte inferior del parabrisas del conductor, en el chasis de la rueda delantera, en el marco de la puerta del conductor o en el motor del carro).","Ud. podrá ejercer los derechos de acceso, supresión, rectificación, oposición, limitación y portabilidad, mediante carta a Planeta de Agostini Formación, S.L.U. - Apartado de Correos 221 de Barcelona, o remitiendo un email a info@ceac.com.Asimismo, cuando lo considere oportuno podrá presentar una reclamación ante la Agencia Española de protección de datos.","Un monovolumen es una carrocería en la que no se diferencia más de un volumen. La zona del motor, la cabina y el maletero están completamente integrados. Generalmente, un monovolumen es más alto que un automóvil de turismo (1,6 a 1,8 m contra 1,4 a 1,5 m). Todos los …",0.9987491369247437,2.944477539685054
debe,"Partes de un automóvil . El motor. ... que va montado sobre la llanta de tal forma que el conjunto debe ser estanco y flexible para poder absorber las irregularidades del terreno. Principales mandos de un vehículo Para conducir un vehículo que no sea automático, es necesario accionar unos mandos con los pies y otros con las manos. ...",Partes de un coche Motor Neumáticos Chasis Carrocería Parabrisas Asientos Tapicería Cuadros de mando,"El coche es la herramienta de trabajo para muchos de nosotros. Tanto para conductores que utilizan su vehículo como medio de transporte constante como para los que están al otro lado y se dedican a tener nuestro coche siempre listo, mecánicos, ingenieros, etc. Por ello, tanto para unos como para otros, es fundamental conocer del coche y saber qué estás tratando.",0.998743176460266,2.77641651174947
capaz,@juangangelEl primer automóvil con motor de combustión interna se atribuye a Karl Friedrich Benz en la ciudad de Mannheim en 1886 con el modelo Benz Patent-M...,"Partes de un automóvil . El motor. Se trata de una máquina destinada a producir movimiento mediante la transformación de la energía química en energía mecánica. El carburador es el dispositivo encargado de mezclar el aire y la gasolina. Tiene un depósito encargado de mantener constante el nivel de combustible a la salida del surtidor, o ...","El VIN es el Número de Identificación Vehicular o número de chasis de un automóvil. Es único para cada vehículo y queda grabado en algunas partes del mismo (en la parte inferior del parabrisas del conductor, en el chasis de la rueda delantera, en el marco de la puerta del conductor o en el motor del carro).",0.9987407326698304,2.8872678026831995
equipo,@juangangelEl primer automóvil con motor de combustión interna se atribuye a Karl Friedrich Benz en la ciudad de Mannheim en 1886 con el modelo Benz Patent-M...,"Descubre las partes de un coche de forma sencilla y conoce todo el rendimiento que puede ofrecerte tu vehículo. ¡Entra! Si a un niño le pides dibujar un coche, rápidamente trazará los círculos que forman los neumáticos, la forma de la carrocería, las lunas y, en algunos casos, las puertas o …","Asegura el acceso cómodo a la parte inferior del automóvil y ayuda en tareas como la alineación, el cambio de ruedas y el ajuste de otros componentes tales como la suspensión. Osciloscopio Es una de las herramientas para taller mecánico que permite revisar las señales provenientes de los sensores en el sistema eléctrico y determinar con ...",0.9987396001815796,2.9713010313825907
