word_added,s1,s2,s3,similarity_w,sum_cos
argentina,"SOAP BOX ARG - Cyclecars - Pedal Cars, Carritos de rulemanes y otros. 3909 Me gusta. Equipo deportivo de aficionados","Venta autos usados de todas las marcas, en Argentina. Autos usados. Encontrá el auto usado que más se adapta a tus necesidades.","Todos los modelos de catálogo autos nuevos 0km de todas las marcas, disponibles en argentina",0.8971617221832275,2.74534843267271
año,"En 2020 vuelve uno de los eventos más entretenidos y desafiantes del mundo a Santiago. Tras cuatro años de ausencia, SoapBox Race, que en 2016 se realizó en la comuna de La Reina, regresará durante el primer semestre de 2020 y ya están abiertas las postulaciones para los valientes (y suficientemente locos) que quieran participar. Red Bull Soapbox Race es un evento abierto al público ...","Cómo saber qué SOAP tiene mi auto, una buena interrogante en caso de que hayas olvidado una información tan valiosa, tomando en cuenta …","Encuentra autos nuevos, seminuevos y usados: automóviles, camiones, motocicletas y más en un solo lugar. Consulta nuestra gama completa de vehículos en línea en chileautos.cl",0.8970379829406738,3.0
carreras,"Red Bull SoapBox Race 2020: Vuelve al Cerro San Cristóbal la carrera de autos locos más entretenida de Chile Mucha atención, que ya comenzó la etapa de postulaciones para partcipar con el más creativo, loco y rápido de los autos de Santiago",Red Bull Soapbox Race: la carrera de ‘autos locos’ que estará este sábado en el Parque Metropolitano,"La carrera de autos locos Red Bull SoapBox Race inicia su etapa de postulaciones para partcipar con el más creativo, loco y rápido de los autos. En 2020 vuelve uno de los eventos más ...",0.8967019319534302,1.711376420579119
vez,"Red Bull Soapbox Race vuelve por tercera vez a Tierra Azteca, aunque será la primera vez que la Ciudad de México viva toda la emoción de los autos más simpáticos del mundo.","Red Bull Soapbox Race es un evento abierto al público, donde cada equipo puede inscribirse y participar diseñando y construyendo sus propios autos. Cada máquina que participa hecha a mano es alimentada a puro coraje y fuerza de gravedad. Se trata de una carrera no motorizada que desafía a corredores y aficionados de la velocidad y la ...","La carrera de autos locos Red Bull SoapBox Race inicia su etapa de postulaciones para partcipar con el más creativo, loco y rápido de los autos. En 2020 vuelve uno de los eventos más ...",0.8963359594345093,2.6213176504990683
like,"soapbox derby race car child - soap box derby car stock pictures, royalty-free photos & images. portrait of little boy riding a go-kart. - soap box derby car stock pictures, royalty-free photos & images. Year old boy in a helmet drives a go-cart during a Soap Box Derby, as a crowd watches in the background, Harlem Speedway, New York City. The ...","- A bit like soapbox cars – Formula V, the cheapest way to drive a racing car in the 60s. Wheels, suspension and the 50-hp-engine were taken from the VW Beetle.","En el Soapbox de Alemania, la estrella de F1 muestra la potencia de su super auto ¡99 carreras de autos locos en 99 segundos! No te pierdas este clip que reúne lo mejor de las 99 carreras de ...",0.8961429595947266,2.837112265786646
gravedad,"Motormanía. Conoce el primer coche sin motor que usa la gravedad para acelerar. La marca Hyundai lanzará el auto Soapbox sin motor, ya que usa la gravedad como fuerza de impulso. msnvolver a …","Hyundai lanzará ""pronto"" en Europa el nuevo 'Soapbox ride', un vehículo sin motor e impulsado por la gravedad que está inspirado en el Concept Car 45. Redacción 27 agosto 2020 - 08:30 h. Archivado en: hyundai Hyundai Soapbox ride","Las carreras de Soapbox. Desde 1933, el Soapbox Derby existe y fue creado en los Estados Unidos, en la ciudad de Akron, en Ohio. Todos los meses de julio se celebra un campeonato donde el protagonista es un auto sin motor y marcas como Red Bull han puesto el ojo en la competencia, profesionalizándola y llevándola a todos los lugares del mundo.",0.8954905271530151,2.6494819679029984
may,"En 2020 vuelve uno de los eventos más entretenidos y desafiantes del mundo a Santiago. Tras cuatro años de ausencia, SoapBox Race, que en 2016 se realizó en la comuna de La Reina, regresará durante el primer semestre de 2020 y ya están abiertas las postulaciones para los valientes (y suficientemente locos) que quieran participar. Red Bull Soapbox Race es un evento abierto al público ...","Los mejores autos encuéntralos en Maya Autos. La mejor esquina, los mejores autos del país. Cotiza tu seminuevo. Adquiere el auto más vendido del Ecuador en la …","¡Vuelve a Santiago la ya conocida Red Bull Soapbox Race! A partir de hoy y hasta finales de septiembre se estarán recibiendo las postulaciones de los equipos más locos y valientes de Chile, donde tendrán que ingeniárselas para dar con un auto que combine creatividad, locura y velocidad.",0.8951998949050903,2.7249902282261833
kit,The powerful shopping cart software for web stores and e-commerce enabled stores is based on PHP5 with SQL database with highly configurable implementation based on templates,"The Masters kit is designed for a child up to (Approx.) 6 foot tall and 155 lbs.. This kit includes: 4 piece fiberglass shell, pre-cut floorboard, brake and steering assemblies, complete building instructions, mounting and construction hardware, and an official racing helmet. ***KIT DOES NOT INCLUDE Z-GLAS RACING WHEELS***","5, 2017 - Explore Malsr Malsr's board ""soap box car diy"" on Pinterest. See more ideas about soap box cars, box car, soap boxes.",0.89479660987854,2.8594795762402625
online,Hace algunos días te platicábamos sobre el nuevo proyecto que traía entre manos Hyundai; un vehículo sin motor de nombre Soapbox...,"Esta es una carrera en grupo. Y si a eso le sumamos que los autos no pueden utilizar un motor, el resto del equipo pasa a ser vital a la hora de impulsar los primeros movimientos del carro.","Soapbox Race World. Download. Return to the streets of Need for Speed: World! Download the launcher. Multiple Servers. Our server list consists of various community-hosted servers, along with official servers operated by project staff. Custom Economy.",0.8945541381835938,2.937646772244243
make,"Esta es una carrera en grupo. Y si a eso le sumamos que los autos no pueden utilizar un motor, el resto del equipo pasa a ser vital a la hora de impulsar los primeros movimientos del carro.","5, 2017 - Explore Malsr Malsr's board ""soap box car diy"" on Pinterest. See more ideas about soap box cars, box car, soap boxes.","1, 2016 - Diy ideas for up cycled soapbox cars to inspire kids and grown ups. Recycle just about anything to make your race car. Clever. Creative. See more …",0.8943924307823181,2.831961110783936
versión,"Ya llega una nueva versión del Red Bull Soapbox Race. Este sábado 14 de marzo en el Parque Metropolitano, 35 carros competirán para quedarse con una nueva edición de la carrera de autos locos más entretenida y extrema del mundo. Se espera que más de 10 mil personas asistan gratuitamente a una nueva edición de Red Bull Race.","Ya llega una nueva versión del Red Bull Soapbox Race. Este sábado 14 de marzo en el Parque Metropolitano, 35 carros competirán para quedarse con una nueva edición de la carrera de autos locos más entretenida y extrema del mundo. Se espera que más de 10 mil personas asistan gratuitamente a una nueva edición de Red Bull Race.","Se abren inscripciones para la versión 2020 de Red Bull Soapbox Race ¡Vuelve a Santiago la ya conocida Red Bull Soapbox Race! A partir de hoy y hasta finales de septiembre se estarán recibiendo las postulaciones de los equipos más locos y valientes de Chile, donde tendrán que ingeniárselas para dar con un que combine creatividad ...",0.8942489027976991,1.5334012836641424
design,"The globetrotting, gravity-propelled circus that is the Red Bull Soapbox Race lands in London on July 9 2017, with a bunch of sublime and ridiculous …","2, 2020 - Explore Drew's board ""soapbox design"" on Pinterest. See more ideas about cycle car, cool cars, vintage race car.","Hyundai Motor has revealed a first glimpse of a new project coming from its European design center, Hyundai Design Center Europe. In a new teaser image, the shape of the soapbox ride can be seen against a dark background. The vehicle is painted yellow, and the Hyundai logo is …",0.8936096429824829,2.6404092627419753
país,"Los 35 autos más locos de Chile se atrevieron a bajar el trazado de 640 metros lleno de saltos, curvas empinadas y veloces pendientes de la tercera edición de la Red Bull Soapbox Race, que se ...","Esta es una carrera en grupo. Y si a eso le sumamos que los autos no pueden utilizar un motor, el resto del equipo pasa a ser vital a la hora de impulsar los primeros movimientos del carro.","Unas 20 mil personas gozaron este domingo de la segunda edición chilena de Red Bull Soapbox Race, la divertida carrera de carros que se efectuó en …",0.8935864567756653,2.7598392159771117
city,Su construcción es guiada mediante un tutorial en YouTube.,"¡Vuelve a Santiago la ya conocida Red Bull Soapbox Race! A partir de hoy y hasta finales de septiembre se estarán recibiendo las postulaciones de los equipos más locos y valientes de Chile, donde tendrán que ingeniárselas para dar con un auto que combine creatividad, locura y velocidad.",Gallery with auto-pagination; Gallery Lightbox On; Gallery with lightbox; Sponsored article; Google AMP article version; Lazy loading images; Lazy loading embeds; Auto Load Next Post; Text article; Video Playlist; Pay to Unlock Post; All monetization methods; All widgets; Poll examples. Classic Poll; Versus Poll; Hot or Not Poll; Paginated Poll ...,0.8934047222137451,2.97361133832263
español,Hyundai Soapbox es un auto de juguete fácil y barato de armar Luis Hernández. 9/18/2020. Muere un hombre baleado por un agente de la Patrulla Fronteriza en la frontera de Texas.,Hace algunos días te platicábamos sobre el nuevo proyecto que traía entre manos Hyundai; un vehículo sin motor de nombre Soapbox...,"Esta es una carrera en grupo. Y si a eso le sumamos que los autos no pueden utilizar un motor, el resto del equipo pasa a ser vital a la hora de impulsar los primeros movimientos del carro.",0.8931638598442078,2.8798738571689158
