word_added,s1,s2,s3,similarity_w,sum_cos
componentes,"En este reportaje, vamos a ver cómo se fabrica un coche, en cuatro pasos. Puede que te interese: 12 inventos que revolucionaron el automóvil. Antes de la puesta en marcha de la cadena de producción para la fabricación de un modelo concreto, numerosas personas han trabajado intensamente para que llegue ese momento.","Los componentes de aluminio han ido tomando un lugar importante en la construcción del automóvil, e incluso marcas como Ford ofrecen en la actualidad vehículos construidos en aluminio de grado militar con una resistencia alta y bajo peso.","La fabricación del automóvil precisa de trabajos previos, durante y después de su construcción, luego los veremos con más detalle. En la animación vemos el concepto de fabricación, es decir acoplar un conjunto de piezas, órganos, elementos y componentes independientes para conformar el automóvil.",0.9988447427749634,0.1553167558718619
diseño,"Tratándose del automóvil la palabra diseño puede estar dada en función de su apa-riencia externa; pero también los elementos que lo constituyen son diseñados, no por artistas sino por ingenieros, aunque en algunos casos este tenga oportunidad de mostrar algo de capacidad artística. Por tanto, el diseño de un automóvil alimentado","El diseño de automóviles, también conocido como diseño automovilístico o diseño de automoción, es la profesión implicada en el desarrollo de un automóvil. Normalmente está referido al diseño de automóviles de turismo, pero normalmente también se refiere a motocicletas, camiones, autobuses y furgonetas. Esta práctica, hoy en día, es llevada a cabo por un gran equipo que reúne diferentes …","La construcción real de vehículo se efectúa en diferentes fases. En la primera se crean vehículos virtuales en 3 dimensiones con dimensiones ideales. En una segunda fase, los primeros prototipos reales suelen fabricarse en un taller especializado para estos propósitos con una línea de producción limitada, en lugar de la fabricarse en la planta final de producción.",0.9985365867614746,0.1538150627878761
vehículo,"Los ocho pasos -y los cuatro años- para engendrar un auto, desde el primer dibujo hasta el lanzamiento oficial.","AUTOS, VEHÍCULOS, TOPS, LOS MEJORES TOPS, IMPRESIONANTE, NO LO CREERÁS, LOS PASOS para un AUTOSIGUENOS EN: https://twitter.com/TuCosmopolisVISITA N...","La construcción real de vehículo se efectúa en diferentes fases. En la primera se crean vehículos virtuales en 3 dimensiones con dimensiones ideales. En una segunda fase, los primeros prototipos reales suelen fabricarse en un taller especializado para estos propósitos con una línea de producción limitada, en lugar de la fabricarse en la planta final de producción.",0.9985058307647705,0.08045638485359634
partes,"La fabricación de un coche se divide, fundamentalmente, en cuatro etapas: prensado, chapistería, pintura y montaje. Vamos a repasar lo que se hace en cada una de estas cuatro etapas. ¿Sabías que en las dos primeras apenas intervienen personas?","La mayor parte de los automóviles actuales están construidos en acero de diferentes calibres, el acero se utiliza para crear el chasis y el cuerpo del vehículo, lo que podríamos relacionar con el esqueleto humano y se encarga de proteger a los ocupantes en un accidente. Puertas, techo y paneles de la carrocería son de acero.","Este material también se lo emplea para formar el chasis subyacente del vehículo o parte del esqueleto del coche, para así proteger a sus ocupantes en caso de un accidente. El peso de un auto proviene principalmente del acero, que en promedio puede contener cerca de 1.350 kg. Las camionetas, por otro lado, llegan a tener alrededor de 1.800 Kg.",0.9983494281768799,0.23869377267183292
sistema,"Proceso de producción A la hora de fabricar un vehículo normalmente se siguen los pasos descritos más abajo. Algunos fabricantes (especialmente de gama alta, ej. BMW) crean en vehículo a partir de la configuración del cliente, en lugar de crear vehículos con diferentes equipamientos, colores y variantes entre los que el cliente pueda elegir.","Esto significa que la planta de ""producción"" de un automóvil es un punto activo de ensamblaje donde trabajadores expertos y sistemas de robot unen todos los componentes necesarios separados para crear el producto final en un proceso de ""a la orden del día"". ... la carrocería se construye como un proceso secundario. ... Estos componentes ...","Se realiza la construcción mecánica y el diseño electrónico del mismo, para que el sistema sea capaz de generar el movimiento controlado de freno, acelerador y embrague de un automóvil ...",0.9982395172119141,0.10289872711686864
construcción,"En este reportaje, vamos a ver cómo se fabrica un coche, en cuatro pasos. Puede que te interese: 12 inventos que revolucionaron el automóvil. Antes de la puesta en marcha de la cadena de producción para la fabricación de un modelo concreto, numerosas personas han trabajado intensamente para que llegue ese momento.","Como se fabrica un automóvil, paso a paso. Como se fabrica un automóvil, paso a paso. Paso 1: Diseño. Folio en blanco. Los diseñadores realizan una media de entre 60 y 80 bocetos de potenciales diseños. ... Se construye un número limitado de unidades de preproducción para iniciar la …","La carrocería autoportante es una técnica de construcción de chasis en la cual la chapa externa del vehículo soporta parte (semi-monocasco) o toda la carga estructural del vehículo, se compone de un conjunto de bastidor y carrocería unidos entre sí remachados o soldados que forman la …",0.9981582760810852,0.05940076087852244
parte,"En este reportaje, vamos a ver cómo se fabrica un coche, en cuatro pasos. Puede que te interese: 12 inventos que revolucionaron el automóvil. Antes de la puesta en marcha de la cadena de producción para la fabricación de un modelo concreto, numerosas personas han trabajado intensamente para que llegue ese momento.","En paralelo se construyen los laterales. Las partes de un chasis de automóvil que más torsión soportan son los anclajes de la transmisión. Construir estas piezas con hojas de aluminio es muy complejo y caro, por eso se utilizan las piezas inyectadas. …","La construcción real de vehículo se efectúa en diferentes fases. En la primera se crean vehículos virtuales en 3 dimensiones con dimensiones ideales. En una segunda fase, los primeros prototipos reales suelen fabricarse en un taller especializado para estos propósitos con una línea de producción limitada, en lugar de la fabricarse en la planta final de producción.",0.9981327056884766,0.05874822928961878
piezas,"¿Sueñas con reconstruir un hotrod clásico pero dudas que puedas pagar las piezas? Si es así, no renuncies a tu sueño de construir un auto genial hasta que visites un depósito de chatarra profesional, uno que te permita elige tus propias piezas de auto, y ofrece una amplia selección de automóviles, incluidos algunos autos antiguos que, si estuvieran en buenas condiciones, se ...","Corte de piezas metálicas. En la segunda etapa del proceso de producción de un automóvil y ya que las piezas se tienen disponibles en cada estación, se realiza el corte de las piezas metálicas que servirán como el armazón del carro, principalmente a través de 4 pasos:. Sitúan en posición las piezas metálicas de chapa plana, a fin de que reciban el estampado del dibujo.","Unas enormes bobinas de acero, con un peso de aproximadamente 20 toneladas, llegan hasta la planta de prensas. Una vez aquí, pasan por un tren de rodillos para que el acero pierda la curvatura y, posteriormente, unas prensas hidráulicas lo cortan a la medida adecuada de la pieza a la que vaya destinada esa lámina o pletina.",0.9981100559234619,0.08226282785024809
automovil,"Los ocho pasos -y los cuatro años- para engendrar un auto, desde el primer dibujo hasta el lanzamiento oficial.","Pues, en este reportaje, resolvemos tus dudas repasando cada una de las cuatro etapas en las que se divide, fundamentalmente, la fabricación de un coche: prensado, chapistería, pintura …","Manijas, tapetes, interruptores, ventilas del aire acondicionado, las bolsas de aire, entre otros, están fabricados de plástico. Este material se lo utiliza mayormente en la manufactura de los coches pues según el American Chemistry Council de Estados Unidos, son durables, baratos de fabricar y se moldean en casi cualquier forma.",0.9980831146240234,0.08336011698685229
principales,"Los ocho pasos -y los cuatro años- para engendrar un auto, desde el primer dibujo hasta el lanzamiento oficial.","Por eso, a continuación Toyocosta te detallará cuáles de estos son los más usados para fabricar un auto. ¿Cuáles materiales son usados para fabricar un vehículo? Acero. Las puertas, el techo y los paneles de la carrocería están hechos de acero. Incluso algunas partes para acomodar el motor, y los escapes son hechos de acero inoxidable.","O lo que es lo mismo, la etapa del proceso de producción de un automóvil que se trata de terminar de “vestir” al carro, la cual, a su vez, se realiza a través de 3 fases principales: Ensamblaje de piezas plásticas que completan la carrocería, tal y como es el parachoques. Instalación de …",0.99801105260849,0.05304028642475109
chasis,About Press Copyright Contact us Creators Advertise Developers Terms Privacy Policy & Safety How YouTube works Test new features Press Copyright Contact us Creators ...,"Diseñar y construir un chasis para un vehículo tipo Formula SAE. OBJETIVOS ESPECÍFICOS: Diseñar un bastidor resistente, seguro y ergonómico para el vehículo de Formula SAE. Desarrollar los sistemas de suspensión, dirección y frenado para garantizar el desempeño dinámico del vehículo.","La introducción de nuevos materiales en la fabricación del chasis es una vía que permite reducir el peso de los vehículos, y en consecuencia las emisiones y el consumo.",0.9979997873306274,0.019007302171627268
gasolina,"Las emanaciones de los vehículos que tragan mucha gasolina, y la asfixia que provoca la contaminación urbana son poderosos argumentos en favor de los vehículos de energía limpia como la mejor solución si deseamos continuar disfrutando de la comodidad, el confort y las ventajas de la movilidad personal.","Esto ocurrió porque en 1879, Georg Balwin Selden registró una patente en Estados Unidos que describía todos y cada uno de los detalles referidos a la construcción de un automóvil. Fue el registro de esta patente lo que ocasionó una especia de bloqueo durante más de 15 años hasta que apareciese el primer coche a gasolina.","Roger comenzó a construir automóviles Benz también, y como resultado, la mayoría de los automóviles Benz se vendieron inicialmente en Francia. En 1897 se dio el desarrollo del “doble motor”, que constaba de dos unidades de un solo cilindro horizontal en paralelo. Sin embargo, no tuvo los resultados esperados.",0.9979129433631897,0.015253492525094033
decir,(CNN) — Ver a un apreciado maestro sustituto viviendo en su automóvil inspiró a un exalumno a intentar ayudar a un hombre que había marcado una diferencia en su vida.,"Cómo construir un automóvil Newton un automóvil newton demuestra la tercera ley de movimiento de newton, es decir, la ley de interacción: para cada acción, hay una reacción igual y opuesta. el auto hace esto arrojando un peso de la espalda, forzándose hacia adelante.","Reconociendo la necesidad de reinventar el automóvil, el presidente de Estados Unidos, Bill Clinton, anunció en 1993 un proyecto conjunto del gobierno y la industria automovilística estadounidenses para diseñar el auto del futuro. Dijo: “Trataremos de poner en marcha el programa tecnológico más ambicioso que jamás haya tenido nuestra nación”.",0.9978779554367065,0.07818745396660408
tiempo,"Desde que Henry Ford instaurase en sus fábricas la cadena de montaje como sistema para la fabricación masiva de vehículos, el proceso ha evolucionado tanto que, hoy en …",¿Cuánto tiempo lleva construir un Toyota? Los vehículos y la importancia que tienen en la vida de una persona. Los coches han sido responsables de muchas cosas en... Introducción al proceso de desarrollo y producción de un Toyota. El proceso de desarrollo y producción de un Toyota se... Producir un ...,Depende qué automóvil por ejemplo: Toyota Corolla - 18 horas. Chevrolet Tahoe - 23 horas. Rolls Royce Wraith - 6 Meses. Bugatti Veyron - 9 meses.,0.9978659749031067,0.17132524801936863
gran,"Desde que el diseñador dibuja hasta que los ingenieros fabriquen en serie, el auto se gesta en un embrión que demora, estimativamente, 1.400 días en nacer.","De forma alterna, prepara el volante sin ensamblar las ruedas para que el conductor opere el volante directamente al jalar una cuerda o la otra para dirigir el automóvil. Pon un freno en la parte trasera del automóvil adhiriendo un brazo hecho de madera a un punto de pivote y un cable al frente del la cabina para jalar hacia abajo, donde un pedazo de madera puede servir como pedal de freno.",Construcción de un automóvil propulsado por bandas elásticas - Santiago Martínez - YouTube. Construcción de un automóvil propulsado por bandas elásticas - Santiago Martínez. Watch later.,0.9978504180908203,0.04559029474730815
dos,"Construir un garaje para dos autos tiene ciertos beneficios: Ahorros, ya que la cantidad de materiales de construcción requeridos se reduce significativamente. Las comunicaciones de colocación se deben hacer solo una vez. Los coches están situados uno junto al otro.","Primero, se pintan los interiores y huecos para después pintar la carrocería por la parte exterior. Después, una ultima capa de laca 2k (dos componentes, laca y catalizador para que esta se seque) es aplicada para introducir la carrocería en el horno de secado.","Dos ex ingenieros de Google construyeron un innovador automóvil, completamente autónomo",0.9978153705596924,0.05012988165471834
trabajo,"PASO 1 – Briefing Las líneas maestras que sujetarán al modelo en el que se está trabajando. Es una hoja de ruta que guiará a la fabricación, en donde se origina el ADN del auto.","La fabricación de automóviles se refiere a la producción industrial de vehículos automóviles en fábricas habilitadas para ello. Es una de las etapas indispensables de la industria automotriz, junto a la comercialización. La fabricación de automóviles requiere un capital humano y financiero muy importante. Dependiendo del tipo de vehículo, la cantidad de unidades a fabricar por …","Trabaja en un espacio bien iluminado y ordenado. Elige una mesa o un área de trabajo donde puedas dejar los componentes del equipo durante un período prolongado de tiempo, ya que la construcción de un automóvil RC tarda unos días en completarse.",0.9978059530258179,0.05654460102805375
forma,"Desde que el diseñador dibuja hasta que los ingenieros fabriquen en serie, el auto se gesta en un embrión que demora, estimativamente, 1.400 días en nacer.","La construcción real de vehículo se efectúa en diferentes fases. En la primera se crean vehículos virtuales en 3 dimensiones con dimensiones ideales. En una segunda fase, los primeros prototipos reales suelen fabricarse en un taller especializado para estos propósitos con una línea de producción limitada, en lugar de la fabricarse en la planta final de producción.","En el primer artículo de esta serie –“Estampación y soldadura”– vimos que la materia prima de un automóvil de serie son bobinas de metal. Este metal es principalmente acero y, a veces, aluminio.Son varias las aleaciones que se utilizan y su espesor varía de unos 0,7 mm a poco más de 2 mm. Estas bobinas se cortan en hojas y se les da en prensas enormes, generalmente en …",0.9977900981903076,0.057444075120126926
básico,"Para construir un chasis de un turismo solo necesitamos moldear unos 300 kg de acero en hojas y unirlos mediante puntos de soldadura. Si partimos de un precio del acero en torno a un euro el kg nos da un coste de unos 300 euros, una ganga; si lo hacemos en aluminio el coste sería el triple, unos 900 euros, muy buen precio para un chasis ligero.","Siguiendo el esquema de montaje construiremos el interior del vehículo, pegando los asientos y demás elementos al chasis con pegamento líquido, procurando aplicarlo con cuidado para que no ataque al plástico y nos arruine la maqueta.","El trabajo está destinado a presentar las etapas que debe llevar un ingeniero para la solución de problemas (Diseño, Construcción, Prueba y Evaluación) enfoc...",0.9977800846099854,0.03925766510555407
elementos,"Desde la tarea más artesanal hasta la faceta más tecnológica, el nacimiento de un nuevo modelo atraviesa ocho etapas, desde el papel y el lápiz hasta las pruebas de utilidad y eficiencia.",Un estudiante de ingeniería no cree que cuatro personas con las especialidades de los Doers puedan hacer un auto con cosas de un supermercado.Toda la energía...,"This is ""Cp 2. Construir un automóvil con elementos de supermercado"" by AC mcgarrybowen on Vimeo, the home for high quality videos and the people who…",0.9977779984474182,0.035516671463343294
motor,"Los ocho pasos -y los cuatro años- para engendrar un auto, desde el primer dibujo hasta el lanzamiento oficial.","Construir un motor de automóvil desde cero, lleva tiempo y paciencia. También deberás tener cerca un mecánico experto que te ayude en esta aventura. Este proyecto implica más que unir piezas. Según el tipo de motor, existen diferentes tolerancias y aprietes sobre las tuercas y pernos, que deben mantenerse.","Constructor de Carros viene con un diseño limpio y ordenado y la interfaz es muy fácil de usar y el juego es tan fácil de aprender que sus hijos tendrán una idea completa después de construir y ajustar algunos carros en la fábrica de automóviles del mundo del motor. Para comenzar y construir un automóvil, primero seleccione un vehículo y luego arrastre y suelte diferentes partes del vehículo en sus lugares …",0.9977741241455078,0.07974551925881308
así,"Así, con tres piezas casi, casi tenemos el automóvil montado. Gracias a las imágenes sobre estas líneas se comprende que es más recomendable construir todo el lateral de una pieza, pues simplifica su montaje.","En esta planta se construye un coche completamente, desde cero. En Sunderland se producen aproximadamente 120 coches por hora (sí, sí, 120 cada hora, del orden de un coche cada minuto por cada ...","Por fin tenemos el diseño de nuestro vehículo, lo hicimos en una servilleta, la pasamos a ordenador y generamos un modelo en tres dimensiones. Pese a que adelantan mucho los sistemas de simulación en 3D siempre se acaba construyendo un modelo en arcilla para comprobar el aspecto final.",0.9977539777755737,0.02856123585823782
ruedas,"Inventa un increíble automóvil de tres ruedas que gira sobre su propio eje Por Caro Rosales El sueño de muchos hombres tal vez sea diseñar su propio automóvil, mientras que unos lo harían deportivo y ultra rápido, otros se irían más por el lado de lo ingenioso y útil, como este hombre que inventó un asombroso auto de tres que gira sobre su propio eje.","De forma alterna, prepara el volante sin ensamblar las ruedas para que el conductor opere el volante directamente al jalar una cuerda o la otra para dirigir el automóvil. Pon un freno en la parte trasera del adhiriendo un brazo hecho de madera a un punto de pivote y un cable al frente del la cabina para jalar hacia abajo, donde un pedazo de madera puede servir como pedal de freno.",Construir un auto RC de cero 1. Corta un armazón de láminas de plástico Lexan. Lexan es un plástico grueso que es una excelente base para un... 2. Fija las ruedas de un viejo coche de juguete a la parte delantera del armazón. Quita las ruedas de 5 centímetros (2... 3. Fabrica un componente de ...,0.9977415204048157,0.08869395871002352
conjunto,"Los ocho pasos -y los cuatro años- para engendrar un auto, desde el primer dibujo hasta el lanzamiento oficial.",Construcción de un automóvil propulsado por bandas elásticas - Santiago Martínez - YouTube. Construcción de un automóvil propulsado por bandas elásticas - Santiago Martínez. Watch later.,Estos son seguidos por procesos de fabricación y procedimientos para construir el automóvil. El software necesitaba ser sofisticado para detectar errores de forma fácil y rápida en las primeras etapas del proceso de diseño y permitir al equipo realizar modificaciones de diseño sin afectar todo el conjunto.,0.9977315664291382,0.029498548222332124
puede,"Desde que el diseñador dibuja hasta que los ingenieros fabriquen en serie, el auto se gesta en un embrión que demora, estimativamente, 1.400 días en nacer.","La fabricación de automóviles se refiere a la producción industrial de vehículos automóviles en fábricas habilitadas para ello. Es una de las etapas indispensables de la industria automotriz, junto a la comercialización. La fabricación de automóviles …","Las pruebas de simulación y un mecanismo de verificación bien diseñado son la clave para construir un vehículo autónomo seguro. Un informe de 2018 que demuestra la confiabilidad de los vehículos autónomos calcula que se necesitarían 8.8 mil millones de millas, con una flota de 100 vehículos que se prueban las 24 horas del día, los 365 días del año, a una velocidad promedio de 25 millas por hora.",0.9977246522903442,0.06757926790113802
realizar,"Aunque la tecnología sea determinante, aún se valora el trabajo artesanal en la fase de creación. Cuatro años de trabajo, 1.400 días calendario, mil bocetos analizados, cinco mil …","La siguiente operación se realiza en los bajos del coche con la colocación de tubos de frenos y combustible. El coche ya está listo para recibir el motor. Cuando la mecánica llega hasta la carrocería para ser montada en el vehículo, ya tiene acoplados elementos como el sistema de escape, transmisión, eje trasero o columna de dirección.","Diablo-Caliente : Como se fabrica un automóvil, paso a paso. Paso 1: Diseño Folio en blanco. Los diseñadores realizan una media de entre 60 y 80 bocetos...",0.9977083802223206,0.027748625664523876
debe,"Los ocho pasos -y los cuatro años- para engendrar un auto, desde el primer dibujo hasta el lanzamiento oficial.","La fabricación de automóviles se refiere a la producción industrial de vehículos automóviles en fábricas habilitadas para ello. Es una de las etapas indispensables de la industria automotriz, junto a la comercialización. La fabricación de automóviles requiere un capital humano y …","INSTRUCCIONES PARA LA CONSTRUCCIÓN DEL AUTOMÓVIL: 1) Tomar una botella plástica y con ayuda de un bisturí que debe ser manipulado por el docente y/o adulto responsable, se realiza un corte de arriba hacia abajo por uno de los lados de la botella, esta será la parte superior del automóvil.",0.9977037310600281,0.0
cualquier,"Desde que el diseñador dibuja hasta que los ingenieros fabriquen en serie, el auto se gesta en un embrión que demora, estimativamente, 1.400 días en nacer.","INSTRUCCIONES PARA LA CONSTRUCCIÓN DEL AUTOMÓVIL: 1) Tomar una botella plástica y con ayuda de un bisturí que debe ser manipulado por el docente y/o adulto responsable, se realiza un corte de arriba hacia abajo por uno de los lados de la botella, esta será la parte superior del automóvil.",Recorta una tira delgada de plástico Lexan que tenga la misma longitud que la distancia entre las bisagras de la rueda. Taladra un pequeño agujero a través de la parte posterior de las bisagras y la tira que acabas de cortar. Coloca un pequeño perno a través de cada orificio para que la tira permanezca en su lugar.,0.9976801872253418,0.019087142452151238
arquitectura,"Desde que el diseñador dibuja hasta que los ingenieros fabriquen en serie, el auto se gesta en un embrión que demora, estimativamente, 1.400 días en nacer.","Automóviles y Arquitectura. “El verdadero progreso es el que pone la tecnología al alcance de todos”. Esta frase la firma Henry Ford , icono del progreso americano entre los años 20 y 30. El 1910 Henry Ford revolucionó para siempre el mundo del automóvil produciéndolos …","El proceso de diseño de un coche explicado en ocho pasos. Jorge Arenas. 13/06/2016 - 16:25. Aunque a veces pueda parecer fácil, diseñar un nuevo modelo es una tarea que exige un …",0.9976505637168884,0.0
mantenimiento,Durante las tareas de mantenimiento correctivo tienen cabida las reparaciones o sustituciones de aquellos componentes del vehículo que han dejado de funcionar o ya no lo hacen adecuadamente. Beneficios del correctivo. Los requerimientos del de emergencia son reducidos. La disponibilidad de la planta es aumentada.,"un video rápido de un mantenimiento completo automotriz, llevan más de 20 puntos de revisión...","Según las estadísticas, un mantenimiento planificado mejora en un 25% la productividad del automóvil, reduce en un 30% los costos y la vida útil es alargada hasta en un 50%. Entre los “trabajos” que se deben realizar frecuentemente al vehículo para así evitar la aparición de diversas fallas, encontramos los siguientes:",0.9976354241371155,0.0767996987368631
