word_added,s1,s2,s3,similarity_w,sum_cos
dirección,Sistema de dirección de un automóvil con suspensión MacPherson diseñada en SolidWorks,"El objetivo principal de este proyecto es diseñar, validar y construir el sistema de dirección del vehículo del Equipo CREVE. Se trata de un vehículo eléctrico ligero construido (íntegramente por el equipo) en las instalaciones del CREVE y que, posteriormente, participará en el evento ElectroCat 2018.","En este artículo se ha presentado un sistema de dirección a las cuatro ruedas totalmente mecánico para un vehículo automóvil. Frente a los sistemas electrónico-hidraúlicos, que son más versátiles, este sistema aporta mayor robustez y fiabilidad. El empleo de …",0.9976239204406738,0.3110684899150038
mecánico,Juega el último juego de fábrica de un fabricante de automóviles deportivos y disfruta del exclusivo juego de construcción de automóviles de los juegos mecánicos automotrices. Combine varias piezas de automóvil mediante la soldadura y el montaje de todo el chasis con bonete; coloque las puertas del automóvil y las llantas de aleación moviéndose sobre la cinta transportadora.,Modelado matemático de un sistema mecánico de automóvil - YouTube. Modelado matemático de un sistema mecánico de automóvil. Watch later. Share. Copy link. Info. Shopping. Tap to unmute. If ...,"De acuerdo con los creadores y los videos del proceso de construcción, el vehículo se basó en un chasis hecho de tubos soldados entre sí; la carrocería está hecha de láminas de metal ...",0.9976056814193726,0.10782542781411547
materiales,"Manijas, tapetes, interruptores, ventilas del aire acondicionado, las bolsas de aire, entre otros, están fabricados de plástico. Este material se lo utiliza mayormente en la manufactura de los coches pues según el American Chemistry Council de Estados Unidos, son durables, baratos de fabricar y se moldean en casi cualquier forma.","¿De qué material se construyen los autos? Acero. La mayor parte de los automóviles actuales están construidos en acero de diferentes calibres, el acero se utiliza... Plástico. El plástico es un material que ha tomado fuerza en todas las industrias, por sus características técnicas y...","Aunque la tecnología sea determinante, aún se valora el trabajo artesanal en la fase de creación. Cuatro años de trabajo, 1.400 días calendario, mil bocetos analizados, cinco mil kilos …",0.9975848197937012,0.10633775643665105
fabricación,"La fabricación de automóviles se refiere a la producción industrial de vehículos automóviles en fábricas habilitadas para ello. Es una de las etapas indispensables de la industria automotriz, junto a la comercialización.La fabricación de automóviles requiere un capital humano y financiero muy importante.. Dependiendo del tipo de vehículo, la cantidad de unidades a fabricar por …","En este reportaje, vamos a ver cómo se fabrica un coche, en cuatro pasos. Puede que te interese: 12 inventos que revolucionaron el automóvil. Antes de la puesta en marcha de la cadena de producción para la fabricación de un modelo concreto, numerosas personas han trabajado intensamente para que llegue ese momento.","La funcionalidad y la ergonomía interior se consiguen gracias a un simulador de realidad en 3D. Manos a la obra. Se construye un número limitado de unidades de preproducción para iniciar la fase de ensayos. Aerodinámica. 130 horas de pruebas en el túnel de viento, a …",0.9975578784942627,0.07070579562061552
aire,La cantidad de aire necesaria para efectuar la ventilación puede depender entre otros factores de: - Las dimensiones del habitáculo del vehículo. - Calor a disipar o carga térmica. - Granulometría de los sólidos a transportar. Las renovaciones de aire hasta un número de ocho veces a la,"Aire comprimido en el sector del automóvil La industria automovilística abarca los más diversos ámbitos de aplicación, desde la fabricación de piezas individuales, pasando por la construcción de vehículos enteros hasta la reparación en talleres. Los ámbitos de …","Un método de construcción antiguo consistía en disponer los tubos del radiador en forma de panal de abeja, dando forma de hexágonos en sus extremos a un conjunto de tubos cilíndricos, posteriormente apilados y soldados.",0.9975396394729614,0.06583661940593215
proceso,"Aunque la tecnología sea determinante, aún se valora el trabajo artesanal en la fase de creación. Cuatro años de trabajo, 1.400 días calendario, mil bocetos analizados, cinco mil …","14 fotos La planta de montaje es la que une todas las piezas del puzzle. Esta es la última etapa del proceso de fabricación de un coche. Aquí se unen la carrocería, el conjunto motopropulsor y el resto de elementos que conforman el coche. Curiosamente, lo primero que se hace en el área de montaje es desmontar las puertas.",Paso 1: Diseño. Folio en blanco. Los diseñadores realizan una media de entre 60 y 80 bocetos de potenciales diseños. Pies de barro. Se moldean en arcilla ocho modelos a tamaño real. Simulaciones. Recreaciones virtuales permiten simular más de 5.000 crash-tests para evaluar los daños sobre la carrocería.,0.9975371360778809,0.04316163728651219
motores,"Los ocho pasos -y los cuatro años- para engendrar un auto, desde el primer dibujo hasta el lanzamiento oficial.","Construir un motor de automóvil desde cero, lleva tiempo y paciencia. También deberás tener cerca un mecánico experto que te ayude en esta aventura. Este proyecto implica más que unir piezas. Según el tipo de motor, existen diferentes tolerancias y aprietes sobre las tuercas y pernos, que deben mantenerse.","Comenzamos con 22 estudiantes entusiastas y logramos desarrollar y construir un automóvil desde cero. Además, la mayoría de nuestros socios no pertenecen a la industria automotriz, por lo que tampoco es un requisito.",0.9975318908691406,0.0673850872131784
sistemas,"Desde que el diseñador dibuja hasta que los ingenieros fabriquen en serie, el auto se gesta en un embrión que demora, estimativamente, 1.400 días en nacer.","A medida de que progresa el armazón, el carro se construye literalmente ""del armazón hacia arriba"" para crear el producto final. Las partes que son aplicadas en secuencia al chasis incluyen el motor, la suspensión trasera y delantera, el tanque de gasolina, los soportes medios la parte trasera, el árbol motor, la caja de engranes, la caja del volante, las cajas de las poleas y el sistema de frenado.","La construcción real de vehículo se efectúa en diferentes fases. En la primera se crean vehículos virtuales en 3 dimensiones con dimensiones ideales. En una segunda fase, los primeros prototipos reales suelen fabricarse en un taller especializado para estos propósitos con una línea de producción limitada, en lugar de la fabricarse en la planta final de producción.",0.9975125789642334,0.015376756527525973
esenciales,"Los 8 pasos esenciales para crear un auto 13 de Junio de 2016 Aunque la tecnología sea determinante, aún se valora el trabajo artesanal en la fase de creación.","Apperson la construcción de un automóvil según sus indicaciones. Años después, Haynes reclama para sí mismo haber sido el primer fabricante de Estados Unidos, cuestionando este hecho a Frank Duryea. 1894. En Detroit, Charles B. King presenta en público su automóvil con motor de cuatro cilindros. Este vehículo, que en su tiempo no supera el","Un automóvil, también denominado coche, carro, auto, etc; es un vehículo motorizado con ruedas utilizado para el transporte. La mayoría de las definiciones de automóvil, hacen referencia a los vehículos que circulan principalmente por las carreteras, con capacidad de uno a ocho personas, cuentan con cuatro neumáticos y transportan principalmente a personas, antes que mercaderías. El automóvil …",0.9975069165229797,0.14003473860555898
mecánica,"Si te encantan la mecánica y los automóviles, te encantará Taz Mechanic Simulator, este juego es absorbente y te permite construir un automóvil prácticamente desde cero. Puedes agregar todas las diferentes partes del vehículo, como bastidor, bobinas, neumáticos, motor y paneles.","La carrocería autoportante es una técnica de construcción de chasis en la cual la chapa externa del vehículo soporta parte (semi-monocasco) o toda la carga estructural del vehículo, se compone de un conjunto de bastidor y carrocería unidos entre sí remachados o soldados que forman la …","El automóvil solía fabricarse con un o estructura metálica sobre la que se disponía la bastidor carrocería. El bastidor lo constituían una serie de vigas formando una celosía, la cual no se fabricaba pensando en la posible formación provocada por un accidente, sino con el fin de de soportar los",0.9975056648254395,0.2122261148733171
poder,Construcción de un automóvil propulsado por bandas elásticas - Santiago Martínez - YouTube. Construcción de un automóvil propulsado por bandas elásticas - Santiago Martínez. Watch later.,"Además de realizar un test similar al que hacen las ITV con el sistema de frenado, pero mucho más exigente, que deberá superar para poder pasar a la siguiente fase. En la siguiente fase, se realizan 2 pruebas: la de lluvia, que consiste en detectar posibles entradas de agua al habitáculo por algún mal ajuste y, si existe, tratar de arreglarlo.","Estos deben de poder ensamblarse y reemplazarse de forma ergonómica, deben de tener un coste asequible y deben de poder ensamblarse sin problemas mediante la definición de tolerancias. La construcción real de vehículo se efectúa en diferentes fases. En la primera se crean vehículos virtuales en 3 dimensiones con dimensiones ideales.",0.9974896907806396,0.059072801960318846
control,"Hola amigos, en este vídeo haremos un coche casero a control remoto.Sígueme en Facebook https://www.facebook.com/Muyfacildehacer.MFH Materiales- aquí aprende...","Hacer tu propio auto RC te permite personalizar opciones, como el color de la pintura, el motor y la máquina, para que puedas construir un auto de juguete único que puedas controlar. Si bien muchas personas construyen autos RC a partir de equipos preempacados, ¡también puedes comprar componentes electrónicos separados y hacer un armazón casero de plástico!","El primer paso en la construcción de un coche de control remoto es crear la estructura. Adjunta una placa rectangular de acero de un pie (30 cm) de largo por 6 pulgadas(15 cm) de ancho con dos ejes pequeños. El eje delantero debe tener puntas pivotantes, que permitirán a los neumáticos delanteros del coche girar a la izquierda o a la derecha.",0.9974850416183472,0.10579053207396716
posible,Sería posible diseñar y construir un automóvil con propulsión solar de tamaño estándar,"Respuesta:Si, es posible Explicación:Debido que el panel solar puede producir energía y con esa energía se podría manejar el automóvil","Sería posible diseñar y construir un automóvil con propulsión solar de tamaño estándar. Física, 16.10.2020 14:28, solangebordon.",0.9974772930145264,0.802839705937054
manera,"Los ocho pasos -y los cuatro años- para engendrar un auto, desde el primer dibujo hasta el lanzamiento oficial. Los encargados de elegir colores y texturas suelen evaluar diseños durante dos ...","La fabricación de un coche se divide, fundamentalmente, en cuatro etapas: prensado, chapistería, pintura y montaje. Vamos a repasar lo que se hace en cada una de estas cuatro etapas. ¿Sabías que en las dos primeras apenas intervienen personas?","A la hora de fabricar un vehículo normalmente se siguen los pasos descritos más abajo. Algunos fabricantes (especialmente de gama alta, ej. BMW) crean en vehículo a partir de la configuración del cliente, en lugar de crear vehículos con diferentes equipamientos, colores y variantes entre los que el cliente pueda elegir.",0.9974584579467773,0.17693927123047515
potencia,COMO CONSTRUIR AUTO RATONERA O DE ENERGÍA POTENCIAL. El proyecto del coche con trampa para ratones es un desafío de física clásico: construye un vehículo que pueda viajar lo más lejos o lo más rápido posible usando solo la energía que se …,"un Sistema de Potencia Hidráulico a diseñar. PASO 1.- IDENTIFICACIÓN DEL CLIENTE. El Diseño de un Sistema de Potencia Hidráulico (Motor Híbrido) va enfocado a satisfacer necesidades a usuarios de un transporte que sea Económico en el combustible, a demás de Innovar un producto con Tecnología Ecológica. Creemos","El récord de velocidad terrestre de 200 mph (322 kilómetros por hora) establecido en 1927 por el Sunbeam 1000HP, había sido superado por sus rivales en 1929, y la compañía decidió construir un automóvil capaz de alcanzar las 250 mph (402 kilómetros por hora) para recuperarlo. Solo los motores aeronáuticos ofrecían suficiente potencia para acometer este reto, y se contaba con que un automóvil …",0.9974396228790283,0.0552014623943035
utiliza,"Desde que el diseñador dibuja hasta que los ingenieros fabriquen en serie, el auto se gesta en un embrión que demora, estimativamente, 1.400 días en nacer.","La mayor parte de los automóviles actuales están construidos en acero de diferentes calibres, el acero se utiliza para crear el chasis y el cuerpo del vehículo, lo que podríamos relacionar con el esqueleto humano y se encarga de proteger a los ocupantes en un accidente. Puertas, techo y paneles de la carrocería son de acero.","Manijas, tapetes, interruptores, ventilas del aire acondicionado, las bolsas de aire, entre otros, están fabricados de plástico. Este material se lo utiliza mayormente en la manufactura de los coches pues según el American Chemistry Council de Estados Unidos, son durables, baratos de fabricar y se moldean en casi cualquier forma.",0.9974356889724731,0.013197191133192338
transmisión,"cÁlculo y diseÑo de la transmisiÓn de un automÓvil resumen 3– CÁLCULOS En primer lugar, procederemos al cálculo de las fuerzas resistentes que se encuentra","Se denomina transmisión mecánica a un mecanismo encargado de transmitir potencia entre dos o más elementos dentro de una máquina. [1] Son parte fundamental de los elementos u órganos de una máquina, muchas veces clasificados en uno unas cuantas de chicas semi de los dos subgrupos fundamentales, los elementos de transmisión propiamente dichos y los elementos de sujeción.",El sistema de transmisión permite que llegue a las ruedas motrices la potencia y movimiento necesarios para funcionar El sistema de transmisión de un vehículo consiste en una serie de componentes encargados de conducir desde el cigüeñal la potencia suficiente para que las ruedas motrices giren .,0.9974237680435181,0.11099997735018384
eléctrico,En este primer vídeo les comentamos los primeros pasos para Convertir su Auto en EléctricoSi desean adquirir el e-book Conveirte tu Auto en vayan a...,"Un grupo de estudiantes se dio a la tarea de construir un automóvil eléctrico hecho con materiales reciclables como plásticos o desechos domésticos. El proyecto del automóvil eléctrico -al cual bautizaron como Luca- estuvo a cargo de estudiantes de la Universidad Tecnológica de Eindhoven en Holanda , una de las 200 mejores universidades del mundo.","Como hacer un AUTOMOVIL ELECTRICO PARA NIÑOS. Un automóvil eléctrico Que puede remolcar un carrito de cuatro ruedas es un juguete que deleitara una Cualquier niño y Puede ser que muy Fácilmente un muy poco costo.El , accionado por un motor de los lados para el arranque de au­tos, alcanza velocidades de 10 a 12 kms. por hora y puede re­molcar …",0.9974157810211182,0.04867299645833834
combustible,"Reinventar el automóvil: ¿Qué se necesita para fabricar un motor limpio? Junio de 2009. Nuestra pasión por los autos pulidos y lustrados de alto rendimiento, y nuestra dependencia del transporte motorizado está planteando a la sociedad un grave problema.",En 1885 se crea el primer vehículo automóvil por motor de combustión interna con gasolina. El francés Nicolas-Joseph Cugnot (1725-1804) construyó un automóvil de vapor que circuló por ...,"En 1892 el pintor Joen Cederholm y su hermano André, herrero de profesión, diseñaron y construyeron un coche de dos asientos. En 1894 añadieron un condensador. Su iniciativa no tuvo éxito.",0.9974111914634705,0.07512831660707622
cuatro,"La fabricación de un coche se divide, fundamentalmente, en cuatro etapas: prensado, chapistería, pintura y montaje. Vamos a repasar lo que se hace en cada una de estas cuatro etapas. ¿Sabías que en las dos primeras apenas intervienen personas?","Los ocho pasos -y los cuatro años- para engendrar un auto, desde el primer dibujo hasta el lanzamiento oficial. Los encargados de elegir colores y texturas suelen evaluar diseños durante dos ...","Continuando con sus experimentos mecánicos, al poco tiempo construyó un automóvil de cuatro ruedas, con una palanca de dirección, correa de transmisión y caja de cuatro velocidades. Con este alcanzaba a desarrollar dieciocho kilómetros por hora, y para …",0.9974106550216675,0.14301376701969978
